Data,Dia,Vazao,DataCompleta,Ano,Mes
01/12/2023,1,16.3127,2023-12-01,2023,12
01/11/2023,1,24.1566,2023-11-01,2023,11
01/10/2023,1,12.6385,2023-10-01,2023,10
01/09/2023,1,16.3127,2023-09-01,2023,9
01/08/2023,1,15.6793,2023-08-01,2023,8
01/07/2023,1,18.9266,2023-07-01,2023,7
01/06/2023,1,24.1566,2023-06-01,2023,6
01/05/2023,1,30.5659,2023-05-01,2023,5
01/04/2023,1,44.7726,2023-04-01,2023,4
01/03/2023,1,47.0067,2023-03-01,2023,3
01/02/2023,1,72.5509,2023-02-01,2023,2
01/01/2023,1,161.9923,2023-01-01,2023,1
01/12/2022,1,16.3127,2022-12-01,2022,12
01/11/2022,1,16.3127,2022-11-01,2022,11
01/10/2022,1,23.7951,2022-10-01,2022,10
01/09/2022,1,10.0915,2022-09-01,2022,9
01/08/2022,1,11.2004,2022-08-01,2022,8
01/07/2022,1,13.8291,2022-07-01,2022,7
01/06/2022,1,15.995,2022-06-01,2022,6
01/05/2022,1,19.5996,2022-05-01,2022,5
01/04/2022,1,56.768,2022-04-01,2022,4
01/03/2022,1,37.0313,2022-03-01,2022,3
01/02/2022,1,63.4152,2022-02-01,2022,2
01/01/2022,1,55.8126,2022-01-01,2022,1
01/12/2021,1,14.4718,2021-12-01,2021,12
01/11/2021,1,24.5783,2021-11-01,2021,11
01/10/2021,1,10.6666,2021-10-01,2021,10
01/09/2021,1,9.3072,2021-09-01,2021,9
01/08/2021,1,11.2271,2021-08-01,2021,8
01/07/2021,1,12.9637,2021-07-01,2021,7
01/06/2021,1,17.6458,2021-06-01,2021,6
01/05/2021,1,16.3516,2021-05-01,2021,5
01/04/2021,1,24.2142,2021-04-01,2021,4
01/03/2021,1,39.6527,2021-03-01,2021,3
01/02/2021,1,23.8519,2021-02-01,2021,2
01/01/2021,1,40.842,2021-01-01,2021,1
01/12/2020,1,24.8848,2020-12-01,2020,12
01/11/2020,1,9.0426,2020-11-01,2020,11
01/10/2020,1,8.0097,2020-10-01,2020,10
01/09/2020,1,8.521,2020-09-01,2020,9
01/08/2020,1,9.8437,2020-08-01,2020,8
01/07/2020,1,12.3758,2020-07-01,2020,7
01/06/2020,1,15.7167,2020-06-01,2020,6
01/05/2020,1,17.3192,2020-05-01,2020,5
01/04/2020,1,29.8576,2020-04-01,2020,4
01/03/2020,1,117.4941,2020-03-01,2020,3
01/02/2020,1,21.6642,2020-02-01,2020,2
01/01/2020,1,15.4023,2020-01-01,2020,1
01/12/2019,1,13.5604,2019-12-01,2019,12
01/11/2019,1,12.6686,2019-11-01,2019,11
01/10/2019,1,10.6666,2019-10-01,2019,10
01/09/2019,1,10.1156,2019-09-01,2019,9
01/08/2019,1,8.521,2019-08-01,2019,8
01/07/2019,1,10.3899,2019-07-01,2019,7
01/06/2019,1,12.6686,2019-06-01,2019,6
01/05/2019,1,15.7167,2019-05-01,2019,5
01/04/2019,1,20.3287,2019-04-01,2019,4
01/03/2019,1,43.889,2019-03-01,2019,3
01/02/2019,1,15.995,2019-02-01,2019,2
01/01/2019,1,24.5783,2019-01-01,2019,1
01/12/2018,1,43.4493,2018-12-01,2018,12
01/11/2018,1,10.1156,2018-11-01,2018,11
01/10/2018,1,7.758,2018-10-01,2018,10
01/09/2018,1,6.3039,2018-09-01,2018,9
01/08/2018,1,5.6148,2018-08-01,2018,8
01/07/2018,1,7.0186,2018-07-01,2018,7
01/06/2018,1,8.0097,2018-06-01,2018,6
01/05/2018,1,9.0426,2018-05-01,2018,5
01/04/2018,1,12.0852,2018-04-01,2018,4
01/03/2018,1,29.4695,2018-03-01,2018,3
01/02/2018,1,32.2208,2018-02-01,2018,2
01/01/2018,1,37.8676,2018-01-01,2018,1
01/12/2017,1,15.09,2017-12-01,2017,12
01/11/2017,1,13.8621,2017-11-01,2017,11
01/10/2017,1,12.9637,2017-10-01,2017,10
01/09/2017,1,8.2641,2017-09-01,2017,9
01/08/2017,1,9.0426,2017-08-01,2017,8
01/07/2017,1,10.9457,2017-07-01,2017,7
01/06/2017,1,12.9637,2017-06-01,2017,6
01/05/2017,1,14.1659,2017-05-01,2017,5
01/04/2017,1,14.4718,2017-04-01,2017,4
01/03/2017,1,18.9266,2017-03-01,2017,3
01/02/2017,1,20.6726,2017-02-01,2017,2
01/01/2017,1,15.4023,2017-01-01,2017,1
01/12/2016,1,36.7028,2016-12-01,2016,12
01/11/2016,1,11.7688,2016-11-01,2016,11
01/10/2016,1,8.2641,2016-10-01,2016,10
01/09/2016,1,12.3758,2016-09-01,2016,9
01/08/2016,1,10.9457,2016-08-01,2016,8
01/07/2016,1,14.1659,2016-07-01,2016,7
01/06/2016,1,15.4023,2016-06-01,2016,6
01/05/2016,1,17.9743,2016-05-01,2016,5
01/04/2016,1,31.0319,2016-04-01,2016,4
01/03/2016,1,54.9935,2016-03-01,2016,3
01/02/2016,1,47.4577,2016-02-01,2016,2
01/01/2016,1,19.939,2016-01-01,2016,1
01/12/2015,1,42.2396,2015-12-01,2015,12
01/11/2015,1,8.2641,2015-11-01,2015,11
01/10/2015,1,7.758,2015-10-01,2015,10
01/09/2015,1,7.0186,2015-09-01,2015,9
01/08/2015,1,7.5088,2015-08-01,2015,8
01/07/2015,1,9.0426,2015-07-01,2015,7
01/06/2015,1,10.9457,2015-06-01,2015,6
01/05/2015,1,12.3758,2015-05-01,2015,5
01/04/2015,1,29.4695,2015-04-01,2015,4
01/03/2015,1,12.7537,2015-03-01,2015,3
01/02/2015,1,22.0315,2015-02-01,2015,2
01/01/2015,1,13.1068,2015-01-01,2015,1
01/10/2014,1,,2014-10-01,2014,10
01/09/2014,1,,2014-09-01,2014,9
01/08/2014,1,,2014-08-01,2014,8
01/07/2014,1,,2014-07-01,2014,7
01/06/2014,1,,2014-06-01,2014,6
01/05/2014,1,9.9942,2014-05-01,2014,5
01/04/2014,1,10.3326,2014-04-01,2014,4
01/03/2014,1,12.0529,2014-03-01,2014,3
01/02/2014,1,13.8179,2014-02-01,2014,2
01/01/2014,1,25.9693,2014-01-01,2014,1
01/12/2013,1,73.6493,2013-12-01,2013,12
01/11/2013,1,15.2595,2013-11-01,2013,11
01/10/2013,1,18.5907,2013-10-01,2013,10
01/09/2013,1,12.7537,2013-09-01,2013,9
01/08/2013,1,18.2149,2013-08-01,2013,8
01/07/2013,1,22.0315,2013-07-01,2013,7
01/06/2013,1,27.9796,2013-06-01,2013,6
01/05/2013,1,26.7702,2013-05-01,2013,5
01/04/2013,1,34.1617,2013-04-01,2013,4
01/03/2013,1,45.3511,2013-03-01,2013,3
01/02/2013,1,125.794,2013-02-01,2013,2
01/01/2013,1,19.3463,2013-01-01,2013,1
01/12/2012,1,17.4675,2012-12-01,2012,12
01/11/2012,1,12.4024,2012-11-01,2012,11
01/10/2012,1,12.4024,2012-10-01,2012,10
01/09/2012,1,14.8967,2012-09-01,2012,9
01/08/2012,1,18.2149,2012-08-01,2012,8
01/07/2012,1,23.5928,2012-07-01,2012,7
01/06/2012,1,23.5928,2012-06-01,2012,6
01/05/2012,1,43.1567,2012-05-01,2012,5
01/04/2012,1,37.1184,2012-04-01,2012,4
01/03/2012,1,35.002,2012-03-01,2012,3
01/02/2012,1,66.8359,2012-02-01,2012,2
01/01/2012,1,102.0149,2012-01-01,2012,1
01/12/2011,1,21.6442,2011-12-01,2011,12
01/11/2011,1,15.2595,2011-11-01,2011,11
01/10/2011,1,12.0529,2011-10-01,2011,10
01/09/2011,1,14.8967,2011-09-01,2011,9
01/08/2011,1,18.5907,2011-08-01,2011,8
01/07/2011,1,23.2007,2011-07-01,2011,7
01/06/2011,1,26.3692,2011-06-01,2011,6
01/05/2011,1,28.7911,2011-05-01,2011,5
01/04/2011,1,43.594,2011-04-01,2011,4
01/03/2011,1,57.0558,2011-03-01,2011,3
01/02/2011,1,64.9521,2011-02-01,2011,2
01/01/2011,1,62.1446,2011-01-01,2011,1
01/12/2010,1,18.5907,2010-12-01,2010,12
01/11/2010,1,20.8732,2010-11-01,2010,11
01/10/2010,1,17.4675,2010-10-01,2010,10
01/09/2010,1,12.7537,2010-09-01,2010,9
01/08/2010,1,16.3569,2010-08-01,2010,8
01/07/2010,1,19.3463,2010-07-01,2010,7
01/06/2010,1,,2010-06-01,2010,6
01/05/2010,1,30.0159,2010-05-01,2010,5
01/04/2010,1,38.3986,2010-04-01,2010,4
01/03/2010,1,38.3986,2010-03-01,2010,3
01/02/2010,1,46.677,2010-02-01,2010,2
01/01/2010,1,172.5149,2010-01-01,2010,1
01/12/2009,1,47.1204,2009-12-01,2009,12
01/11/2009,1,25.9693,2009-11-01,2009,11
01/10/2009,1,22.0315,2009-10-01,2009,10
01/09/2009,1,18.5907,2009-09-01,2009,9
01/08/2009,1,21.6442,2009-08-01,2009,8
01/07/2009,1,29.6066,2009-07-01,2009,7
01/06/2009,1,30.0159,2009-06-01,2009,6
01/05/2009,1,38.3986,2009-05-01,2009,5
01/04/2009,1,157.8385,2009-04-01,2009,4
01/03/2009,1,65.4222,2009-03-01,2009,3
01/02/2009,1,72.5509,2009-02-01,2009,2
01/01/2009,1,109.9835,2009-01-01,2009,1
01/12/2008,1,23.5928,2008-12-01,2008,12
01/11/2008,1,27.9796,2008-11-01,2008,11
01/10/2008,1,16.7257,2008-10-01,2008,10
01/09/2008,1,13.8179,2008-09-01,2008,9
01/08/2008,1,15.6238,2008-08-01,2008,8
01/07/2008,1,20.8732,2008-07-01,2008,7
01/06/2008,1,25.1726,2008-06-01,2008,6
01/05/2008,1,36.6934,2008-05-01,2008,5
01/04/2008,1,38.3986,2008-04-01,2008,4
01/03/2008,1,57.0558,2008-03-01,2008,3
01/02/2008,1,64.0138,2008-02-01,2008,2
01/01/2008,1,16.7257,2008-01-01,2008,1
01/12/2007,1,13.8179,2007-12-01,2007,12
01/11/2007,1,13.8179,2007-11-01,2007,11
01/10/2007,1,9.9942,2007-10-01,2007,10
01/09/2007,1,11.3591,2007-09-01,2007,9
01/08/2007,1,15.2595,2007-08-01,2007,8
01/07/2007,1,17.0959,2007-07-01,2007,7
01/06/2007,1,22.0315,2007-06-01,2007,6
01/05/2007,1,24.3805,2007-05-01,2007,5
01/04/2007,1,30.4262,2007-04-01,2007,4
01/03/2007,1,42.2843,2007-03-01,2007,3
01/02/2007,1,153.033,2007-02-01,2007,2
01/01/2007,1,83.1795,2007-01-01,2007,1
01/12/2006,1,62.611,2006-12-01,2006,12
01/11/2006,1,9.658,2006-11-01,2006,11
01/10/2006,1,10.3326,2006-10-01,2006,10
01/09/2006,1,9.9942,2006-09-01,2006,9
01/08/2006,1,11.7051,2006-08-01,2006,8
01/07/2006,1,14.8967,2006-07-01,2006,7
01/06/2006,1,15.9896,2006-06-01,2006,6
01/05/2006,1,20.1072,2006-05-01,2006,5
01/04/2006,1,29.1984,2006-04-01,2006,4
01/03/2006,1,34.1617,2006-03-01,2006,3
01/02/2006,1,25.5704,2006-02-01,2006,2
01/01/2006,1,29.6066,2006-01-01,2006,1
01/12/2005,1,22.8098,2005-12-01,2005,12
01/11/2005,1,18.2149,2005-11-01,2005,11
01/10/2005,1,13.8179,2005-10-01,2005,10
01/09/2005,1,14.5355,2005-09-01,2005,9
01/08/2005,1,18.2149,2005-08-01,2005,8
01/07/2005,1,22.0315,2005-07-01,2005,7
01/06/2005,1,29.1984,2005-06-01,2005,6
01/05/2005,1,42.2843,2005-05-01,2005,5
01/04/2005,1,35.002,2005-04-01,2005,4
01/03/2005,1,52.9508,2005-03-01,2005,3
01/02/2005,1,76.9737,2005-02-01,2005,2
01/01/2005,1,38.8271,2005-01-01,2005,1
01/12/2004,1,36.6934,2004-12-01,2004,12
01/11/2004,1,11.7051,2004-11-01,2004,11
01/10/2004,1,9.658,2004-10-01,2004,10
01/09/2004,1,12.0529,2004-09-01,2004,9
01/08/2004,1,15.9896,2004-08-01,2004,8
01/07/2004,1,19.3463,2004-07-01,2004,7
01/06/2004,1,27.9796,2004-06-01,2004,6
01/05/2004,1,29.1984,2004-05-01,2004,5
01/04/2004,1,39.6865,2004-04-01,2004,4
01/03/2004,1,68.7452,2004-03-01,2004,3
01/02/2004,1,23.5928,2004-02-01,2004,2
01/01/2004,1,24.3805,2004-01-01,2004,1
01/12/2003,1,29.1984,2003-12-01,2003,12
01/11/2003,1,11.3591,2003-11-01,2003,11
01/10/2003,1,7.6852,2003-10-01,2003,10
01/09/2003,1,12.4024,2003-09-01,2003,9
01/08/2003,1,11.7051,2003-08-01,2003,8
01/07/2003,1,13.8179,2003-07-01,2003,7
01/06/2003,1,17.0959,2003-06-01,2003,6
01/05/2003,1,18.2149,2003-05-01,2003,5
01/04/2003,1,27.5754,2003-04-01,2003,4
01/03/2003,1,30.0159,2003-03-01,2003,3
01/02/2003,1,136.2356,2003-02-01,2003,2
01/01/2003,1,23.5928,2003-01-01,2003,1
01/12/2002,1,15.2595,2002-12-01,2002,12
01/11/2002,1,17.0959,2002-11-01,2002,11
01/10/2002,1,10.3326,2002-10-01,2002,10
01/09/2002,1,9.658,2002-09-01,2002,9
01/08/2002,1,11.7051,2002-08-01,2002,8
01/07/2002,1,13.4615,2002-07-01,2002,7
01/06/2002,1,16.7257,2002-06-01,2002,6
01/05/2002,1,19.3463,2002-05-01,2002,5
01/04/2002,1,31.2496,2002-04-01,2002,4
01/03/2002,1,44.0321,2002-03-01,2002,3
01/02/2002,1,73.0995,2002-02-01,2002,2
01/01/2002,1,85.4712,2002-01-01,2002,1
01/12/2001,1,65.4222,2001-12-01,2001,12
01/11/2001,1,8.3339,2001-11-01,2001,11
01/10/2001,1,7.6852,2001-10-01,2001,10
01/09/2001,1,13.8179,2001-09-01,2001,9
01/08/2001,1,7.0461,2001-08-01,2001,8
01/07/2001,1,8.0084,2001-07-01,2001,7
01/06/2001,1,11.7051,2001-06-01,2001,6
01/05/2001,1,10.3326,2001-05-01,2001,5
01/04/2001,1,32.0769,2001-04-01,2001,4
01/03/2001,1,15.2595,2001-03-01,2001,3
01/02/2001,1,27.5754,2001-02-01,2001,2
01/01/2001,1,52.0461,2001-01-01,2001,1
01/12/2000,1,40.9817,2000-12-01,2000,12
01/11/2000,1,13.8179,2000-11-01,2000,11
01/10/2000,1,17.4675,2000-10-01,2000,10
01/09/2000,1,14.5355,2000-09-01,2000,9
01/08/2000,1,15.2595,2000-08-01,2000,8
01/07/2000,1,15.9896,2000-07-01,2000,7
01/06/2000,1,19.7261,2000-06-01,2000,6
01/05/2000,1,24.3805,2000-05-01,2000,5
01/04/2000,1,41.8493,2000-04-01,2000,4
01/03/2000,1,47.1204,2000-03-01,2000,3
01/02/2000,1,79.7769,2000-02-01,2000,2
01/01/2000,1,65.4222,2000-01-01,2000,1
01/12/1999,1,8.6616,1999-12-01,1999,12
01/11/1999,1,8.9916,1999-11-01,1999,11
01/10/1999,1,8.6616,1999-10-01,1999,10
01/09/1999,1,10.3326,1999-09-01,1999,9
01/08/1999,1,14.1759,1999-08-01,1999,8
01/07/1999,1,16.3569,1999-07-01,1999,7
01/06/1999,1,18.2149,1999-06-01,1999,6
01/05/1999,1,22.8098,1999-05-01,1999,5
01/04/1999,1,40.1174,1999-04-01,1999,4
01/03/1999,1,94.2264,1999-03-01,1999,3
01/02/1999,1,68.7452,1999-02-01,1999,2
01/01/1999,1,34.5814,1999-01-01,1999,1
01/12/1998,1,42.7201,1998-12-01,1998,12
01/11/1998,1,20.1072,1998-11-01,1998,11
01/10/1998,1,12.7537,1998-10-01,1998,10
01/09/1998,1,12.7537,1998-09-01,1998,9
01/08/1998,1,14.5355,1998-08-01,1998,8
01/07/1998,1,18.5907,1998-07-01,1998,7
01/06/1998,1,38.8271,1998-06-01,1998,6
01/05/1998,1,29.1984,1998-05-01,1998,5
01/04/1998,1,67.7813,1998-04-01,1998,4
01/03/1998,1,47.1204,1998-03-01,1998,3
01/02/1998,1,32.908,1998-02-01,1998,2
01/01/1998,1,25.5704,1998-01-01,1998,1
01/12/1997,1,51.1441,1997-12-01,1997,12
01/11/1997,1,15.6238,1997-11-01,1997,11
01/10/1997,1,26.7702,1997-10-01,1997,10
01/09/1997,1,16.7257,1997-09-01,1997,9
01/08/1997,1,20.8732,1997-08-01,1997,8
01/07/1997,1,25.9693,1997-07-01,1997,7
01/06/1997,1,30.4262,1997-06-01,1997,6
01/05/1997,1,35.4235,1997-05-01,1997,5
01/04/1997,1,41.8493,1997-04-01,1997,4
01/03/1997,1,62.1446,1997-03-01,1997,3
01/02/1997,1,137.558,1997-02-01,1997,2
01/01/1997,1,100.8048,1997-01-01,1997,1
01/12/1996,1,40.9817,1996-12-01,1996,12
01/11/1996,1,27.5754,1996-11-01,1996,11
01/10/1996,1,17.0959,1996-10-01,1996,10
01/09/1996,1,12.4024,1996-09-01,1996,9
01/08/1996,1,14.5355,1996-08-01,1996,8
01/07/1996,1,21.2581,1996-07-01,1996,7
01/06/1996,1,20.8732,1996-06-01,1996,6
01/05/1996,1,23.9861,1996-05-01,1996,5
01/04/1996,1,32.0769,1996-04-01,1996,4
01/03/1996,1,36.2692,1996-03-01,1996,3
01/02/1996,1,26.7702,1996-02-01,1996,2
01/01/1996,1,49.7964,1996-01-01,1996,1
01/12/1995,1,17.8405,1995-12-01,1995,12
01/11/1995,1,24.776,1995-11-01,1995,11
01/10/1995,1,17.0959,1995-10-01,1995,10
01/09/1995,1,10.6728,1995-09-01,1995,9
01/08/1995,1,13.8179,1995-08-01,1995,8
01/07/1995,1,17.0959,1995-07-01,1995,7
01/06/1995,1,21.2581,1995-06-01,1995,6
01/05/1995,1,23.2007,1995-05-01,1995,5
01/04/1995,1,54.7686,1995-04-01,1995,4
01/03/1995,1,42.7201,1995-03-01,1995,3
01/02/1995,1,134.917,1995-02-01,1995,2
01/01/1995,1,42.7201,1995-01-01,1995,1
01/12/1994,1,18.9679,1994-12-01,1994,12
01/11/1994,1,15.2595,1994-11-01,1994,11
01/10/1994,1,12.0529,1994-10-01,1994,10
01/09/1994,1,15.6238,1994-09-01,1994,9
01/08/1994,1,19.3463,1994-08-01,1994,8
01/07/1994,1,24.3805,1994-07-01,1994,7
01/06/1994,1,32.0769,1994-06-01,1994,6
01/05/1994,1,25.9693,1994-05-01,1994,5
01/04/1994,1,45.7923,1994-04-01,1994,4
01/03/1994,1,46.2343,1994-03-01,1994,3
01/02/1994,1,65.8928,1994-02-01,1994,2
01/01/1994,1,88.9429,1994-01-01,1994,1
01/12/1993,1,14.8967,1993-12-01,1993,12
01/11/1993,1,13.8179,1993-11-01,1993,11
01/10/1993,1,17.8405,1993-10-01,1993,10
01/09/1993,1,14.5355,1993-09-01,1993,9
01/08/1993,1,17.8405,1993-08-01,1993,8
01/07/1993,1,22.0315,1993-07-01,1993,7
01/06/1993,1,28.7911,1993-06-01,1993,6
01/05/1993,1,28.7911,1993-05-01,1993,5
01/04/1993,1,45.7923,1993-04-01,1993,4
01/03/1993,1,59.3593,1993-03-01,1993,3
01/02/1993,1,41.4151,1993-02-01,1993,2
01/01/1993,1,26.3692,1993-01-01,1993,1
01/12/1992,1,28.3848,1992-12-01,1992,12
01/11/1992,1,53.8583,1992-11-01,1992,11
01/10/1992,1,32.908,1992-10-01,1992,10
01/09/1992,1,15.9896,1992-09-01,1992,9
01/08/1992,1,16.7257,1992-08-01,1992,8
01/07/1992,1,20.1072,1992-07-01,1992,7
01/06/1992,1,25.5704,1992-06-01,1992,6
01/05/1992,1,31.2496,1992-05-01,1992,5
01/04/1992,1,42.2843,1992-04-01,1992,4
01/03/1992,1,50.2449,1992-03-01,1992,3
01/02/1992,1,122.5819,1992-02-01,1992,2
01/01/1992,1,48.9015,1992-01-01,1992,1
01/12/1991,1,15.6238,1991-12-01,1991,12
01/11/1991,1,33.7429,1991-11-01,1991,11
01/10/1991,1,32.0769,1991-10-01,1991,10
01/09/1991,1,16.7257,1991-09-01,1991,9
01/08/1991,1,22.0315,1991-08-01,1991,8
01/07/1991,1,24.776,1991-07-01,1991,7
01/06/1991,1,30.8374,1991-06-01,1991,6
01/05/1991,1,51.5948,1991-05-01,1991,5
01/04/1991,1,109.3642,1991-04-01,1991,4
01/03/1991,1,50.6942,1991-03-01,1991,3
01/02/1991,1,70.3688,1991-02-01,1991,2
01/01/1991,1,22.4201,1991-01-01,1991,1
01/12/1990,1,16.7257,1990-12-01,1990,12
01/11/1990,1,12.5729,1990-11-01,1990,11
01/10/1990,1,12.8853,1990-10-01,1990,10
01/09/1990,1,15.4687,1990-09-01,1990,9
01/08/1990,1,14.809,1990-08-01,1990,8
01/07/1990,1,16.1375,1990-07-01,1990,7
01/06/1990,1,18.5468,1990-06-01,1990,6
01/05/1990,1,22.5391,1990-05-01,1990,5
01/04/1990,1,44.3955,1990-04-01,1990,4
01/03/1990,1,81.9269,1990-03-01,1990,3
01/02/1990,1,22.914,1990-02-01,1990,2
01/01/1990,1,66.6903,1990-01-01,1990,1
01/12/1989,1,38.951,1989-12-01,1989,12
01/11/1989,1,14.1584,1989-11-01,1989,11
01/10/1989,1,22.914,1989-10-01,1989,10
01/09/1989,1,17.5013,1989-09-01,1989,9
01/08/1989,1,30.806,1989-08-01,1989,8
01/07/1989,1,22.5391,1989-07-01,1989,7
01/06/1989,1,24.433,1989-06-01,1989,6
01/05/1989,1,31.2195,1989-05-01,1989,5
01/04/1989,1,41.6452,1989-04-01,1989,4
01/03/1989,1,47.6733,1989-03-01,1989,3
01/02/1989,1,36.3143,1989-02-01,1989,2
01/01/1989,1,55.4353,1989-01-01,1989,1
01/12/1988,1,27.1639,1988-12-01,1988,12
01/11/1988,1,20.3311,1988-11-01,1988,11
01/10/1988,1,23.2909,1988-10-01,1988,10
01/09/1988,1,15.4687,1988-09-01,1988,9
01/08/1988,1,19.2543,1988-08-01,1988,8
01/07/1988,1,23.6697,1988-07-01,1988,7
01/06/1988,1,30.3942,1988-06-01,1988,6
01/05/1988,1,32.8907,1988-05-01,1988,5
01/04/1988,1,38.0656,1988-04-01,1988,4
01/03/1988,1,62.522,1988-03-01,1988,3
01/02/1988,1,42.0997,1988-02-01,1988,2
01/01/1988,1,172.0033,1988-01-01,1988,1
01/12/1987,1,32.0517,1987-12-01,1987,12
01/11/1987,1,24.8175,1987-11-01,1987,11
01/10/1987,1,23.2909,1987-10-01,1987,10
01/09/1987,1,17.5013,1987-09-01,1987,9
01/08/1987,1,21.7951,1987-08-01,1987,8
01/07/1987,1,26.7682,1987-07-01,1987,7
01/06/1987,1,26.6801,1987-06-01,1987,6
01/05/1987,1,31.1361,1987-05-01,1987,5
01/04/1987,1,33.9096,1987-04-01,1987,4
01/03/1987,1,29.9869,1987-03-01,1987,3
01/02/1987,1,79.0746,1987-02-01,1987,2
01/01/1987,1,109.9528,1987-01-01,1987,1
01/12/1986,1,40.737,1986-12-01,1986,12
01/11/1986,1,12.7604,1986-11-01,1986,11
01/10/1986,1,17.7218,1986-10-01,1986,10
01/09/1986,1,19.4743,1986-09-01,1986,9
01/08/1986,1,21.0038,1986-08-01,1986,8
01/07/1986,1,21.3173,1986-07-01,1986,7
01/06/1986,1,31.1361,1986-06-01,1986,6
01/05/1986,1,31.5244,1986-05-01,1986,5
01/04/1986,1,49.7393,1986-04-01,1986,4
01/03/1986,1,53.8245,1986-03-01,1986,3
01/02/1986,1,60.4206,1986-02-01,1986,2
01/01/1986,1,100.3122,1986-01-01,1986,1
01/12/1985,1,27.0371,1985-12-01,1985,12
01/11/1985,1,15.7906,1985-11-01,1985,11
01/10/1985,1,21.3173,1985-10-01,1985,10
01/09/1985,1,15.2611,1985-09-01,1985,9
01/08/1985,1,17.7218,1985-08-01,1985,8
01/07/1985,1,21.0038,1985-07-01,1985,7
01/06/1985,1,24.5922,1985-06-01,1985,6
01/05/1985,1,29.9869,1985-05-01,1985,5
01/04/1985,1,55.6836,1985-04-01,1985,4
01/03/1985,1,95.9472,1985-03-01,1985,3
01/02/1985,1,140.4557,1985-02-01,1985,2
01/01/1985,1,31.9153,1985-01-01,1985,1
01/12/1984,1,21.3173,1984-12-01,1984,12
01/11/1984,1,12.7604,1984-11-01,1984,11
01/10/1984,1,16.8793,1984-10-01,1984,10
01/09/1984,1,16.059,1984-09-01,1984,9
01/08/1984,1,15.7906,1984-08-01,1984,8
01/07/1984,1,18.296,1984-07-01,1984,7
01/06/1984,1,21.9519,1984-06-01,1984,6
01/05/1984,1,30.7504,1984-05-01,1984,5
01/04/1984,1,29.2338,1984-04-01,1984,4
01/03/1984,1,34.7257,1984-03-01,1984,3
01/02/1984,1,50.2404,1984-02-01,1984,2
01/01/1984,1,104.7626,1984-01-01,1984,1
01/12/1983,1,46.7905,1983-12-01,1983,12
01/11/1983,1,58.9792,1983-11-01,1983,11
01/10/1983,1,57.5552,1983-10-01,1983,10
01/09/1983,1,27.3968,1983-09-01,1983,9
01/08/1983,1,35.9699,1983-08-01,1983,8
01/07/1983,1,52.2719,1983-07-01,1983,7
01/06/1983,1,118.622,1983-06-01,1983,6
01/05/1983,1,54.7595,1983-05-01,1983,5
01/04/1983,1,70.4746,1983-04-01,1983,4
01/03/1983,1,59.9382,1983-03-01,1983,3
01/02/1983,1,128.9836,1983-02-01,1983,2
01/01/1983,1,187.2633,1983-01-01,1983,1
01/12/1982,1,35.9699,1982-12-01,1982,12
01/11/1982,1,48.7455,1982-11-01,1982,11
01/10/1982,1,18.8801,1982-10-01,1982,10
01/09/1982,1,17.7218,1982-09-01,1982,9
01/08/1982,1,23.2516,1982-08-01,1982,8
01/07/1982,1,27.3968,1982-07-01,1982,7
01/06/1982,1,32.7051,1982-06-01,1982,6
01/05/1982,1,39.8461,1982-05-01,1982,5
01/04/1982,1,107.3439,1982-04-01,1982,4
01/03/1982,1,83.5603,1982-03-01,1982,3
01/02/1982,1,62.8616,1982-02-01,1982,2
01/01/1982,1,38.966,1982-01-01,1982,1
01/12/1981,1,34.7257,1981-12-01,1981,12
01/11/1981,1,24.2532,1981-11-01,1981,11
01/10/1981,1,16.6034,1981-10-01,1981,10
01/09/1981,1,16.33,1981-09-01,1981,9
01/08/1981,1,18.296,1981-08-01,1981,8
01/07/1981,1,21.6333,1981-07-01,1981,7
01/06/1981,1,25.6245,1981-06-01,1981,6
01/05/1981,1,31.1361,1981-05-01,1981,5
01/04/1981,1,53.3042,1981-04-01,1981,4
01/03/1981,1,43.9398,1981-03-01,1981,3
01/02/1981,1,67.3772,1981-02-01,1981,2
01/01/1981,1,102.8449,1981-01-01,1981,1
01/12/1980,1,122.0333,1980-12-01,1980,12
01/11/1980,1,12.2894,1980-11-01,1980,11
01/10/1980,1,14.7414,1980-10-01,1980,10
01/09/1980,1,16.8793,1980-09-01,1980,9
01/08/1980,1,19.176,1980-08-01,1980,8
01/07/1980,1,27.3968,1980-07-01,1980,7
01/06/1980,1,25.9738,1980-06-01,1980,6
01/05/1980,1,34.3163,1980-05-01,1980,5
01/04/1980,1,33.5054,1980-04-01,1980,4
01/03/1980,1,51.7599,1980-03-01,1980,3
01/02/1980,1,104.7626,1980-02-01,1980,2
01/01/1980,1,100.9428,1980-01-01,1980,1
01/12/1979,1,19.7752,1979-12-01,1979,12
01/11/1979,1,39.8461,1979-11-01,1979,11
01/10/1979,1,17.7218,1979-10-01,1979,10
01/09/1979,1,17.1576,1979-09-01,1979,9
01/08/1979,1,18.0076,1979-08-01,1979,8
01/07/1979,1,18.8801,1979-07-01,1979,7
01/06/1979,1,28.1238,1979-06-01,1979,6
01/05/1979,1,40.737,1979-05-01,1979,5
01/04/1979,1,35.5525,1979-04-01,1979,4
01/03/1979,1,53.3042,1979-03-01,1979,3
01/02/1979,1,53.3042,1979-02-01,1979,2
01/01/1979,1,38.53,1979-01-01,1979,1
01/12/1978,1,29.9869,1978-12-01,1978,12
01/11/1978,1,68.4019,1978-11-01,1978,11
01/10/1978,1,10.5016,1978-10-01,1978,10
01/09/1978,1,12.7604,1978-09-01,1978,9
01/08/1978,1,15.0,1978-08-01,1978,8
01/07/1978,1,16.33,1978-07-01,1978,7
01/06/1978,1,33.9096,1978-06-01,1978,6
01/05/1978,1,21.0038,1978-05-01,1978,5
01/04/1978,1,29.609,1978-04-01,1978,4
01/03/1978,1,30.7504,1978-03-01,1978,3
01/02/1978,1,36.8126,1978-02-01,1978,2
01/01/1978,1,23.2516,1978-01-01,1978,1
01/12/1977,1,103.4824,1977-12-01,1977,12
01/11/1977,1,11.8281,1977-11-01,1977,11
01/10/1977,1,15.2611,1977-10-01,1977,10
01/09/1977,1,20.0786,1977-09-01,1977,9
01/08/1977,1,13.9802,1977-08-01,1977,8
01/07/1977,1,17.1576,1977-07-01,1977,7
01/06/1977,1,20.6929,1977-06-01,1977,6
01/05/1977,1,26.6801,1977-05-01,1977,5
01/04/1977,1,47.2752,1977-04-01,1977,4
01/03/1977,1,30.3673,1977-03-01,1977,3
01/02/1977,1,215.5051,1977-02-01,1977,2
01/01/1977,1,67.3772,1977-01-01,1977,1
01/12/1976,1,34.7257,1976-12-01,1976,12
01/11/1976,1,43.9398,1976-11-01,1976,11
01/10/1976,1,28.8612,1976-10-01,1976,10
01/09/1976,1,16.8793,1976-09-01,1976,9
01/08/1976,1,16.33,1976-08-01,1976,8
01/07/1976,1,16.8793,1976-07-01,1976,7
01/06/1976,1,27.0371,1976-06-01,1976,6
01/05/1976,1,21.3173,1976-05-01,1976,5
01/04/1976,1,29.9869,1976-04-01,1976,4
01/03/1976,1,39.8461,1976-03-01,1976,3
01/02/1976,1,32.7051,1976-02-01,1976,2
01/01/1976,1,29.2338,1976-01-01,1976,1
01/12/1975,1,72.5782,1975-12-01,1975,12
01/11/1975,1,10.2889,1975-11-01,1975,11
01/10/1975,1,14.2315,1975-10-01,1975,10
01/09/1975,1,10.2889,1975-09-01,1975,9
01/08/1975,1,12.7604,1975-08-01,1975,8
01/07/1975,1,14.4852,1975-07-01,1975,7
01/06/1975,1,15.7906,1975-06-01,1975,6
01/05/1975,1,18.5868,1975-05-01,1975,5
01/04/1975,1,28.4912,1975-04-01,1975,4
01/03/1975,1,156.163,1975-03-01,1975,3
01/02/1975,1,47.7625,1975-02-01,1975,2
01/01/1975,1,56.1486,1975-01-01,1975,1
01/12/1974,1,15.0,1974-12-01,1974,12
01/11/1974,1,35.1378,1974-11-01,1974,11
01/10/1974,1,10.7167,1974-10-01,1974,10
01/09/1974,1,9.1826,1974-09-01,1974,9
01/08/1974,1,12.3436,1974-08-01,1974,8
01/07/1974,1,20.3259,1974-07-01,1974,7
01/06/1974,1,19.9608,1974-06-01,1974,6
01/05/1974,1,26.363,1974-05-01,1974,5
01/04/1974,1,45.0254,1974-04-01,1974,4
01/03/1974,1,27.5336,1974-03-01,1974,3
01/02/1974,1,81.3846,1974-02-01,1974,2
01/01/1974,1,47.2312,1974-01-01,1974,1
01/12/1973,1,12.3436,1973-12-01,1973,12
01/11/1973,1,85.9333,1973-11-01,1973,11
01/10/1973,1,7.981,1973-10-01,1973,10
01/09/1973,1,7.1059,1973-09-01,1973,9
01/08/1973,1,14.3369,1973-08-01,1973,8
01/07/1973,1,16.0483,1973-07-01,1973,7
01/06/1973,1,15.3585,1973-06-01,1973,6
01/05/1973,1,18.8746,1973-05-01,1973,5
01/04/1973,1,59.0723,1973-04-01,1973,4
01/03/1973,1,27.5336,1973-03-01,1973,3
01/02/1973,1,83.3993,1973-02-01,1973,2
01/01/1973,1,63.782,1973-01-01,1973,1
01/12/1972,1,87.973,1972-12-01,1972,12
01/11/1972,1,30.3092,1972-11-01,1972,11
01/10/1972,1,31.1133,1972-10-01,1972,10
01/09/1972,1,9.1826,1972-09-01,1972,9
01/08/1972,1,11.3731,1972-08-01,1972,8
01/07/1972,1,11.3731,1972-07-01,1972,7
01/06/1972,1,15.3585,1972-06-01,1972,6
01/05/1972,1,21.0606,1972-05-01,1972,5
01/04/1972,1,34.3766,1972-04-01,1972,4
01/03/1972,1,57.2118,1972-03-01,1972,3
01/02/1972,1,28.7157,1972-02-01,1972,2
01/01/1972,1,32.7357,1972-01-01,1972,1
01/12/1971,1,27.9264,1971-12-01,1971,12
01/11/1971,1,9.1826,1971-11-01,1971,11
01/10/1971,1,9.4889,1971-10-01,1971,10
01/09/1971,1,1.9933,1971-09-01,1971,9
01/08/1971,1,4.1166,1971-08-01,1971,8
01/07/1971,1,6.2548,1971-07-01,1971,7
01/06/1971,1,3.6159,1971-06-01,1971,6
01/05/1971,1,6.2548,1971-05-01,1971,5
01/04/1971,1,13.0004,1971-04-01,1971,4
01/03/1971,1,7.6867,1971-03-01,1971,3
01/02/1971,1,11.3731,1971-02-01,1971,2
01/01/1971,1,29.51,1971-01-01,1971,1
01/12/1970,1,17.8025,1970-12-01,1970,12
01/11/1970,1,14.6757,1970-11-01,1970,11
01/10/1970,1,12.0181,1970-10-01,1970,10
01/09/1970,1,18.5157,1970-09-01,1970,9
01/08/1970,1,10.1083,1970-08-01,1970,8
01/07/1970,1,11.6946,1970-07-01,1970,7
01/06/1970,1,12.0181,1970-06-01,1970,6
01/05/1970,1,19.9608,1970-05-01,1970,5
01/04/1970,1,26.363,1970-04-01,1970,4
01/03/1970,1,35.6192,1970-03-01,1970,3
01/02/1970,1,41.1169,1970-02-01,1970,2
01/01/1970,1,19.2351,1970-01-01,1970,1
01/12/1969,1,23.6779,1969-12-01,1969,12
01/11/1969,1,15.7026,1969-11-01,1969,11
01/10/1969,1,5.1603,1969-10-01,1969,10
01/09/1969,1,7.1059,1969-09-01,1969,9
01/08/1969,1,8.577,1969-08-01,1969,8
01/07/1969,1,12.0181,1969-07-01,1969,7
01/06/1969,1,22.923,1969-06-01,1969,6
01/05/1969,1,17.8025,1969-05-01,1969,5
01/04/1969,1,29.909,1969-04-01,1969,4
01/03/1969,1,78.3839,1969-03-01,1969,3
01/02/1969,1,51.7137,1969-02-01,1969,2
01/01/1969,1,19.9608,1969-01-01,1969,1
01/12/1968,1,21.0606,1968-12-01,1968,12
01/11/1968,1,14.0,1968-11-01,1968,11
01/10/1968,1,8.577,1968-10-01,1968,10
01/09/1968,1,7.981,1968-09-01,1968,9
01/08/1968,1,9.1826,1968-08-01,1968,8
01/07/1968,1,10.1083,1968-07-01,1968,7
01/06/1968,1,13.3317,1968-06-01,1968,6
01/05/1968,1,16.745,1968-05-01,1968,5
01/04/1968,1,22.1737,1968-04-01,1968,4
01/03/1968,1,51.2613,1968-03-01,1968,3
01/02/1968,1,33.9647,1968-02-01,1968,2
01/01/1968,1,47.2312,1968-01-01,1968,1
01/12/1967,1,64.7337,1967-12-01,1967,12
01/11/1967,1,27.1422,1967-11-01,1967,11
01/10/1967,1,9.1826,1967-10-01,1967,10
01/09/1967,1,12.671,1967-09-01,1967,9
01/08/1967,1,16.745,1967-08-01,1967,8
01/07/1967,1,21.0606,1967-07-01,1967,7
01/06/1967,1,23.6779,1967-06-01,1967,6
01/05/1967,1,36.0357,1967-05-01,1967,5
01/04/1967,1,54.4469,1967-04-01,1967,4
01/03/1967,1,45.0254,1967-03-01,1967,3
01/02/1967,1,88.4846,1967-02-01,1967,2
01/01/1967,1,79.3813,1967-01-01,1967,1
01/12/1966,1,36.0357,1966-12-01,1966,12
01/11/1966,1,32.3283,1966-11-01,1966,11
01/10/1966,1,14.0,1966-10-01,1966,10
01/09/1966,1,14.6757,1966-09-01,1966,9
01/08/1966,1,20.3259,1966-08-01,1966,8
01/07/1966,1,21.8012,1966-07-01,1966,7
01/06/1966,1,27.5336,1966-06-01,1966,6
01/05/1966,1,35.6192,1966-05-01,1966,5
01/04/1966,1,49.9096,1966-04-01,1966,4
01/03/1966,1,50.3592,1966-03-01,1966,3
01/02/1966,1,82.3905,1966-02-01,1966,2
01/01/1966,1,44.5872,1966-01-01,1966,1
01/12/1965,1,34.7897,1965-12-01,1965,12
01/11/1965,1,34.7897,1965-11-01,1965,11
01/10/1965,1,45.9049,1965-10-01,1965,10
01/09/1965,1,21.0606,1965-09-01,1965,9
01/08/1965,1,25.2042,1965-08-01,1965,8
01/07/1965,1,29.909,1965-07-01,1965,7
01/06/1965,1,35.2039,1965-06-01,1965,6
01/05/1965,1,45.9049,1965-05-01,1965,5
01/04/1965,1,59.0723,1965-04-01,1965,4
01/03/1965,1,127.58,1965-03-01,1965,3
01/02/1965,1,85.9333,1965-02-01,1965,2
01/01/1965,1,85.9333,1965-01-01,1965,1
01/12/1964,1,18.5157,1964-12-01,1964,12
01/11/1964,1,52.167,1964-11-01,1964,11
01/10/1964,1,5.4294,1964-10-01,1964,10
01/09/1964,1,6.8195,1964-09-01,1964,9
01/08/1964,1,9.1826,1964-08-01,1964,8
01/07/1964,1,11.3731,1964-07-01,1964,7
01/06/1964,1,13.6649,1964-06-01,1964,6
01/05/1964,1,25.2042,1964-05-01,1964,5
01/04/1964,1,32.7357,1964-04-01,1964,4
01/03/1964,1,124.7931,1964-03-01,1964,3
01/02/1964,1,136.1032,1964-02-01,1964,2
01/01/1964,1,33.9647,1964-01-01,1964,1
01/12/1963,1,9.1826,1963-12-01,1963,12
01/11/1963,1,37.2916,1963-11-01,1963,11
01/10/1963,1,5.1603,1963-10-01,1963,10
01/09/1963,1,8.2778,1963-09-01,1963,9
01/08/1963,1,13.0004,1963-08-01,1963,8
01/07/1963,1,15.3585,1963-07-01,1963,7
01/06/1963,1,18.1583,1963-06-01,1963,6
01/05/1963,1,22.5476,1963-05-01,1963,5
01/04/1963,1,33.9647,1963-04-01,1963,4
01/03/1963,1,52.167,1963-03-01,1963,3
01/02/1963,1,52.167,1963-02-01,1963,2
01/01/1963,1,190.5932,1963-01-01,1963,1
01/12/1962,1,29.909,1962-12-01,1962,12
01/11/1962,1,44.8347,1962-11-01,1962,11
01/10/1962,1,8.5555,1962-10-01,1962,10
01/09/1962,1,4.6434,1962-09-01,1962,9
01/08/1962,1,6.2066,1962-08-01,1962,8
01/07/1962,1,8.3001,1962-07-01,1962,7
01/06/1962,1,11.9911,1962-06-01,1962,6
01/05/1962,1,18.9153,1962-05-01,1962,5
01/04/1962,1,25.7647,1962-04-01,1962,4
01/03/1962,1,63.1292,1962-03-01,1962,3
01/02/1962,1,34.512,1962-02-01,1962,2
01/01/1962,1,66.7677,1962-01-01,1962,1
01/12/1961,1,9.0802,1961-12-01,1961,12
01/11/1961,1,7.5617,1961-11-01,1961,11
01/10/1961,1,3.6449,1961-10-01,1961,10
01/09/1961,1,23.3402,1961-09-01,1961,9
01/08/1961,1,9.0802,1961-08-01,1961,8
01/07/1961,1,13.2935,1961-07-01,1961,7
01/06/1961,1,19.7558,1961-06-01,1961,6
01/05/1961,1,52.1243,1961-05-01,1961,5
01/04/1961,1,51.3656,1961-04-01,1961,4
01/03/1961,1,104.7626,1961-03-01,1961,3
01/02/1961,1,82.79,1961-02-01,1961,2
01/01/1961,1,100.9428,1961-01-01,1961,1
01/12/1960,1,77.0938,1960-12-01,1960,12
01/11/1960,1,10.4751,1960-11-01,1960,11
01/10/1960,1,13.9751,1960-10-01,1960,10
01/09/1960,1,6.4214,1960-09-01,1960,9
01/08/1960,1,8.5555,1960-08-01,1960,8
01/07/1960,1,13.9751,1960-07-01,1960,7
01/06/1960,1,17.6953,1960-06-01,1960,6
01/05/1960,1,23.8136,1960-05-01,1960,5
01/04/1960,1,49.1294,1960-04-01,1960,4
01/03/1960,1,137.5473,1960-03-01,1960,3
01/02/1960,1,86.8835,1960-02-01,1960,2
01/01/1960,1,35.1101,1960-01-01,1960,1
01/12/1959,1,31.0518,1959-12-01,1959,12
01/11/1959,1,23.3402,1959-11-01,1959,11
01/10/1959,1,8.5555,1959-10-01,1959,10
01/09/1959,1,9.6238,1959-09-01,1959,9
01/08/1959,1,10.7685,1959-08-01,1959,8
01/07/1959,1,13.6317,1959-07-01,1959,7
01/06/1959,1,18.5032,1959-06-01,1959,6
01/05/1959,1,28.8659,1959-05-01,1959,5
01/04/1959,1,59.0845,1959-04-01,1959,4
01/03/1959,1,28.0019,1959-03-01,1959,3
01/02/1959,1,52.9792,1959-02-01,1959,2
01/01/1959,1,51.285,1959-01-01,1959,1
01/12/1958,1,26.7,1958-12-01,1958,12
01/11/1958,1,59.0845,1958-11-01,1958,11
01/10/1958,1,23.864,1958-10-01,1958,10
01/09/1958,1,19.7146,1958-09-01,1958,9
01/08/1958,1,24.483,1958-08-01,1958,8
01/07/1958,1,27.3478,1958-07-01,1958,7
01/06/1958,1,32.406,1958-06-01,1958,6
01/05/1958,1,30.3407,1958-05-01,1958,5
01/04/1958,1,32.406,1958-04-01,1958,4
01/03/1958,1,40.8287,1958-03-01,1958,3
01/02/1958,1,52.1293,1958-02-01,1958,2
01/01/1958,1,22.0461,1958-01-01,1958,1
01/12/1957,1,35.6072,1957-12-01,1957,12
01/11/1957,1,28.95,1957-11-01,1957,11
01/10/1957,1,37.9238,1957-10-01,1957,10
01/09/1957,1,24.3636,1957-09-01,1957,9
01/08/1957,1,35.1284,1957-08-01,1957,8
01/07/1957,1,36.796,1957-07-01,1957,7
01/06/1957,1,43.1549,1957-06-01,1957,6
01/05/1957,1,51.1495,1957-05-01,1957,5
01/04/1957,1,66.5039,1957-04-01,1957,4
01/03/1957,1,77.3115,1957-03-01,1957,3
01/02/1957,1,52.4242,1957-02-01,1957,2
01/01/1957,1,60.9927,1957-01-01,1957,1
01/12/1956,1,31.9325,1956-12-01,1956,12
01/11/1956,1,27.5242,1956-11-01,1956,11
01/10/1956,1,28.4699,1956-10-01,1956,10
01/09/1956,1,17.6272,1956-09-01,1956,9
01/08/1956,1,32.4467,1956-08-01,1956,8
01/07/1956,1,21.4314,1956-07-01,1956,7
01/06/1956,1,28.4699,1956-06-01,1956,6
01/05/1956,1,27.5242,1956-05-01,1956,5
01/04/1956,1,46.1694,1956-04-01,1956,4
01/03/1956,1,92.6498,1956-03-01,1956,3
01/02/1956,1,24.3636,1956-02-01,1956,2
01/01/1956,1,108.6449,1956-01-01,1956,1
01/12/1955,1,10.7702,1955-12-01,1955,12
01/11/1955,1,20.6347,1955-11-01,1955,11
01/10/1955,1,9.9882,1955-10-01,1955,10
01/09/1955,1,12.7345,1955-09-01,1955,9
01/08/1955,1,15.2253,1955-08-01,1955,8
01/07/1955,1,15.5556,1955-07-01,1955,7
01/06/1955,1,27.0585,1955-06-01,1955,6
01/05/1955,1,23.9308,1955-05-01,1955,5
01/04/1955,1,30.4193,1955-04-01,1955,4
01/03/1955,1,60.3164,1955-03-01,1955,3
01/02/1955,1,31.4232,1955-02-01,1955,2
01/01/1955,1,12.7345,1955-01-01,1955,1
01/12/1954,1,7.6318,1954-12-01,1954,12
01/11/1954,1,13.0313,1954-11-01,1954,11
01/10/1954,1,11.8685,1954-10-01,1954,10
01/09/1954,1,7.8505,1954-09-01,1954,9
01/08/1954,1,8.5288,1954-08-01,1954,8
01/07/1954,1,9.4863,1954-07-01,1954,7
01/06/1954,1,13.0313,1954-06-01,1954,6
01/05/1954,1,16.2289,1954-05-01,1954,5
01/04/1954,1,20.6347,1954-04-01,1954,4
01/03/1954,1,21.0308,1954-03-01,1954,3
01/02/1954,1,13.0313,1954-02-01,1954,2
01/01/1954,1,19.0955,1954-01-01,1954,1
01/12/1953,1,31.4232,1953-12-01,1953,12
01/11/1953,1,37.3583,1953-11-01,1953,11
01/10/1953,1,8.0729,1953-10-01,1953,10
01/09/1953,1,16.4172,1953-09-01,1953,9
01/08/1953,1,16.0342,1953-08-01,1953,8
01/07/1953,1,17.1942,1953-07-01,1953,7
01/06/1953,1,23.9372,1953-06-01,1953,6
01/05/1953,1,25.3031,1953-05-01,1953,5
01/04/1953,1,33.1113,1953-04-01,1953,4
01/03/1953,1,24.8443,1953-03-01,1953,3
01/02/1953,1,17.1942,1953-02-01,1953,2
01/01/1953,1,29.0983,1953-01-01,1953,1
01/12/1952,1,17.5883,1952-12-01,1952,12
01/11/1952,1,12.074,1952-11-01,1952,11
01/10/1952,1,11.4046,1952-10-01,1952,10
01/09/1952,1,12.074,1952-09-01,1952,9
01/08/1952,1,14.1764,1952-08-01,1952,8
01/07/1952,1,17.1942,1952-07-01,1952,7
01/06/1952,1,18.3877,1952-06-01,1952,6
01/05/1952,1,26.7005,1952-05-01,1952,5
01/04/1952,1,51.2529,1952-04-01,1952,4
01/03/1952,1,56.9354,1952-03-01,1952,3
01/02/1952,1,74.8655,1952-02-01,1952,2
01/01/1952,1,26.2312,1952-01-01,1952,1
01/12/1951,1,59.5402,1951-12-01,1951,12
01/11/1951,1,17.9862,1951-11-01,1951,11
01/10/1951,1,11.4046,1951-10-01,1951,10
01/09/1951,1,12.4147,1951-09-01,1951,9
01/08/1951,1,14.5404,1951-08-01,1951,8
01/07/1951,1,16.4172,1951-07-01,1951,7
01/06/1951,1,18.7929,1951-06-01,1951,6
01/05/1951,1,23.4888,1951-05-01,1951,5
01/04/1951,1,36.7975,1951-04-01,1951,4
01/03/1951,1,36.7975,1951-03-01,1951,3
01/02/1951,1,42.913,1951-02-01,1951,2
01/01/1951,1,30.5779,1951-01-01,1951,1
01/12/1950,1,53.1194,1950-12-01,1950,12
01/11/1950,1,24.389,1950-11-01,1950,11
01/10/1950,1,15.2797,1950-10-01,1950,10
01/09/1950,1,13.4601,1950-09-01,1950,9
01/08/1950,1,16.4172,1950-08-01,1950,8
01/07/1950,1,20.8735,1950-07-01,1950,7
01/06/1950,1,23.0441,1950-06-01,1950,6
01/05/1950,1,43.4882,1950-05-01,1950,5
01/04/1950,1,40.6441,1950-04-01,1950,4
01/03/1950,1,63.6435,1950-03-01,1950,3
01/02/1950,1,80.49,1950-02-01,1950,2
01/01/1950,1,28.6119,1950-01-01,1950,1
01/12/1949,1,12.074,1949-12-01,1949,12
01/11/1949,1,14.5404,1949-11-01,1949,11
01/10/1949,1,9.8012,1949-10-01,1949,10
01/09/1949,1,13.4601,1949-09-01,1949,9
01/08/1949,1,19.6142,1949-08-01,1949,8
01/07/1949,1,23.4888,1949-07-01,1949,7
01/06/1949,1,26.7005,1949-06-01,1949,6
01/05/1949,1,32.5979,1949-05-01,1949,5
01/04/1949,1,34.6713,1949-04-01,1949,4
01/03/1949,1,55.0137,1949-03-01,1949,3
01/02/1949,1,96.5656,1949-02-01,1949,2
01/01/1949,1,50.0239,1949-01-01,1949,1
01/12/1948,1,55.6512,1948-12-01,1948,12
01/11/1948,1,14.9296,1948-11-01,1948,11
01/10/1948,1,16.0472,1948-10-01,1948,10
01/09/1948,1,13.8424,1948-09-01,1948,9
01/08/1948,1,19.1729,1948-08-01,1948,8
01/07/1948,1,19.5781,1948-07-01,1948,7
01/06/1948,1,22.9328,1948-06-01,1948,6
01/05/1948,1,27.2849,1948-05-01,1948,5
01/04/1948,1,46.5451,1948-04-01,1948,4
01/03/1948,1,55.637,1948-03-01,1948,3
01/02/1948,1,42.7755,1948-02-01,1948,2
01/01/1948,1,53.7099,1948-01-01,1948,1
01/12/1947,1,32.8291,1947-12-01,1947,12
01/11/1947,1,18.7709,1947-11-01,1947,11
01/10/1947,1,20.3981,1947-10-01,1947,10
01/09/1947,1,30.2879,1947-09-01,1947,9
01/08/1947,1,20.3981,1947-08-01,1947,8
01/07/1947,1,23.8502,1947-07-01,1947,7
01/06/1947,1,26.2958,1947-06-01,1947,6
01/05/1947,1,33.3414,1947-05-01,1947,5
01/04/1947,1,55.1524,1947-04-01,1947,4
01/03/1947,1,82.2123,1947-03-01,1947,3
01/02/1947,1,59.0815,1947-02-01,1947,2
01/01/1947,1,39.5877,1947-01-01,1947,1
01/12/1946,1,26.2958,1946-12-01,1946,12
01/11/1946,1,25.3128,1946-11-01,1946,11
01/10/1946,1,19.9865,1946-10-01,1946,10
01/09/1946,1,13.487,1946-09-01,1946,9
01/08/1946,1,16.809,1946-08-01,1946,8
01/07/1946,1,18.372,1946-07-01,1946,7
01/06/1946,1,21.2306,1946-06-01,1946,6
01/05/1946,1,26.2958,1946-05-01,1946,5
01/04/1946,1,34.3699,1946-04-01,1946,4
01/03/1946,1,36.9634,1946-03-01,1946,3
01/02/1946,1,57.102,1946-02-01,1946,2
01/01/1946,1,366.4818,1946-01-01,1946,1
01/12/1945,1,27.2849,1945-12-01,1945,12
01/11/1945,1,17.584,1945-11-01,1945,11
01/10/1945,1,10.447,1945-10-01,1945,10
01/09/1945,1,11.0973,1945-09-01,1945,9
01/08/1945,1,11.7622,1945-08-01,1945,8
01/07/1945,1,14.5638,1945-07-01,1945,7
01/06/1945,1,15.6713,1945-06-01,1945,6
01/05/1945,1,19.5781,1945-05-01,1945,5
01/04/1945,1,30.7934,1945-04-01,1945,4
01/03/1945,1,27.2849,1945-03-01,1945,3
01/02/1945,1,68.3545,1945-02-01,1945,2
01/01/1945,1,13.487,1945-01-01,1945,1
01/12/1944,1,13.8424,1944-12-01,1944,12
01/11/1944,1,21.6515,1944-11-01,1944,11
01/10/1944,1,10.447,1944-10-01,1944,10
01/09/1944,1,12.4415,1944-09-01,1944,9
01/08/1944,1,14.2014,1944-08-01,1944,8
01/07/1944,1,16.809,1944-07-01,1944,7
01/06/1944,1,19.1729,1944-06-01,1944,6
01/05/1944,1,22.5026,1944-05-01,1944,5
01/04/1944,1,30.2879,1944-04-01,1944,4
01/03/1944,1,62.6168,1944-03-01,1944,3
01/02/1944,1,42.7755,1944-02-01,1944,2
01/01/1944,1,36.4422,1944-01-01,1944,1
01/12/1943,1,17.9764,1943-12-01,1943,12
01/11/1943,1,18.372,1943-11-01,1943,11
01/10/1943,1,14.9296,1943-10-01,1943,10
01/09/1943,1,13.8424,1943-09-01,1943,9
01/08/1943,1,15.2988,1943-08-01,1943,8
01/07/1943,1,17.9764,1943-07-01,1943,7
01/06/1943,1,20.3981,1943-06-01,1943,6
01/05/1943,1,25.3128,1943-05-01,1943,5
01/04/1943,1,34.3699,1943-04-01,1943,4
01/03/1943,1,41.7084,1943-03-01,1943,3
01/02/1943,1,62.6168,1943-02-01,1943,2
01/01/1943,1,59.0815,1943-01-01,1943,1
01/12/1942,1,43.8471,1942-12-01,1942,12
01/11/1942,1,20.8128,1942-11-01,1942,11
01/10/1942,1,13.1349,1942-10-01,1942,10
01/09/1942,1,12.7864,1942-09-01,1942,9
01/08/1942,1,15.2988,1942-08-01,1942,8
01/07/1942,1,17.1949,1942-07-01,1942,7
01/06/1942,1,19.9865,1942-06-01,1942,6
01/05/1942,1,22.5026,1942-05-01,1942,5
01/04/1942,1,31.8085,1942-04-01,1942,4
01/03/1942,1,43.8471,1942-03-01,1942,3
01/02/1942,1,20.8128,1942-02-01,1942,2
01/01/1942,1,36.4422,1942-01-01,1942,1
01/12/1941,1,24.8236,1941-12-01,1941,12
01/11/1941,1,19.1729,1941-11-01,1941,11
01/10/1941,1,38.5344,1941-10-01,1941,10
01/09/1941,1,10.7703,1941-09-01,1941,9
01/08/1941,1,13.1349,1941-08-01,1941,8
01/07/1941,1,14.5638,1941-07-01,1941,7
01/06/1941,1,15.2988,1941-06-01,1941,6
01/05/1941,1,17.9764,1941-05-01,1941,5
01/04/1941,1,22.5026,1941-04-01,1941,4
01/03/1941,1,28.7799,1941-03-01,1941,3
01/02/1941,1,54.6697,1941-02-01,1941,2
01/01/1941,1,102.2091,1941-01-01,1941,1
01/12/1940,1,86.2934,1940-12-01,1940,12
01/11/1940,1,16.0472,1940-11-01,1940,11
01/10/1940,1,14.9296,1940-10-01,1940,10
01/09/1940,1,13.8424,1940-09-01,1940,9
01/08/1940,1,15.2988,1940-08-01,1940,8
01/07/1940,1,18.372,1940-07-01,1940,7
01/06/1940,1,22.0755,1940-06-01,1940,6
01/05/1940,1,29.2811,1940-05-01,1940,5
01/04/1940,1,45.4627,1940-04-01,1940,4
01/03/1940,1,43.8471,1940-03-01,1940,3
01/02/1940,1,56.6118,1940-02-01,1940,2
01/01/1940,1,79.9195,1940-01-01,1940,1
01/12/1939,1,27.7817,1939-12-01,1939,12
01/11/1939,1,12.1,1939-11-01,1939,11
01/10/1939,1,42.7755,1939-10-01,1939,10
01/09/1939,1,14.1421,1939-09-01,1939,9
01/08/1939,1,18.2866,1939-08-01,1939,8
01/07/1939,1,16.5816,1939-07-01,1939,7
01/06/1939,1,18.2866,1939-06-01,1939,6
01/05/1939,1,23.2865,1939-05-01,1939,5
01/04/1939,1,37.3564,1939-04-01,1939,4
01/03/1939,1,40.8073,1939-03-01,1939,3
01/02/1939,1,71.0357,1939-02-01,1939,2
01/01/1939,1,136.8244,1939-01-01,1939,1
01/12/1938,1,84.5336,1938-12-01,1938,12
01/11/1938,1,31.8607,1938-11-01,1938,11
01/10/1938,1,14.9393,1938-10-01,1938,10
01/09/1938,1,16.5816,1938-09-01,1938,9
01/08/1938,1,19.1622,1938-08-01,1938,8
01/07/1938,1,16.165,1938-07-01,1938,7
01/06/1938,1,20.9584,1938-06-01,1938,6
01/05/1938,1,22.8136,1938-05-01,1938,5
01/04/1938,1,29.7543,1938-04-01,1938,4
01/03/1938,1,53.105,1938-03-01,1938,3
01/02/1938,1,28.7213,1938-02-01,1938,2
01/01/1938,1,150.0928,1938-01-01,1938,1
01/12/1937,1,49.2903,1937-12-01,1937,12
01/11/1937,1,20.5037,1937-11-01,1937,11
01/10/1937,1,17.4264,1937-10-01,1937,10
01/09/1937,1,16.5816,1937-09-01,1937,9
01/08/1937,1,12.2214,1937-08-01,1937,8
01/07/1937,1,14.1421,1937-07-01,1937,7
01/06/1937,1,17.8546,1937-06-01,1937,6
01/05/1937,1,24.2431,1937-05-01,1937,5
01/04/1937,1,25.2138,1937-04-01,1937,4
01/03/1937,1,34.02,1937-03-01,1937,3
01/02/1937,1,49.2903,1937-02-01,1937,2
01/01/1937,1,60.3688,1937-01-01,1937,1
01/12/1936,1,16.5816,1936-12-01,1936,12
01/11/1936,1,8.3753,1936-11-01,1936,11
01/10/1936,1,12.2214,1936-10-01,1936,10
01/09/1936,1,15.3439,1936-09-01,1936,9
01/08/1936,1,11.1195,1936-08-01,1936,8
01/07/1936,1,12.2214,1936-07-01,1936,7
01/06/1936,1,15.3439,1936-06-01,1936,6
01/05/1936,1,21.4167,1936-05-01,1936,5
01/04/1936,1,41.9826,1936-04-01,1936,4
01/03/1936,1,115.9237,1936-03-01,1936,3
01/02/1936,1,10.4066,1936-02-01,1936,2
01/01/1936,1,23.2865,1936-01-01,1936,1
01/12/1935,1,20.0528,1935-12-01,1935,12
01/11/1935,1,20.9584,1935-11-01,1935,11
01/10/1935,1,22.3444,1935-10-01,1935,10
01/09/1935,1,11.8498,1935-09-01,1935,9
01/08/1935,1,14.9393,1935-08-01,1935,8
01/07/1935,1,16.165,1935-07-01,1935,7
01/06/1935,1,23.763,1935-06-01,1935,6
01/05/1935,1,34.568,1935-05-01,1935,5
01/04/1935,1,24.7267,1935-04-01,1935,4
01/03/1935,1,53.751,1935-03-01,1935,3
01/02/1935,1,84.5336,1935-02-01,1935,2
01/01/1935,1,44.9745,1935-01-01,1935,1
01/12/1934,1,19.6056,1934-12-01,1934,12
01/11/1934,1,12.2214,1934-11-01,1934,11
01/10/1934,1,8.7024,1934-10-01,1934,10
01/09/1934,1,6.8108,1934-09-01,1934,9
01/08/1934,1,7.7351,1934-08-01,1934,8
01/07/1934,1,5.9308,1934-07-01,1934,7
01/06/1934,1,5.9308,1934-06-01,1934,6
01/05/1934,1,11.4825,1934-05-01,1934,5
01/04/1934,1,15.3439,1934-04-01,1934,4
01/03/1934,1,,1934-03-01,1934,3
01/12/2023,2,17.6038,2023-12-02,2023,12
01/11/2023,2,25.6201,2023-11-02,2023,11
01/10/2023,2,14.7447,2023-10-02,2023,10
01/09/2023,2,15.6793,2023-09-02,2023,9
01/08/2023,2,15.6793,2023-08-02,2023,8
01/07/2023,2,18.9266,2023-07-02,2023,7
01/06/2023,2,24.1566,2023-06-02,2023,6
01/05/2023,2,41.7053,2023-05-02,2023,5
01/04/2023,2,43.0111,2023-04-02,2023,4
01/03/2023,2,46.557,2023-03-02,2023,3
01/02/2023,2,67.669,2023-02-02,2023,2
01/01/2023,2,107.5128,2023-01-02,2023,1
01/12/2022,2,17.6038,2022-12-02,2022,12
01/11/2022,2,15.0541,2022-11-02,2022,11
01/10/2022,2,20.6234,2022-10-02,2022,10
01/09/2022,2,10.0915,2022-09-02,2022,9
01/08/2022,2,11.2004,2022-08-02,2022,8
01/07/2022,2,13.5281,2022-07-02,2022,7
01/06/2022,2,15.995,2022-06-02,2022,6
01/05/2022,2,19.2621,2022-05-02,2022,5
01/04/2022,2,42.1391,2022-04-02,2022,4
01/03/2022,2,36.6155,2022-03-02,2022,3
01/02/2022,2,52.0448,2022-02-02,2022,2
01/01/2022,2,60.7984,2022-01-02,2022,1
01/12/2021,2,13.8621,2021-12-02,2021,12
01/11/2021,2,51.2383,2021-11-02,2021,11
01/10/2021,2,9.8437,2021-10-02,2021,10
01/09/2021,2,9.3072,2021-09-02,2021,9
01/08/2021,2,11.2271,2021-08-02,2021,8
01/07/2021,2,12.9637,2021-07-02,2021,7
01/06/2021,2,21.7158,2021-06-02,2021,6
01/05/2021,2,16.0331,2021-05-02,2021,5
01/04/2021,2,23.1326,2021-04-02,2021,4
01/03/2021,2,35.051,2021-03-02,2021,3
01/02/2021,2,26.0523,2021-02-02,2021,2
01/01/2021,2,38.288,2021-01-02,2021,1
01/12/2020,2,25.6201,2020-12-02,2020,12
01/11/2020,2,8.7806,2020-11-02,2020,11
01/10/2020,2,7.5088,2020-10-02,2020,10
01/09/2020,2,8.0097,2020-09-02,2020,9
01/08/2020,2,9.8437,2020-08-02,2020,8
01/07/2020,2,12.0852,2020-07-02,2020,7
01/06/2020,2,15.09,2020-06-02,2020,6
01/05/2020,2,16.9947,2020-05-02,2020,5
01/04/2020,2,34.2344,2020-04-02,2020,4
01/03/2020,2,111.225,2020-03-02,2020,3
01/02/2020,2,26.736,2020-02-02,2020,2
01/01/2020,2,23.4913,2020-01-02,2020,1
01/12/2019,2,14.4718,2019-12-02,2019,12
01/11/2019,2,12.0852,2019-11-02,2019,11
01/10/2019,2,10.3899,2019-10-02,2019,10
01/09/2019,2,10.1156,2019-09-02,2019,9
01/08/2019,2,8.521,2019-08-02,2019,8
01/07/2019,2,10.1156,2019-07-02,2019,7
01/06/2019,2,12.6686,2019-06-02,2019,6
01/05/2019,2,15.4023,2019-05-02,2019,5
01/04/2019,2,19.9866,2019-04-02,2019,4
01/03/2019,2,102.0149,2019-03-02,2019,3
01/02/2019,2,15.3657,2019-02-02,2019,2
01/01/2019,2,26.0523,2019-01-02,2019,1
01/12/2018,2,61.8412,2018-12-02,2018,12
01/11/2018,2,9.5742,2018-11-02,2018,11
01/10/2018,2,8.521,2018-10-02,2018,10
01/09/2018,2,6.3039,2018-09-02,2018,9
01/08/2018,2,6.5394,2018-08-02,2018,8
01/07/2018,2,6.7776,2018-07-02,2018,7
01/06/2018,2,8.0097,2018-06-02,2018,6
01/05/2018,2,9.0426,2018-05-02,2018,5
01/04/2018,2,12.0852,2018-04-02,2018,4
01/03/2018,2,22.7757,2018-03-02,2018,3
01/02/2018,2,27.9338,2018-02-02,2018,2
01/01/2018,2,24.5198,2018-01-02,2018,1
01/12/2017,2,20.6726,2017-12-02,2017,12
01/11/2017,2,11.5108,2017-11-02,2017,11
01/10/2017,2,13.2609,2017-10-02,2017,10
01/09/2017,2,8.0097,2017-09-02,2017,9
01/08/2017,2,9.0426,2017-08-02,2017,8
01/07/2017,2,10.6666,2017-07-02,2017,7
01/06/2017,2,12.9637,2017-06-02,2017,6
01/05/2017,2,13.5604,2017-05-02,2017,5
01/04/2017,2,14.1659,2017-04-02,2017,4
01/03/2017,2,19.939,2017-03-02,2017,3
01/02/2017,2,20.6726,2017-02-02,2017,2
01/01/2017,2,14.7799,2017-01-02,2017,1
01/12/2016,2,32.6203,2016-12-02,2016,12
01/11/2016,2,11.7688,2016-11-02,2016,11
01/10/2016,2,8.0097,2016-10-02,2016,10
01/09/2016,2,12.9637,2016-09-02,2016,9
01/08/2016,2,10.9457,2016-08-02,2016,8
01/07/2016,2,13.8621,2016-07-02,2016,7
01/06/2016,2,19.6464,2016-06-02,2016,6
01/05/2016,2,17.3192,2016-05-02,2016,5
01/04/2016,2,28.3152,2016-04-02,2016,4
01/03/2016,2,33.0215,2016-03-02,2016,3
01/02/2016,2,37.0313,2016-02-02,2016,2
01/01/2016,2,18.5929,2016-01-02,2016,1
01/12/2015,2,35.4616,2015-12-02,2015,12
01/11/2015,2,10.1156,2015-11-02,2015,11
01/10/2015,2,7.758,2015-10-02,2015,10
01/09/2015,2,6.7776,2015-09-02,2015,9
01/08/2015,2,7.2624,2015-08-02,2015,8
01/07/2015,2,9.0426,2015-07-02,2015,7
01/06/2015,2,10.9457,2015-06-02,2015,6
01/05/2015,2,12.3758,2015-05-02,2015,5
01/04/2015,2,23.4913,2015-04-02,2015,4
01/03/2015,2,12.0529,2015-03-02,2015,3
01/02/2015,2,15.9896,2015-02-02,2015,2
01/01/2015,2,12.7537,2015-01-02,2015,1
01/10/2014,2,,2014-10-02,2014,10
01/09/2014,2,,2014-09-02,2014,9
01/08/2014,2,,2014-08-02,2014,8
01/07/2014,2,,2014-07-02,2014,7
01/06/2014,2,,2014-06-02,2014,6
01/05/2014,2,9.658,2014-05-02,2014,5
01/04/2014,2,11.015,2014-04-02,2014,4
01/03/2014,2,12.0529,2014-03-02,2014,3
01/02/2014,2,13.4615,2014-02-02,2014,2
01/01/2014,2,25.9693,2014-01-02,2014,1
01/12/2013,2,65.4222,2013-12-02,2013,12
01/11/2013,2,14.8967,2013-11-02,2013,11
01/10/2013,2,17.4675,2013-10-02,2013,10
01/09/2013,2,12.7537,2013-09-02,2013,9
01/08/2013,2,17.4675,2013-08-02,2013,8
01/07/2013,2,21.6442,2013-07-02,2013,7
01/06/2013,2,25.9693,2013-06-02,2013,6
01/05/2013,2,26.3692,2013-05-02,2013,5
01/04/2013,2,33.325,2013-04-02,2013,4
01/03/2013,2,72.5509,2013-03-02,2013,3
01/02/2013,2,129.0305,2013-02-02,2013,2
01/01/2013,2,18.2149,2013-01-02,2013,1
01/12/2012,2,15.6238,2012-12-02,2012,12
01/11/2012,2,13.1068,2012-11-02,2012,11
01/10/2012,2,12.0529,2012-10-02,2012,10
01/09/2012,2,14.8967,2012-09-02,2012,9
01/08/2012,2,17.8405,2012-08-02,2012,8
01/07/2012,2,23.5928,2012-07-02,2012,7
01/06/2012,2,24.3805,2012-06-02,2012,6
01/05/2012,2,38.8271,2012-05-02,2012,5
01/04/2012,2,35.002,2012-04-02,2012,4
01/03/2012,2,34.1617,2012-03-02,2012,3
01/02/2012,2,64.4827,2012-02-02,2012,2
01/01/2012,2,149.6276,2012-01-02,2012,1
01/12/2011,2,27.9796,2011-12-02,2011,12
01/11/2011,2,14.8967,2011-11-02,2011,11
01/10/2011,2,11.7051,2011-10-02,2011,10
01/09/2011,2,14.8967,2011-09-02,2011,9
01/08/2011,2,18.5907,2011-08-02,2011,8
01/07/2011,2,23.2007,2011-07-02,2011,7
01/06/2011,2,25.9693,2011-06-02,2011,6
01/05/2011,2,27.9796,2011-05-02,2011,5
01/04/2011,2,40.9817,2011-04-02,2011,4
01/03/2011,2,57.0558,2011-03-02,2011,3
01/02/2011,2,65.8928,2011-02-02,2011,2
01/01/2011,2,65.4222,2011-01-02,2011,1
01/12/2010,2,26.7702,2010-12-02,2010,12
01/11/2010,2,24.3805,2010-11-02,2010,11
01/10/2010,2,17.4675,2010-10-02,2010,10
01/09/2010,2,12.4024,2010-09-02,2010,9
01/08/2010,2,15.9896,2010-08-02,2010,8
01/07/2010,2,19.3463,2010-07-02,2010,7
01/06/2010,2,,2010-06-02,2010,6
01/05/2010,2,29.1984,2010-05-02,2010,5
01/04/2010,2,35.4235,2010-04-02,2010,4
01/03/2010,2,51.1441,2010-03-02,2010,3
01/02/2010,2,44.0321,2010-02-02,2010,2
01/01/2010,2,139.5487,2010-01-02,2010,1
01/12/2009,2,32.908,2009-12-02,2009,12
01/11/2009,2,26.7702,2009-11-02,2009,11
01/10/2009,2,21.2581,2009-10-02,2009,10
01/09/2009,2,18.2149,2009-09-02,2009,9
01/08/2009,2,21.2581,2009-08-02,2009,8
01/07/2009,2,27.9796,2009-07-02,2009,7
01/06/2009,2,29.6066,2009-06-02,2009,6
01/05/2009,2,37.971,2009-05-02,2009,5
01/04/2009,2,90.6941,2009-04-02,2009,4
01/03/2009,2,62.611,2009-03-02,2009,3
01/02/2009,2,65.4222,2009-02-02,2009,2
01/01/2009,2,71.4574,2009-01-02,2009,1
01/12/2008,2,21.2581,2008-12-02,2008,12
01/11/2008,2,91.28,2008-11-02,2008,11
01/10/2008,2,21.2581,2008-10-02,2008,10
01/09/2008,2,14.8967,2008-09-02,2008,9
01/08/2008,2,15.6238,2008-08-02,2008,8
01/07/2008,2,20.4895,2008-07-02,2008,7
01/06/2008,2,24.776,2008-06-02,2008,6
01/05/2008,2,36.6934,2008-05-02,2008,5
01/04/2008,2,36.6934,2008-04-02,2008,4
01/03/2008,2,115.6028,2008-03-02,2008,3
01/02/2008,2,49.3486,2008-02-02,2008,2
01/01/2008,2,15.9896,2008-01-02,2008,1
01/12/2007,2,13.1068,2007-12-02,2007,12
01/11/2007,2,13.8179,2007-11-02,2007,11
01/10/2007,2,9.658,2007-10-02,2007,10
01/09/2007,2,11.3591,2007-09-02,2007,9
01/08/2007,2,15.2595,2007-08-02,2007,8
01/07/2007,2,17.0959,2007-07-02,2007,7
01/06/2007,2,22.0315,2007-06-02,2007,6
01/05/2007,2,23.9861,2007-05-02,2007,5
01/04/2007,2,29.6066,2007-04-02,2007,4
01/03/2007,2,40.5492,2007-03-02,2007,3
01/02/2007,2,116.2322,2007-02-02,2007,2
01/01/2007,2,105.0587,2007-01-02,2007,1
01/12/2006,2,47.1204,2006-12-02,2006,12
01/11/2006,2,11.015,2006-11-02,2006,11
01/10/2006,2,10.3326,2006-10-02,2006,10
01/09/2006,2,11.015,2006-09-02,2006,9
01/08/2006,2,13.4615,2006-08-02,2006,8
01/07/2006,2,14.8967,2006-07-02,2006,7
01/06/2006,2,15.9896,2006-06-02,2006,6
01/05/2006,2,19.7261,2006-05-02,2006,5
01/04/2006,2,28.3848,2006-04-02,2006,4
01/03/2006,2,29.6066,2006-03-02,2006,3
01/02/2006,2,24.3805,2006-02-02,2006,2
01/01/2006,2,33.325,2006-01-02,2006,1
01/12/2005,2,28.3848,2005-12-02,2005,12
01/11/2005,2,15.9896,2005-11-02,2005,11
01/10/2005,2,13.8179,2005-10-02,2005,10
01/09/2005,2,14.5355,2005-09-02,2005,9
01/08/2005,2,17.4675,2005-08-02,2005,8
01/07/2005,2,21.6442,2005-07-02,2005,7
01/06/2005,2,28.7911,2005-06-02,2005,6
01/05/2005,2,32.492,2005-05-02,2005,5
01/04/2005,2,34.1617,2005-04-02,2005,4
01/03/2005,2,47.5646,2005-03-02,2005,3
01/02/2005,2,100.2014,2005-02-02,2005,2
01/01/2005,2,40.1174,2005-01-02,2005,1
01/12/2004,2,29.6066,2004-12-02,2004,12
01/11/2004,2,13.8179,2004-11-02,2004,11
01/10/2004,2,9.9942,2004-10-02,2004,10
01/09/2004,2,12.0529,2004-09-02,2004,9
01/08/2004,2,15.9896,2004-08-02,2004,8
01/07/2004,2,19.3463,2004-07-02,2004,7
01/06/2004,2,27.5754,2004-06-02,2004,6
01/05/2004,2,28.3848,2004-05-02,2004,5
01/04/2004,2,33.325,2004-04-02,2004,4
01/03/2004,2,59.822,2004-03-02,2004,3
01/02/2004,2,30.0159,2004-02-02,2004,2
01/01/2004,2,18.5907,2004-01-02,2004,1
01/12/2003,2,37.5443,2003-12-02,2003,12
01/11/2003,2,11.3591,2003-11-02,2003,11
01/10/2003,2,7.6852,2003-10-02,2003,10
01/09/2003,2,12.4024,2003-09-02,2003,9
01/08/2003,2,11.7051,2003-08-02,2003,8
01/07/2003,2,13.4615,2003-07-02,2003,7
01/06/2003,2,17.0959,2003-06-02,2003,6
01/05/2003,2,18.2149,2003-05-02,2003,5
01/04/2003,2,26.3692,2003-04-02,2003,4
01/03/2003,2,29.1984,2003-03-02,2003,3
01/02/2003,2,101.4093,2003-02-02,2003,2
01/01/2003,2,22.0315,2003-01-02,2003,1
01/12/2002,2,13.4615,2002-12-02,2002,12
01/11/2002,2,20.1072,2002-11-02,2002,11
01/10/2002,2,10.3326,2002-10-02,2002,10
01/09/2002,2,10.6728,2002-09-02,2002,9
01/08/2002,2,12.4024,2002-08-02,2002,8
01/07/2002,2,13.4615,2002-07-02,2002,7
01/06/2002,2,16.7257,2002-06-02,2002,6
01/05/2002,2,18.9679,2002-05-02,2002,5
01/04/2002,2,29.6066,2002-04-02,2002,4
01/03/2002,2,39.2564,2002-03-02,2002,3
01/02/2002,2,109.9835,2002-02-02,2002,2
01/01/2002,2,73.6493,2002-01-02,2002,1
01/12/2001,2,87.7812,2001-12-02,2001,12
01/11/2001,2,8.3339,2001-11-02,2001,11
01/10/2001,2,10.3326,2001-10-02,2001,10
01/09/2001,2,12.4024,2001-09-02,2001,9
01/08/2001,2,6.7303,2001-08-02,2001,8
01/07/2001,2,8.0084,2001-07-02,2001,7
01/06/2001,2,11.3591,2001-06-02,2001,6
01/05/2001,2,10.3326,2001-05-02,2001,5
01/04/2001,2,25.1726,2001-04-02,2001,4
01/03/2001,2,14.8967,2001-03-02,2001,3
01/02/2001,2,26.7702,2001-02-02,2001,2
01/01/2001,2,40.9817,2001-01-02,2001,1
01/12/2000,2,32.492,2000-12-02,2000,12
01/11/2000,2,12.4024,2000-11-02,2000,11
01/10/2000,2,15.2595,2000-10-02,2000,10
01/09/2000,2,47.1204,2000-09-02,2000,9
01/08/2000,2,15.2595,2000-08-02,2000,8
01/07/2000,2,15.9896,2000-07-02,2000,7
01/06/2000,2,19.7261,2000-06-02,2000,6
01/05/2000,2,23.9861,2000-05-02,2000,5
01/04/2000,2,42.7201,2000-04-02,2000,4
01/03/2000,2,49.7964,2000-03-02,2000,3
01/02/2000,2,96.6033,2000-02-02,2000,2
01/01/2000,2,116.2322,2000-01-02,2000,1
01/12/1999,2,8.3339,1999-12-02,1999,12
01/11/1999,2,8.6616,1999-11-02,1999,11
01/10/1999,2,8.6616,1999-10-02,1999,10
01/09/1999,2,10.3326,1999-09-02,1999,9
01/08/1999,2,14.1759,1999-08-02,1999,8
01/07/1999,2,16.3569,1999-07-02,1999,7
01/06/1999,2,17.8405,1999-06-02,1999,6
01/05/1999,2,22.8098,1999-05-02,1999,5
01/04/1999,2,34.5814,1999-04-02,1999,4
01/03/1999,2,76.9737,1999-03-02,1999,3
01/02/1999,2,66.8359,1999-02-02,1999,2
01/01/1999,2,46.2343,1999-01-02,1999,1
01/12/1998,2,30.4262,1998-12-02,1998,12
01/11/1998,2,19.7261,1998-11-02,1998,11
01/10/1998,2,19.7261,1998-10-02,1998,10
01/09/1998,2,12.7537,1998-09-02,1998,9
01/08/1998,2,14.5355,1998-08-02,1998,8
01/07/1998,2,18.2149,1998-07-02,1998,7
01/06/1998,2,31.2496,1998-06-02,1998,6
01/05/1998,2,28.7911,1998-05-02,1998,5
01/04/1998,2,91.28,1998-04-02,1998,4
01/03/1998,2,44.9107,1998-03-02,1998,3
01/02/1998,2,29.6066,1998-02-02,1998,2
01/01/1998,2,42.7201,1998-01-02,1998,1
01/12/1997,2,48.0095,1997-12-02,1997,12
01/11/1997,2,15.6238,1997-11-02,1997,11
01/10/1997,2,21.6442,1997-10-02,1997,10
01/09/1997,2,16.7257,1997-09-02,1997,9
01/08/1997,2,20.8732,1997-08-02,1997,8
01/07/1997,2,25.5704,1997-07-02,1997,7
01/06/1997,2,29.6066,1997-06-02,1997,6
01/05/1997,2,34.5814,1997-05-02,1997,5
01/04/1997,2,48.0095,1997-04-02,1997,4
01/03/1997,2,76.9737,1997-03-02,1997,3
01/02/1997,2,121.9425,1997-02-02,1997,2
01/01/1997,2,103.2293,1997-01-02,1997,1
01/12/1996,2,39.2564,1996-12-02,1996,12
01/11/1996,2,30.4262,1996-11-02,1996,11
01/10/1996,2,16.7257,1996-10-02,1996,10
01/09/1996,2,12.4024,1996-09-02,1996,9
01/08/1996,2,14.5355,1996-08-02,1996,8
01/07/1996,2,20.1072,1996-07-02,1996,7
01/06/1996,2,20.4895,1996-06-02,1996,6
01/05/1996,2,23.5928,1996-05-02,1996,5
01/04/1996,2,35.002,1996-04-02,1996,4
01/03/1996,2,38.3986,1996-03-02,1996,3
01/02/1996,2,28.7911,1996-02-02,1996,2
01/01/1996,2,56.597,1996-01-02,1996,1
01/12/1995,2,16.7257,1995-12-02,1995,12
01/11/1995,2,27.9796,1995-11-02,1995,11
01/10/1995,2,15.2595,1995-10-02,1995,10
01/09/1995,2,10.6728,1995-09-02,1995,9
01/08/1995,2,13.8179,1995-08-02,1995,8
01/07/1995,2,17.0959,1995-07-02,1995,7
01/06/1995,2,20.8732,1995-06-02,1995,6
01/05/1995,2,22.8098,1995-05-02,1995,5
01/04/1995,2,52.0461,1995-04-02,1995,4
01/03/1995,2,40.9817,1995-03-02,1995,3
01/02/1995,2,94.819,1995-02-02,1995,2
01/01/1995,2,41.4151,1995-01-02,1995,1
01/12/1994,2,16.3569,1994-12-02,1994,12
01/11/1994,2,13.8179,1994-11-02,1994,11
01/10/1994,2,12.0529,1994-10-02,1994,10
01/09/1994,2,15.2595,1994-09-02,1994,9
01/08/1994,2,18.9679,1994-08-02,1994,8
01/07/1994,2,24.3805,1994-07-02,1994,7
01/06/1994,2,30.8374,1994-06-02,1994,6
01/05/1994,2,25.5704,1994-05-02,1994,5
01/04/1994,2,46.677,1994-04-02,1994,4
01/03/1994,2,40.5492,1994-03-02,1994,3
01/02/1994,2,60.2852,1994-02-02,1994,2
01/01/1994,2,78.652,1994-01-02,1994,1
01/12/1993,2,17.8405,1993-12-02,1993,12
01/11/1993,2,13.1068,1993-11-02,1993,11
01/10/1993,2,22.4201,1993-10-02,1993,10
01/09/1993,2,14.5355,1993-09-02,1993,9
01/08/1993,2,17.8405,1993-08-02,1993,8
01/07/1993,2,22.0315,1993-07-02,1993,7
01/06/1993,2,30.4262,1993-06-02,1993,6
01/05/1993,2,28.7911,1993-05-02,1993,5
01/04/1993,2,44.9107,1993-04-02,1993,4
01/03/1993,2,56.597,1993-03-02,1993,3
01/02/1993,2,40.5492,1993-02-02,1993,2
01/01/1993,2,25.1726,1993-01-02,1993,1
01/12/1992,2,39.2564,1992-12-02,1992,12
01/11/1992,2,41.4151,1992-11-02,1992,11
01/10/1992,2,29.6066,1992-10-02,1992,10
01/09/1992,2,15.9896,1992-09-02,1992,9
01/08/1992,2,16.7257,1992-08-02,1992,8
01/07/1992,2,20.1072,1992-07-02,1992,7
01/06/1992,2,25.5704,1992-06-02,1992,6
01/05/1992,2,35.002,1992-05-02,1992,5
01/04/1992,2,37.971,1992-04-02,1992,4
01/03/1992,2,60.2852,1992-03-02,1992,3
01/02/1992,2,103.2293,1992-02-02,1992,2
01/01/1992,2,38.8271,1992-01-02,1992,1
01/12/1991,2,16.3569,1991-12-02,1991,12
01/11/1991,2,131.6371,1991-11-02,1991,11
01/10/1991,2,36.6934,1991-10-02,1991,10
01/09/1991,2,16.7257,1991-09-02,1991,9
01/08/1991,2,21.6442,1991-08-02,1991,8
01/07/1991,2,25.1726,1991-07-02,1991,7
01/06/1991,2,30.4262,1991-06-02,1991,6
01/05/1991,2,44.0321,1991-05-02,1991,5
01/04/1991,2,113.7205,1991-04-02,1991,4
01/03/1991,2,43.1567,1991-03-02,1991,3
01/02/1991,2,65.4222,1991-02-02,1991,2
01/01/1991,2,20.1072,1991-01-02,1991,1
01/12/1990,2,15.6238,1990-12-02,1990,12
01/11/1990,2,12.5729,1990-11-02,1990,11
01/10/1990,2,12.8853,1990-10-02,1990,10
01/09/1990,2,23.6697,1990-09-02,1990,9
01/08/1990,2,14.809,1990-08-02,1990,8
01/07/1990,2,16.1375,1990-07-02,1990,7
01/06/1990,2,18.1962,1990-06-02,1990,6
01/05/1990,2,25.5922,1990-05-02,1990,5
01/04/1990,2,38.5075,1990-04-02,1990,4
01/03/1990,2,52.9702,1990-03-02,1990,3
01/02/1990,2,22.1661,1990-02-02,1990,2
01/01/1990,2,95.1576,1990-01-02,1990,1
01/12/1989,2,24.8175,1989-12-02,1989,12
01/11/1989,2,13.5171,1989-11-02,1989,11
01/10/1989,2,19.9701,1989-10-02,1989,10
01/09/1989,2,17.5013,1989-09-02,1989,9
01/08/1989,2,28.3618,1989-08-02,1989,8
01/07/1989,2,22.5391,1989-07-02,1989,7
01/06/1989,2,24.0504,1989-06-02,1989,6
01/05/1989,2,30.806,1989-05-02,1989,5
01/04/1989,2,43.4726,1989-04-02,1989,4
01/03/1989,2,70.4064,1989-03-02,1989,3
01/02/1989,2,35.4484,1989-02-02,1989,2
01/01/1989,2,64.5956,1989-01-02,1989,1
01/12/1988,2,24.433,1988-12-02,1988,12
01/11/1988,2,25.9824,1988-11-02,1988,11
01/10/1988,2,19.2543,1988-10-02,1988,10
01/09/1988,2,15.1378,1988-09-02,1988,9
01/08/1988,2,19.2543,1988-08-02,1988,8
01/07/1988,2,23.2909,1988-07-02,1988,7
01/06/1988,2,29.5759,1988-06-02,1988,6
01/05/1988,2,31.6347,1988-05-02,1988,5
01/04/1988,2,38.5075,1988-04-02,1988,4
01/03/1988,2,57.4326,1988-03-02,1988,3
01/02/1988,2,62.007,1988-02-02,1988,2
01/01/1988,2,151.8245,1988-01-02,1988,1
01/12/1987,2,27.5614,1987-12-02,1987,12
01/11/1987,2,21.0591,1987-11-02,1987,11
01/10/1987,2,20.3311,1987-10-02,1987,10
01/09/1987,2,17.5013,1987-09-02,1987,9
01/08/1987,2,21.7951,1987-08-02,1987,8
01/07/1987,2,26.3744,1987-07-02,1987,7
01/06/1987,2,25.9738,1987-06-02,1987,6
01/05/1987,2,30.7504,1987-05-02,1987,5
01/04/1987,2,33.9096,1987-04-02,1987,4
01/03/1987,2,31.5244,1987-03-02,1987,3
01/02/1987,2,57.5552,1987-02-02,1987,2
01/01/1987,2,90.5207,1987-01-02,1987,1
01/12/1986,2,35.1378,1986-12-02,1986,12
01/11/1986,2,12.2894,1986-11-02,1986,11
01/10/1986,2,16.8793,1986-10-02,1986,10
01/09/1986,2,18.8801,1986-09-02,1986,9
01/08/1986,2,21.0038,1986-08-02,1986,8
01/07/1986,2,21.6333,1986-07-02,1986,7
01/06/1986,2,29.609,1986-06-02,1986,6
01/05/1986,2,30.3673,1986-05-02,1986,5
01/04/1986,2,44.4081,1986-04-02,1986,4
01/03/1986,2,56.1486,1986-03-02,1986,3
01/02/1986,2,55.2206,1986-02-02,1986,2
01/01/1986,2,103.4824,1986-01-02,1986,1
01/12/1985,2,22.9228,1985-12-02,1985,12
01/11/1985,2,21.0038,1985-11-02,1985,11
01/10/1985,2,21.0038,1985-10-02,1985,10
01/09/1985,2,15.5246,1985-09-02,1985,9
01/08/1985,2,17.7218,1985-08-02,1985,8
01/07/1985,2,20.6929,1985-07-02,1985,7
01/06/1985,2,24.5922,1985-06-02,1985,6
01/05/1985,2,29.9869,1985-05-02,1985,5
01/04/1985,2,52.7867,1985-04-02,1985,4
01/03/1985,2,84.701,1985-03-02,1985,3
01/02/1985,2,126.1831,1985-02-02,1985,2
01/01/1985,2,31.5244,1985-01-02,1985,1
01/12/1984,2,42.5509,1984-12-02,1984,12
01/11/1984,2,12.0575,1984-11-02,1984,11
01/10/1984,2,16.059,1984-10-02,1984,10
01/09/1984,2,15.7906,1984-09-02,1984,9
01/08/1984,2,15.5246,1984-08-02,1984,8
01/07/1984,2,18.296,1984-07-02,1984,7
01/06/1984,2,21.6333,1984-06-02,1984,6
01/05/1984,2,38.0966,1984-05-02,1984,5
01/04/1984,2,28.8612,1984-04-02,1984,4
01/03/1984,2,34.3163,1984-03-02,1984,3
01/02/1984,2,48.2526,1984-02-02,1984,2
01/01/1984,2,91.7079,1984-01-02,1984,1
01/12/1983,2,46.7905,1983-12-02,1983,12
01/11/1983,2,62.3696,1983-11-02,1983,11
01/10/1983,2,54.3475,1983-10-02,1983,10
01/09/1983,2,27.3968,1983-09-02,1983,9
01/08/1983,2,35.9699,1983-08-02,1983,8
01/07/1983,2,49.7393,1983-07-02,1983,7
01/06/1983,2,78.5226,1983-06-02,1983,6
01/05/1983,2,52.7867,1983-05-02,1983,5
01/04/1983,2,65.3509,1983-04-02,1983,4
01/03/1983,2,87.5867,1983-03-02,1983,3
01/02/1983,2,124.7931,1983-02-02,1983,2
01/01/1983,2,203.3102,1983-01-02,1983,1
01/12/1982,2,52.2719,1982-12-02,1982,12
01/11/1982,2,40.737,1982-11-02,1982,11
01/10/1982,2,17.4385,1982-10-02,1982,10
01/09/1982,2,17.7218,1982-09-02,1982,9
01/08/1982,2,22.9228,1982-08-02,1982,8
01/07/1982,2,26.6801,1982-07-02,1982,7
01/06/1982,2,33.104,1982-06-02,1982,6
01/05/1982,2,39.8461,1982-05-02,1982,5
01/04/1982,2,110.6093,1982-04-02,1982,4
01/03/1982,2,106.6959,1982-03-02,1982,3
01/02/1982,2,63.3556,1982-02-02,1982,2
01/01/1982,2,55.2206,1982-01-02,1982,1
01/12/1981,2,40.737,1981-12-02,1981,12
01/11/1981,2,33.9096,1981-11-02,1981,11
01/10/1981,2,15.7906,1981-10-02,1981,10
01/09/1981,2,16.33,1981-09-02,1981,9
01/08/1981,2,18.296,1981-08-02,1981,8
01/07/1981,2,21.6333,1981-07-02,1981,7
01/06/1981,2,25.2778,1981-06-02,1981,6
01/05/1981,2,30.7504,1981-05-02,1981,5
01/04/1981,2,51.2506,1981-04-02,1981,4
01/03/1981,2,42.5509,1981-03-02,1981,3
01/02/1981,2,62.8616,1981-02-02,1981,2
01/01/1981,2,91.7079,1981-01-02,1981,1
01/12/1980,2,126.8807,1980-12-02,1980,12
01/11/1980,2,12.0575,1980-11-02,1980,11
01/10/1980,2,14.4852,1980-10-02,1980,10
01/09/1980,2,16.6034,1980-09-02,1980,9
01/08/1980,2,18.8801,1980-08-02,1980,8
01/07/1980,2,25.9738,1980-07-02,1980,7
01/06/1980,2,25.6245,1980-06-02,1980,6
01/05/1980,2,33.9096,1980-05-02,1980,5
01/04/1980,2,35.1378,1980-04-02,1980,4
01/03/1980,2,45.8294,1980-03-02,1980,3
01/02/1980,2,130.394,1980-02-02,1980,2
01/01/1980,2,97.8074,1980-01-02,1980,1
01/12/1979,2,19.7752,1979-12-02,1979,12
01/11/1979,2,33.104,1979-11-02,1979,11
01/10/1979,2,17.4385,1979-10-02,1979,10
01/09/1979,2,16.6034,1979-09-02,1979,9
01/08/1979,2,17.7218,1979-08-02,1979,8
01/07/1979,2,18.8801,1979-07-02,1979,7
01/06/1979,2,25.9738,1979-06-02,1979,6
01/05/1979,2,31.5244,1979-05-02,1979,5
01/04/1979,2,36.3899,1979-04-02,1979,4
01/03/1979,2,79.0746,1979-03-02,1979,3
01/02/1979,2,51.2506,1979-02-02,1979,2
01/01/1979,2,43.9398,1979-01-02,1979,1
01/12/1978,2,25.9738,1978-12-02,1978,12
01/11/1978,2,56.6156,1978-11-02,1978,11
01/10/1978,2,10.2889,1978-10-02,1978,10
01/09/1978,2,13.241,1978-09-02,1978,9
01/08/1978,2,14.7414,1978-08-02,1978,8
01/07/1978,2,16.33,1978-07-02,1978,7
01/06/1978,2,26.3257,1978-06-02,1978,6
01/05/1978,2,21.0038,1978-05-02,1978,5
01/04/1978,2,28.1238,1978-04-02,1978,4
01/03/1978,2,29.609,1978-03-02,1978,3
01/02/1978,2,35.1378,1978-02-02,1978,2
01/01/1978,2,29.9869,1978-01-02,1978,1
01/12/1977,2,66.3602,1977-12-02,1977,12
01/11/1977,2,15.2611,1977-11-02,1977,11
01/10/1977,2,15.7906,1977-10-02,1977,10
01/09/1977,2,25.2778,1977-09-02,1977,9
01/08/1977,2,13.7314,1977-08-02,1977,8
01/07/1977,2,16.8793,1977-07-02,1977,7
01/06/1977,2,20.3845,1977-06-02,1977,6
01/05/1977,2,27.0371,1977-05-02,1977,5
01/04/1977,2,51.2506,1977-04-02,1977,4
01/03/1977,2,29.609,1977-03-02,1977,3
01/02/1977,2,128.281,1977-02-02,1977,2
01/01/1977,2,59.4578,1977-01-02,1977,1
01/12/1976,2,45.3529,1976-12-02,1976,12
01/11/1976,2,40.2902,1976-11-02,1976,11
01/10/1976,2,24.5922,1976-10-02,1976,10
01/09/1976,2,16.8793,1976-09-02,1976,9
01/08/1976,2,16.059,1976-08-02,1976,8
01/07/1976,2,16.8793,1976-07-02,1976,7
01/06/1976,2,22.273,1976-06-02,1976,6
01/05/1976,2,21.0038,1976-05-02,1976,5
01/04/1976,2,28.1238,1976-04-02,1976,4
01/03/1976,2,43.0112,1976-03-02,1976,3
01/02/1976,2,39.4047,1976-02-02,1976,2
01/01/1976,2,27.0371,1976-01-02,1976,1
01/12/1975,2,69.9535,1975-12-02,1975,12
01/11/1975,2,22.5966,1975-11-02,1975,11
01/10/1975,2,12.9995,1975-10-02,1975,10
01/09/1975,2,10.2889,1975-09-02,1975,9
01/08/1975,2,12.5237,1975-08-02,1975,8
01/07/1975,2,16.6034,1975-07-02,1975,7
01/06/1975,2,16.059,1975-06-02,1975,6
01/05/1975,2,18.296,1975-05-02,1975,5
01/04/1975,2,26.6801,1975-04-02,1975,4
01/03/1975,2,155.3985,1975-03-02,1975,3
01/02/1975,2,57.0844,1975-02-02,1975,2
01/01/1975,2,103.4824,1975-01-02,1975,1
01/12/1974,2,12.5237,1974-12-02,1974,12
01/11/1974,2,29.2338,1974-11-02,1974,11
01/10/1974,2,10.7167,1974-10-02,1974,10
01/09/1974,2,9.1826,1974-09-02,1974,9
01/08/1974,2,12.3436,1974-08-02,1974,8
01/07/1974,2,19.5972,1974-07-02,1974,7
01/06/1974,2,19.2351,1974-06-02,1974,6
01/05/1974,2,26.363,1974-05-02,1974,5
01/04/1974,2,42.844,1974-04-02,1974,4
01/03/1974,2,25.5892,1974-03-02,1974,3
01/02/1974,2,61.8882,1974-02-02,1974,2
01/01/1974,2,49.9096,1974-01-02,1974,1
01/12/1973,2,12.671,1973-12-02,1973,12
01/11/1973,2,61.8882,1973-11-02,1973,11
01/10/1973,2,7.6867,1973-10-02,1973,10
01/09/1973,2,7.981,1973-09-02,1973,9
01/08/1973,2,14.6757,1973-08-02,1973,8
01/07/1973,2,15.0162,1973-07-02,1973,7
01/06/1973,2,15.3585,1973-06-02,1973,6
01/05/1973,2,18.5157,1973-05-02,1973,5
01/04/1973,2,70.9971,1973-04-02,1973,4
01/03/1973,2,27.5336,1973-03-02,1973,3
01/02/1973,2,59.0723,1973-02-02,1973,2
01/01/1973,2,85.9333,1973-01-02,1973,1
01/12/1972,2,53.5322,1972-12-02,1972,12
01/11/1972,2,80.8827,1972-11-02,1972,11
01/10/1972,2,16.745,1972-10-02,1972,10
01/09/1972,2,10.1083,1972-09-02,1972,9
01/08/1972,2,11.3731,1972-08-02,1972,8
01/07/1972,2,11.0537,1972-07-02,1972,7
01/06/1972,2,15.0162,1972-06-02,1972,6
01/05/1972,2,20.6925,1972-05-02,1972,5
01/04/1972,2,32.3283,1972-04-02,1972,4
01/03/1972,2,60.9462,1972-03-02,1972,3
01/02/1972,2,29.909,1972-02-02,1972,2
01/01/1972,2,32.3283,1972-01-02,1972,1
01/12/1971,2,29.909,1971-12-02,1971,12
01/11/1971,2,14.0,1971-11-02,1971,11
01/10/1971,2,11.0537,1971-10-02,1971,10
01/09/1971,2,1.9933,1971-09-02,1971,9
01/08/1971,2,4.1166,1971-08-02,1971,8
01/07/1971,2,6.2548,1971-07-02,1971,7
01/06/1971,2,3.6159,1971-06-02,1971,6
01/05/1971,2,5.9767,1971-05-02,1971,5
01/04/1971,2,11.0537,1971-04-02,1971,4
01/03/1971,2,6.5357,1971-03-02,1971,3
01/02/1971,2,11.6946,1971-02-02,1971,2
01/01/1971,2,22.1737,1971-01-02,1971,1
01/12/1970,2,16.745,1970-12-02,1970,12
01/11/1970,2,13.3317,1970-11-02,1970,11
01/10/1970,2,12.671,1970-10-02,1970,10
01/09/1970,2,16.3958,1970-09-02,1970,9
01/08/1970,2,9.4889,1970-08-02,1970,8
01/07/1970,2,11.3731,1970-07-02,1970,7
01/06/1970,2,12.0181,1970-06-02,1970,6
01/05/1970,2,18.8746,1970-05-02,1970,5
01/04/1970,2,36.0357,1970-04-02,1970,4
01/03/1970,2,31.5171,1970-03-02,1970,3
01/02/1970,2,41.5472,1970-02-02,1970,2
01/01/1970,2,19.5972,1970-01-02,1970,1
01/12/1969,2,41.9784,1969-12-02,1969,12
01/11/1969,2,14.6757,1969-11-02,1969,11
01/10/1969,2,5.4294,1969-10-02,1969,10
01/09/1969,2,6.8195,1969-09-02,1969,9
01/08/1969,2,8.577,1969-08-02,1969,8
01/07/1969,2,12.0181,1969-07-02,1969,7
01/06/1969,2,18.8746,1969-06-02,1969,6
01/05/1969,2,17.8025,1969-05-02,1969,5
01/04/1969,2,26.752,1969-04-02,1969,4
01/03/1969,2,93.6375,1969-03-02,1969,3
01/02/1969,2,40.6877,1969-02-02,1969,2
01/01/1969,2,18.5157,1969-01-02,1969,1
01/12/1968,2,56.2867,1968-12-02,1968,12
01/11/1968,2,12.0181,1968-11-02,1968,11
01/10/1968,2,8.2778,1968-10-02,1968,10
01/09/1968,2,7.981,1968-09-02,1968,9
01/08/1968,2,9.1826,1968-08-02,1968,8
01/07/1968,2,10.1083,1968-07-02,1968,7
01/06/1968,2,13.3317,1968-06-02,1968,6
01/05/1968,2,16.3958,1968-05-02,1968,5
01/04/1968,2,22.1737,1968-04-02,1968,4
01/03/1968,2,45.4647,1968-03-02,1968,3
01/02/1968,2,27.1422,1968-02-02,1968,2
01/01/1968,2,40.6877,1968-01-02,1968,1
01/12/1967,2,55.8254,1967-12-02,1967,12
01/11/1967,2,25.5892,1967-11-02,1967,11
01/10/1967,2,8.8786,1967-10-02,1967,10
01/09/1967,2,12.671,1967-09-02,1967,9
01/08/1967,2,16.3958,1967-08-02,1967,8
01/07/1967,2,20.6925,1967-07-02,1967,7
01/06/1967,2,23.6779,1967-06-02,1967,6
01/05/1967,2,33.9647,1967-05-02,1967,5
01/04/1967,2,50.3592,1967-04-02,1967,4
01/03/1967,2,49.4609,1967-03-02,1967,3
01/02/1967,2,128.9836,1967-02-02,1967,2
01/01/1967,2,74.4235,1967-01-02,1967,1
01/12/1966,2,33.5539,1966-12-02,1966,12
01/11/1966,2,42.844,1966-11-02,1966,11
01/10/1966,2,14.0,1966-10-02,1966,10
01/09/1966,2,14.6757,1966-09-02,1966,9
01/08/1966,2,20.6925,1966-08-02,1966,8
01/07/1966,2,21.4302,1966-07-02,1966,7
01/06/1966,2,27.5336,1966-06-02,1966,6
01/05/1966,2,34.7897,1966-05-02,1966,5
01/04/1966,2,49.9096,1966-04-02,1966,4
01/03/1966,2,50.3592,1966-03-02,1966,3
01/02/1966,2,114.5848,1966-02-02,1966,2
01/01/1966,2,62.8335,1966-01-02,1966,1
01/12/1965,2,31.1133,1965-12-02,1965,12
01/11/1965,2,31.9221,1965-11-02,1965,11
01/10/1965,2,50.3592,1965-10-02,1965,10
01/09/1965,2,20.6925,1965-09-02,1965,9
01/08/1965,2,25.2042,1965-08-02,1965,8
01/07/1965,2,29.909,1965-07-02,1965,7
01/06/1965,2,35.2039,1965-06-02,1965,6
01/05/1965,2,45.0254,1965-05-02,1965,5
01/04/1965,2,57.2118,1965-04-02,1965,4
01/03/1965,2,111.9276,1965-03-02,1965,3
01/02/1965,2,81.8872,1965-02-02,1965,2
01/01/1965,2,84.9176,1965-01-02,1965,1
01/12/1964,2,26.752,1964-12-02,1964,12
01/11/1964,2,44.1499,1964-11-02,1964,11
01/10/1964,2,15.7026,1964-10-02,1964,10
01/09/1964,2,6.8195,1964-09-02,1964,9
01/08/1964,2,9.1826,1964-08-02,1964,8
01/07/1964,2,10.4213,1964-07-02,1964,7
01/06/1964,2,13.6649,1964-06-02,1964,6
01/05/1964,2,24.8206,1964-05-02,1964,5
01/04/1964,2,32.3283,1964-04-02,1964,4
01/03/1964,2,102.2091,1964-03-02,1964,3
01/02/1964,2,158.4667,1964-02-02,1964,2
01/01/1964,2,85.9333,1964-01-02,1964,1
01/12/1963,2,8.577,1963-12-02,1963,12
01/11/1963,2,33.9647,1963-11-02,1963,11
01/10/1963,2,4.6318,1963-10-02,1963,10
01/09/1963,2,8.2778,1963-09-02,1963,9
01/08/1963,2,13.0004,1963-08-02,1963,8
01/07/1963,2,15.3585,1963-07-02,1963,7
01/06/1963,2,18.1583,1963-06-02,1963,6
01/05/1963,2,22.1737,1963-05-02,1963,5
01/04/1963,2,33.5539,1963-04-02,1963,4
01/03/1963,2,47.6753,1963-03-02,1963,3
01/02/1963,2,65.2108,1963-02-02,1963,2
01/01/1963,2,179.052,1963-01-02,1963,1
01/12/1962,2,29.51,1962-12-02,1962,12
01/11/1962,2,61.5975,1962-11-02,1962,11
01/10/1962,2,9.3497,1962-10-02,1962,10
01/09/1962,2,4.6434,1962-09-02,1962,9
01/08/1962,2,6.2066,1962-08-02,1962,8
01/07/1962,2,8.3001,1962-07-02,1962,7
01/06/1962,2,11.9911,1962-06-02,1962,6
01/05/1962,2,28.3343,1962-05-02,1962,5
01/04/1962,2,25.7647,1962-04-02,1962,4
01/03/1962,2,56.0185,1962-03-02,1962,3
01/02/1962,2,60.5855,1962-02-02,1962,2
01/01/1962,2,28.8659,1962-01-02,1962,1
01/12/1961,2,8.5555,1961-12-02,1961,12
01/11/1961,2,7.0921,1961-11-02,1961,11
01/10/1961,2,3.4924,1961-10-02,1961,10
01/09/1961,2,18.0965,1961-09-02,1961,9
01/08/1961,2,9.0802,1961-08-02,1961,8
01/07/1961,2,13.2935,1961-07-02,1961,7
01/06/1961,2,19.7558,1961-06-02,1961,6
01/05/1961,2,50.6135,1961-05-02,1961,5
01/04/1961,2,49.1294,1961-04-02,1961,4
01/03/1961,2,144.8685,1961-03-02,1961,3
01/02/1961,2,73.7623,1961-02-02,1961,2
01/01/1961,2,108.6449,1961-01-02,1961,1
01/12/1960,2,79.3507,1960-12-02,1960,12
01/11/1960,2,9.3497,1960-11-02,1960,11
01/10/1960,2,16.5238,1960-10-02,1960,10
01/09/1960,2,6.6405,1960-09-02,1960,9
01/08/1960,2,8.5555,1960-08-02,1960,8
01/07/1960,2,13.2935,1960-07-02,1960,7
01/06/1960,2,17.2994,1960-06-02,1960,6
01/05/1960,2,35.7144,1960-05-02,1960,5
01/04/1960,2,47.6716,1960-04-02,1960,4
01/03/1960,2,131.8112,1960-03-02,1960,3
01/02/1960,2,99.6834,1960-02-02,1960,2
01/01/1960,2,24.7776,1960-01-02,1960,1
01/12/1959,2,26.7749,1959-12-02,1959,12
01/11/1959,2,18.5032,1959-11-02,1959,11
01/10/1959,2,8.5555,1959-10-02,1959,10
01/09/1959,2,9.6238,1959-09-02,1959,9
01/08/1959,2,10.7685,1959-08-02,1959,8
01/07/1959,2,13.6317,1959-07-02,1959,7
01/06/1959,2,18.0965,1959-06-02,1959,6
01/05/1959,2,28.3343,1959-05-02,1959,5
01/04/1959,2,93.5538,1959-04-02,1959,4
01/03/1959,2,28.0019,1959-03-02,1959,3
01/02/1959,2,47.1485,1959-02-02,1959,2
01/01/1959,2,39.3071,1959-01-02,1959,1
01/12/1958,2,26.0586,1958-12-02,1958,12
01/11/1958,2,53.8347,1958-11-02,1958,11
01/10/1958,2,23.5569,1958-10-02,1958,10
01/09/1958,2,19.7146,1958-09-02,1958,9
01/08/1958,2,24.1727,1958-08-02,1958,8
01/07/1958,2,27.0231,1958-07-02,1958,7
01/06/1958,2,32.0579,1958-06-02,1958,6
01/05/1958,2,29.6647,1958-05-02,1958,5
01/04/1958,2,32.0579,1958-04-02,1958,4
01/03/1958,2,49.6133,1958-03-02,1958,3
01/02/1958,2,50.865,1958-02-02,1958,2
01/01/1958,2,42.3737,1958-01-02,1958,1
01/12/1957,2,33.4593,1957-12-02,1957,12
01/11/1957,2,27.5242,1957-11-02,1957,11
01/10/1957,2,35.681,1957-10-02,1957,10
01/09/1957,2,24.3636,1957-09-02,1957,9
01/08/1957,2,34.0328,1957-08-02,1957,8
01/07/1957,2,36.2369,1957-07-02,1957,7
01/06/1957,2,42.5612,1957-06-02,1957,6
01/05/1957,2,50.5165,1957-05-02,1957,5
01/04/1957,2,70.0385,1957-04-02,1957,4
01/03/1957,2,64.4163,1957-03-02,1957,3
01/02/1957,2,51.1495,1957-02-02,1957,2
01/01/1957,2,55.6621,1957-01-02,1957,1
01/12/1956,2,28.4699,1956-12-02,1956,12
01/11/1956,2,32.4467,1956-11-02,1956,11
01/10/1956,2,24.801,1956-10-02,1956,10
01/09/1956,2,17.2711,1956-09-02,1956,9
01/08/1956,2,31.4232,1956-08-02,1956,8
01/07/1956,2,21.8365,1956-07-02,1956,7
01/06/1956,2,33.4899,1956-06-02,1956,6
01/05/1956,2,34.579,1956-05-02,1956,5
01/04/1956,2,44.9545,1956-04-02,1956,4
01/03/1956,2,122.7207,1956-03-02,1956,3
01/02/1956,2,24.3636,1956-02-02,1956,2
01/01/1956,2,91.0694,1956-01-02,1956,1
01/12/1955,2,9.9882,1955-12-02,1955,12
01/11/1955,2,25.6898,1955-11-02,1955,11
01/10/1955,2,9.7353,1955-10-02,1955,10
01/09/1955,2,12.4417,1955-09-02,1955,9
01/08/1955,2,15.2253,1955-08-02,1955,8
01/07/1955,2,15.5556,1955-07-02,1955,7
01/06/1955,2,26.1413,1955-06-02,1955,6
01/05/1955,2,23.0793,1955-05-02,1955,5
01/04/1955,2,32.4467,1955-04-02,1955,4
01/03/1955,2,61.6718,1955-03-02,1955,3
01/02/1955,2,31.4232,1955-02-02,1955,2
01/01/1955,2,12.4417,1955-01-02,1955,1
01/12/1954,2,7.4168,1954-12-02,1954,12
01/11/1954,2,11.5879,1954-11-02,1954,11
01/10/1954,2,11.3113,1954-10-02,1954,10
01/09/1954,2,7.6318,1954-09-02,1954,9
01/08/1954,2,8.299,1954-08-02,1954,8
01/07/1954,2,9.2412,1954-07-02,1954,7
01/06/1954,2,13.0313,1954-06-02,1954,6
01/05/1954,2,16.2289,1954-05-02,1954,5
01/04/1954,2,23.9308,1954-04-02,1954,4
01/03/1954,2,19.4736,1954-03-02,1954,3
01/02/1954,2,13.3322,1954-02-02,1954,2
01/01/1954,2,20.2432,1954-01-02,1954,1
01/12/1953,2,40.7987,1953-12-02,1953,12
01/11/1953,2,38.4925,1953-11-02,1953,11
01/10/1953,2,7.8505,1953-10-02,1953,10
01/09/1953,2,15.2797,1953-09-02,1953,9
01/08/1953,2,16.0342,1953-08-02,1953,8
01/07/1953,2,17.1942,1953-07-02,1953,7
01/06/1953,2,23.4888,1953-06-02,1953,6
01/05/1953,2,24.8443,1953-05-02,1953,5
01/04/1953,2,31.0779,1953-04-02,1953,4
01/03/1953,2,27.1732,1953-03-02,1953,3
01/02/1953,2,16.8038,1953-02-02,1953,2
01/01/1953,2,37.8803,1953-01-02,1953,1
01/12/1952,2,20.4501,1952-12-02,1952,12
01/11/1952,2,47.6034,1952-11-02,1952,11
01/10/1952,2,11.4046,1952-10-02,1952,10
01/09/1952,2,12.074,1952-09-02,1952,9
01/08/1952,2,13.8163,1952-08-02,1952,8
01/07/1952,2,17.1942,1952-07-02,1952,7
01/06/1952,2,18.3877,1952-06-02,1952,6
01/05/1952,2,26.2312,1952-05-02,1952,5
01/04/1952,2,47.6034,1952-04-02,1952,4
01/03/1952,2,55.0137,1952-03-02,1952,3
01/02/1952,2,58.2317,1952-02-02,1952,2
01/01/1952,2,20.4501,1952-01-02,1952,1
01/12/1951,2,62.6168,1951-12-02,1951,12
01/11/1951,2,16.4172,1951-11-02,1951,11
01/10/1951,2,11.4046,1951-10-02,1951,10
01/09/1951,2,12.4147,1951-09-02,1951,9
01/08/1951,2,14.5404,1951-08-02,1951,8
01/07/1951,2,16.4172,1951-07-02,1951,7
01/06/1951,2,18.7929,1951-06-02,1951,6
01/05/1951,2,23.0441,1951-05-02,1951,5
01/04/1951,2,35.7278,1951-04-02,1951,4
01/03/1951,2,35.7278,1951-03-02,1951,3
01/02/1951,2,39.5289,1951-02-02,1951,2
01/01/1951,2,29.5881,1951-01-02,1951,1
01/12/1950,2,49.4141,1950-12-02,1950,12
01/11/1950,2,20.4501,1950-11-02,1950,11
01/10/1950,2,14.9081,1950-10-02,1950,10
01/09/1950,2,13.4601,1950-09-02,1950,9
01/08/1950,2,16.4172,1950-08-02,1950,8
01/07/1950,2,21.731,1950-07-02,1950,7
01/06/1950,2,23.0441,1950-06-02,1950,6
01/05/1950,2,43.4882,1950-05-02,1950,5
01/04/1950,2,37.8803,1950-04-02,1950,4
01/03/1950,2,61.0906,1950-03-02,1950,3
01/02/1950,2,72.6662,1950-02-02,1950,2
01/01/1950,2,27.1732,1950-01-02,1950,1
01/12/1949,2,13.8163,1949-12-02,1949,12
01/11/1949,2,14.1764,1949-11-02,1949,11
01/10/1949,2,9.4927,1949-10-02,1949,10
01/09/1949,2,13.4601,1949-09-02,1949,9
01/08/1949,2,19.6142,1949-08-02,1949,8
01/07/1949,2,23.4888,1949-07-02,1949,7
01/06/1949,2,26.7005,1949-06-02,1949,6
01/05/1949,2,32.5979,1949-05-02,1949,5
01/04/1949,2,34.148,1949-04-02,1949,4
01/03/1949,2,49.4141,1949-03-02,1949,3
01/02/1949,2,86.2934,1949-02-02,1949,2
01/01/1949,2,44.6482,1949-01-02,1949,1
01/12/1948,2,45.8208,1948-12-02,1948,12
01/11/1948,2,14.5638,1948-11-02,1948,11
01/10/1948,2,16.0472,1948-10-02,1948,10
01/09/1948,2,13.8424,1948-09-02,1948,9
01/08/1948,2,18.372,1948-08-02,1948,8
01/07/1948,2,19.5781,1948-07-02,1948,7
01/06/1948,2,22.9328,1948-06-02,1948,6
01/05/1948,2,27.2849,1948-05-02,1948,5
01/04/1948,2,44.3846,1948-04-02,1948,4
01/03/1948,2,48.7226,1948-03-02,1948,3
01/02/1948,2,38.5344,1948-02-02,1948,2
01/01/1948,2,58.088,1948-01-02,1948,1
01/12/1947,2,49.8175,1947-12-02,1947,12
01/11/1947,2,19.9865,1947-11-02,1947,11
01/10/1947,2,20.8128,1947-10-02,1947,10
01/09/1947,2,27.2849,1947-09-02,1947,9
01/08/1947,2,20.3981,1947-08-02,1947,8
01/07/1947,2,23.366,1947-07-02,1947,7
01/06/1947,2,26.2958,1947-06-02,1947,6
01/05/1947,2,33.3414,1947-05-02,1947,5
01/04/1947,2,53.2328,1947-04-02,1947,4
01/03/1947,2,85.705,1947-03-02,1947,3
01/02/1947,2,44.9231,1947-02-02,1947,2
01/01/1947,2,55.1524,1947-01-02,1947,1
01/12/1946,2,20.8128,1946-12-02,1946,12
01/11/1946,2,20.8128,1946-11-02,1946,11
01/10/1946,2,17.584,1946-10-02,1946,10
01/09/1946,2,13.487,1946-09-02,1946,9
01/08/1946,2,16.4265,1946-08-02,1946,8
01/07/1946,2,18.372,1946-07-02,1946,7
01/06/1946,2,20.8128,1946-06-02,1946,6
01/05/1946,2,25.8035,1946-05-02,1946,5
01/04/1946,2,43.8471,1946-04-02,1946,4
01/03/1946,2,36.9634,1946-03-02,1946,3
01/02/1946,2,57.102,1946-02-02,1946,2
01/01/1946,2,339.0751,1946-01-02,1946,1
01/12/1945,2,23.366,1945-12-02,1945,12
01/11/1945,2,17.1949,1945-11-02,1945,11
01/10/1945,2,10.447,1945-10-02,1945,10
01/09/1945,2,11.0973,1945-09-02,1945,9
01/08/1945,2,11.7622,1945-08-02,1945,8
01/07/1945,2,14.5638,1945-07-02,1945,7
01/06/1945,2,15.6713,1945-06-02,1945,6
01/05/1945,2,19.1729,1945-05-02,1945,5
01/04/1945,2,46.0034,1945-04-02,1945,4
01/03/1945,2,26.2958,1945-03-02,1945,3
01/02/1945,2,86.2934,1945-02-02,1945,2
01/01/1945,2,14.5638,1945-01-02,1945,1
01/12/1944,2,21.6515,1944-12-02,1944,12
01/11/1944,2,18.372,1944-11-02,1944,11
01/10/1944,2,10.447,1944-10-02,1944,10
01/09/1944,2,12.4415,1944-09-02,1944,9
01/08/1944,2,14.2014,1944-08-02,1944,8
01/07/1944,2,16.809,1944-07-02,1944,7
01/06/1944,2,18.7709,1944-06-02,1944,6
01/05/1944,2,22.5026,1944-05-02,1944,5
01/04/1944,2,57.102,1944-04-02,1944,4
01/03/1944,2,67.8238,1944-03-02,1944,3
01/02/1944,2,36.4422,1944-02-02,1944,2
01/01/1944,2,37.4859,1944-01-02,1944,1
01/12/1943,2,27.2849,1943-12-02,1943,12
01/11/1943,2,17.9764,1943-11-02,1943,11
01/10/1943,2,14.2014,1943-10-02,1943,10
01/09/1943,2,13.8424,1943-09-02,1943,9
01/08/1943,2,15.2988,1943-08-02,1943,8
01/07/1943,2,17.9764,1943-07-02,1943,7
01/06/1943,2,19.9865,1943-06-02,1943,6
01/05/1943,2,25.3128,1943-05-02,1943,5
01/04/1943,2,35.4035,1943-04-02,1943,4
01/03/1943,2,39.0605,1943-03-02,1943,3
01/02/1943,2,85.705,1943-02-02,1943,2
01/01/1943,2,43.8471,1943-01-02,1943,1
01/12/1942,2,34.886,1942-12-02,1942,12
01/11/1942,2,28.2801,1942-11-02,1942,11
01/10/1942,2,12.7864,1942-10-02,1942,10
01/09/1942,2,12.7864,1942-09-02,1942,9
01/08/1942,2,15.2988,1942-08-02,1942,8
01/07/1942,2,17.1949,1942-07-02,1942,7
01/06/1942,2,19.9865,1942-06-02,1942,6
01/05/1942,2,22.5026,1942-05-02,1942,5
01/04/1942,2,29.7838,1942-04-02,1942,4
01/03/1942,2,52.2842,1942-03-02,1942,3
01/02/1942,2,20.8128,1942-02-02,1942,2
01/01/1942,2,45.4627,1942-01-02,1942,1
01/12/1941,2,37.4859,1941-12-02,1941,12
01/11/1941,2,18.7709,1941-11-02,1941,11
01/10/1941,2,41.7084,1941-10-02,1941,10
01/09/1941,2,11.7622,1941-09-02,1941,9
01/08/1941,2,13.1349,1941-08-02,1941,8
01/07/1941,2,14.2014,1941-07-02,1941,7
01/06/1941,2,15.2988,1941-06-02,1941,6
01/05/1941,2,17.584,1941-05-02,1941,5
01/04/1941,2,25.3128,1941-04-02,1941,4
01/03/1941,2,26.7896,1941-03-02,1941,3
01/02/1941,2,55.1524,1941-02-02,1941,2
01/01/1941,2,100.3122,1941-01-02,1941,1
01/12/1940,2,65.1974,1940-12-02,1940,12
01/11/1940,2,15.2988,1940-11-02,1940,11
01/10/1940,2,14.5638,1940-10-02,1940,10
01/09/1940,2,13.8424,1940-09-02,1940,9
01/08/1940,2,15.2988,1940-08-02,1940,8
01/07/1940,2,18.372,1940-07-02,1940,7
01/06/1940,2,21.6515,1940-06-02,1940,6
01/05/1940,2,31.3002,1940-05-02,1940,5
01/04/1940,2,44.3846,1940-04-02,1940,4
01/03/1940,2,43.8471,1940-03-02,1940,3
01/02/1940,2,51.8127,1940-02-02,1940,2
01/01/1940,2,60.5855,1940-01-02,1940,1
01/12/1939,2,29.2811,1939-12-02,1939,12
01/11/1939,2,12.1,1939-11-02,1939,11
01/10/1939,2,46.0034,1939-10-02,1939,10
01/09/1939,2,14.9393,1939-09-02,1939,9
01/08/1939,2,17.4264,1939-08-02,1939,8
01/07/1939,2,16.5816,1939-07-02,1939,7
01/06/1939,2,17.8546,1939-06-02,1939,6
01/05/1939,2,24.7267,1939-05-02,1939,5
01/04/1939,2,34.568,1939-04-02,1939,4
01/03/1939,2,36.7923,1939-03-02,1939,3
01/02/1939,2,63.0951,1939-02-02,1939,2
01/01/1939,2,101.575,1939-01-02,1939,1
01/12/1938,2,109.298,1938-12-02,1938,12
01/11/1938,2,31.8607,1938-11-02,1938,11
01/10/1938,2,14.9393,1938-10-02,1938,10
01/09/1938,2,16.165,1938-09-02,1938,9
01/08/1938,2,19.1622,1938-08-02,1938,8
01/07/1938,2,15.7525,1938-07-02,1938,7
01/06/1938,2,20.9584,1938-06-02,1938,6
01/05/1938,2,21.8787,1938-05-02,1938,5
01/04/1938,2,29.2361,1938-04-02,1938,4
01/03/1938,2,84.5336,1938-03-02,1938,3
01/02/1938,2,28.7213,1938-02-02,1938,2
01/01/1938,2,163.8997,1938-01-02,1938,1
01/12/1937,2,33.4752,1937-12-02,1937,12
01/11/1937,2,48.6648,1937-11-02,1937,11
01/10/1937,2,29.2361,1937-10-02,1937,10
01/09/1937,2,15.7525,1937-09-02,1937,9
01/08/1937,2,12.2214,1937-08-02,1937,8
01/07/1937,2,14.1421,1937-07-02,1937,7
01/06/1937,2,25.2138,1937-06-02,1937,6
01/05/1937,2,57.0243,1937-05-02,1937,5
01/04/1937,2,24.7267,1937-04-02,1937,4
01/03/1937,2,51.1845,1937-03-02,1937,3
01/02/1937,2,49.2903,1937-02-02,1937,2
01/01/1937,2,91.6681,1937-01-02,1937,1
01/12/1936,2,15.3439,1936-12-02,1936,12
01/11/1936,2,7.7351,1936-11-02,1936,11
01/10/1936,2,11.8498,1936-10-02,1936,10
01/09/1936,2,14.9393,1936-09-02,1936,9
01/08/1936,2,11.1195,1936-08-02,1936,8
01/07/1936,2,11.8498,1936-07-02,1936,7
01/06/1936,2,15.3439,1936-06-02,1936,6
01/05/1936,2,48.0423,1936-05-02,1936,5
01/04/1936,2,39.0677,1936-04-02,1936,4
01/03/1936,2,78.7838,1936-03-02,1936,3
01/02/1936,2,10.4066,1936-02-02,1936,2
01/01/1936,2,28.2099,1936-01-02,1936,1
01/12/1935,2,20.5037,1935-12-02,1935,12
01/11/1935,2,20.5037,1935-11-02,1935,11
01/10/1935,2,20.0528,1935-10-02,1935,10
01/09/1935,2,11.8498,1935-09-02,1935,9
01/08/1935,2,14.5387,1935-08-02,1935,8
01/07/1935,2,15.7525,1935-07-02,1935,7
01/06/1935,2,21.8787,1935-06-02,1935,6
01/05/1935,2,27.1974,1935-05-02,1935,5
01/04/1935,2,24.7267,1935-04-02,1935,4
01/03/1935,2,42.5748,1935-03-02,1935,3
01/02/1935,2,79.9195,1935-02-02,1935,2
01/01/1935,2,42.5748,1935-01-02,1935,1
01/12/1934,2,20.5037,1934-12-02,1934,12
01/11/1934,2,9.3705,1934-11-02,1934,11
01/10/1934,2,8.7024,1934-10-02,1934,10
01/09/1934,2,7.114,1934-09-02,1934,9
01/08/1934,2,7.7351,1934-08-02,1934,8
01/07/1934,2,5.9308,1934-07-02,1934,7
01/06/1934,2,5.9308,1934-06-02,1934,6
01/05/1934,2,11.1195,1934-05-02,1934,5
01/04/1934,2,15.3439,1934-04-02,1934,4
01/03/1934,2,,1934-03-02,1934,3
01/12/2023,3,17.9315,2023-12-03,2023,12
01/11/2023,3,23.0776,2023-11-03,2023,11
01/10/2023,3,19.5996,2023-10-03,2023,10
01/09/2023,3,15.6793,2023-09-03,2023,9
01/08/2023,3,15.3657,2023-08-03,2023,8
01/07/2023,3,18.9266,2023-07-03,2023,7
01/06/2023,3,24.1566,2023-06-03,2023,6
01/05/2023,3,31.3517,2023-05-03,2023,5
01/04/2023,3,39.5583,2023-04-03,2023,4
01/03/2023,3,47.0067,2023-03-03,2023,3
01/02/2023,3,77.5319,2023-02-03,2023,2
01/01/2023,3,74.2004,2023-01-03,2023,1
01/12/2022,3,17.9315,2022-12-03,2022,12
01/11/2022,3,13.8291,2022-11-03,2022,11
01/10/2022,3,17.9315,2022-10-03,2022,10
01/09/2022,3,9.8202,2022-09-03,2022,9
01/08/2022,3,11.2004,2022-08-03,2022,8
01/07/2022,3,13.5281,2022-07-03,2022,7
01/06/2022,3,15.995,2022-06-03,2022,6
01/05/2022,3,18.9266,2022-05-03,2022,5
01/04/2022,3,37.0313,2022-04-03,2022,4
01/03/2022,3,35.3772,2022-03-03,2022,3
01/02/2022,3,52.0448,2022-02-03,2022,2
01/01/2022,3,61.3191,2022-01-03,2022,1
01/12/2021,3,18.9717,2021-12-03,2021,12
01/11/2021,3,43.1138,2021-11-03,2021,11
01/10/2021,3,10.3899,2021-10-03,2021,10
01/09/2021,3,9.3072,2021-09-03,2021,9
01/08/2021,3,11.2271,2021-08-03,2021,8
01/07/2021,3,12.9637,2021-07-03,2021,7
01/06/2021,3,18.6373,2021-06-03,2021,6
01/05/2021,3,15.7167,2021-05-03,2021,5
01/04/2021,3,22.4206,2021-04-03,2021,4
01/03/2021,3,30.6388,2021-03-03,2021,3
01/02/2021,3,42.2396,2021-02-03,2021,2
01/01/2021,3,36.2012,2021-01-03,2021,1
01/12/2020,3,17.9315,2020-12-03,2020,12
01/11/2020,3,8.521,2020-11-03,2020,11
01/10/2020,3,7.2624,2020-10-03,2020,10
01/09/2020,3,8.0097,2020-09-03,2020,9
01/08/2020,3,9.8437,2020-08-03,2020,8
01/07/2020,3,12.0852,2020-07-03,2020,7
01/06/2020,3,15.09,2020-06-03,2020,6
01/05/2020,3,16.9947,2020-05-03,2020,5
01/04/2020,3,31.4265,2020-04-03,2020,4
01/03/2020,3,91.28,2020-03-03,2020,3
01/02/2020,3,30.1754,2020-02-03,2020,2
01/01/2020,3,26.4252,2020-01-03,2020,1
01/12/2019,3,13.8621,2019-12-03,2019,12
01/11/2019,3,10.9457,2019-11-03,2019,11
01/10/2019,3,9.3072,2019-10-03,2019,10
01/09/2019,3,10.1156,2019-09-03,2019,9
01/08/2019,3,8.2641,2019-08-03,2019,8
01/07/2019,3,10.1156,2019-07-03,2019,7
01/06/2019,3,12.3758,2019-06-03,2019,6
01/05/2019,3,15.4023,2019-05-03,2019,5
01/04/2019,3,20.6726,2019-04-03,2019,4
01/03/2019,3,104.4479,2019-03-03,2019,3
01/02/2019,3,14.4374,2019-02-03,2019,2
01/01/2019,3,23.4913,2019-01-03,2019,1
01/12/2018,3,81.473,2018-12-03,2018,12
01/11/2018,3,9.0426,2018-11-03,2018,11
01/10/2018,3,12.0852,2018-10-03,2018,10
01/09/2018,3,6.3039,2018-09-03,2018,9
01/08/2018,3,7.5088,2018-08-03,2018,8
01/07/2018,3,6.7776,2018-07-03,2018,7
01/06/2018,3,7.758,2018-06-03,2018,6
01/05/2018,3,8.7806,2018-05-03,2018,5
01/04/2018,3,11.7969,2018-04-03,2018,4
01/03/2018,3,22.0673,2018-03-03,2018,3
01/02/2018,3,22.7757,2018-02-03,2018,2
01/01/2018,3,19.5996,2018-01-03,2018,1
01/12/2017,3,21.3663,2017-12-03,2017,12
01/11/2017,3,10.3899,2017-11-03,2017,11
01/10/2017,3,27.5541,2017-10-03,2017,10
01/09/2017,3,7.758,2017-09-03,2017,9
01/08/2017,3,9.0426,2017-08-03,2017,8
01/07/2017,3,10.6666,2017-07-03,2017,7
01/06/2017,3,12.9637,2017-06-03,2017,6
01/05/2017,3,13.2609,2017-05-03,2017,5
01/04/2017,3,14.1659,2017-04-03,2017,4
01/03/2017,3,20.6234,2017-03-03,2017,3
01/02/2017,3,21.3663,2017-02-03,2017,2
01/01/2017,3,14.4718,2017-01-03,2017,1
01/12/2016,3,21.7158,2016-12-03,2016,12
01/11/2016,3,11.4834,2016-11-03,2016,11
01/10/2016,3,7.758,2016-10-03,2016,10
01/09/2016,3,12.0852,2016-09-03,2016,9
01/08/2016,3,10.9457,2016-08-03,2016,8
01/07/2016,3,13.8621,2016-07-03,2016,7
01/06/2016,3,26.7998,2016-06-03,2016,6
01/05/2016,3,17.3192,2016-05-03,2016,5
01/04/2016,3,26.7998,2016-04-03,2016,4
01/03/2016,3,29.8576,2016-03-03,2016,3
01/02/2016,3,32.1441,2016-02-03,2016,2
01/01/2016,3,32.1441,2016-01-03,2016,1
01/12/2015,3,62.3645,2015-12-03,2015,12
01/11/2015,3,18.9717,2015-11-03,2015,11
01/10/2015,3,7.5088,2015-10-03,2015,10
01/09/2015,3,6.7776,2015-09-03,2015,9
01/08/2015,3,7.2624,2015-08-03,2015,8
01/07/2015,3,9.0426,2015-07-03,2015,7
01/06/2015,3,12.3758,2015-06-03,2015,6
01/05/2015,3,12.0852,2015-05-03,2015,5
01/04/2015,3,20.6726,2015-04-03,2015,4
01/03/2015,3,11.015,2015-03-03,2015,3
01/02/2015,3,20.1072,2015-02-03,2015,2
01/01/2015,3,12.0529,2015-01-03,2015,1
01/10/2014,3,,2014-10-03,2014,10
01/09/2014,3,,2014-09-03,2014,9
01/08/2014,3,,2014-08-03,2014,8
01/07/2014,3,,2014-07-03,2014,7
01/06/2014,3,,2014-06-03,2014,6
01/05/2014,3,9.658,2014-05-03,2014,5
01/04/2014,3,21.2581,2014-04-03,2014,4
01/03/2014,3,12.4024,2014-03-03,2014,3
01/02/2014,3,13.1068,2014-02-03,2014,2
01/01/2014,3,23.5928,2014-01-03,2014,1
01/12/2013,3,80.3411,2013-12-03,2013,12
01/11/2013,3,13.8179,2013-11-03,2013,11
01/10/2013,3,36.6934,2013-10-03,2013,10
01/09/2013,3,12.7537,2013-09-03,2013,9
01/08/2013,3,17.4675,2013-08-03,2013,8
01/07/2013,3,21.6442,2013-07-03,2013,7
01/06/2013,3,27.5754,2013-06-03,2013,6
01/05/2013,3,25.9693,2013-05-03,2013,5
01/04/2013,3,35.8459,2013-04-03,2013,4
01/03/2013,3,58.8973,2013-03-03,2013,3
01/02/2013,3,100.2014,2013-02-03,2013,2
01/01/2013,3,24.776,2013-01-03,2013,1
01/12/2012,3,22.8098,2012-12-03,2012,12
01/11/2012,3,15.2595,2012-11-03,2012,11
01/10/2012,3,11.7051,2012-10-03,2012,10
01/09/2012,3,14.5355,2012-09-03,2012,9
01/08/2012,3,17.8405,2012-08-03,2012,8
01/07/2012,3,22.8098,2012-07-03,2012,7
01/06/2012,3,23.5928,2012-06-03,2012,6
01/05/2012,3,34.1617,2012-05-03,2012,5
01/04/2012,3,33.325,2012-04-03,2012,4
01/03/2012,3,33.325,2012-03-03,2012,3
01/02/2012,3,60.7491,2012-02-03,2012,2
01/01/2012,3,150.987,2012-01-03,2012,1
01/12/2011,3,35.002,2011-12-03,2011,12
01/11/2011,3,14.8967,2011-11-03,2011,11
01/10/2011,3,14.8967,2011-10-03,2011,10
01/09/2011,3,14.8967,2011-09-03,2011,9
01/08/2011,3,18.5907,2011-08-03,2011,8
01/07/2011,3,23.2007,2011-07-03,2011,7
01/06/2011,3,25.9693,2011-06-03,2011,6
01/05/2011,3,27.9796,2011-05-03,2011,5
01/04/2011,3,41.4151,2011-04-03,2011,4
01/03/2011,3,57.0558,2011-03-03,2011,3
01/02/2011,3,60.7491,2011-02-03,2011,2
01/01/2011,3,63.078,2011-01-03,2011,1
01/12/2010,3,26.7702,2010-12-03,2010,12
01/11/2010,3,30.0159,2010-11-03,2010,11
01/10/2010,3,17.4675,2010-10-03,2010,10
01/09/2010,3,12.4024,2010-09-03,2010,9
01/08/2010,3,15.9896,2010-08-03,2010,8
01/07/2010,3,18.9679,2010-07-03,2010,7
01/06/2010,3,,2010-06-03,2010,6
01/05/2010,3,28.7911,2010-05-03,2010,5
01/04/2010,3,35.002,2010-04-03,2010,4
01/03/2010,3,57.5152,2010-03-03,2010,3
01/02/2010,3,42.2843,2010-02-03,2010,2
01/01/2010,3,112.4707,2010-01-03,2010,1
01/12/2009,3,30.0159,2009-12-03,2009,12
01/11/2009,3,31.2496,2009-11-03,2009,11
01/10/2009,3,20.4895,2009-10-03,2009,10
01/09/2009,3,17.4675,2009-09-03,2009,9
01/08/2009,3,21.2581,2009-08-03,2009,8
01/07/2009,3,26.7702,2009-07-03,2009,7
01/06/2009,3,29.6066,2009-06-03,2009,6
01/05/2009,3,37.5443,2009-05-03,2009,5
01/04/2009,3,70.9125,2009-04-03,2009,4
01/03/2009,3,58.8973,2009-03-03,2009,3
01/02/2009,3,144.8982,2009-02-03,2009,2
01/01/2009,3,70.9125,2009-01-03,2009,1
01/12/2008,3,20.4895,2008-12-03,2008,12
01/11/2008,3,19.7261,2008-11-03,2008,11
01/10/2008,3,30.8374,2008-10-03,2008,10
01/09/2008,3,13.8179,2008-09-03,2008,9
01/08/2008,3,15.6238,2008-08-03,2008,8
01/07/2008,3,20.4895,2008-07-03,2008,7
01/06/2008,3,25.5704,2008-06-03,2008,6
01/05/2008,3,35.8459,2008-05-03,2008,5
01/04/2008,3,35.4235,2008-04-03,2008,4
01/03/2008,3,72.0035,2008-03-03,2008,3
01/02/2008,3,47.1204,2008-02-03,2008,2
01/01/2008,3,14.8967,2008-01-03,2008,1
01/12/2007,3,12.4024,2007-12-03,2007,12
01/11/2007,3,13.4615,2007-11-03,2007,11
01/10/2007,3,9.658,2007-10-03,2007,10
01/09/2007,3,11.3591,2007-09-03,2007,9
01/08/2007,3,14.8967,2007-08-03,2007,8
01/07/2007,3,16.7257,2007-07-03,2007,7
01/06/2007,3,23.2007,2007-06-03,2007,6
01/05/2007,3,23.5928,2007-05-03,2007,5
01/04/2007,3,29.1984,2007-04-03,2007,4
01/03/2007,3,38.8271,2007-03-03,2007,3
01/02/2007,3,120.0301,2007-02-03,2007,2
01/01/2007,3,88.9429,2007-01-03,2007,1
01/12/2006,3,40.9817,2006-12-03,2006,12
01/11/2006,3,18.2149,2006-11-03,2006,11
01/10/2006,3,11.015,2006-10-03,2006,10
01/09/2006,3,15.2595,2006-09-03,2006,9
01/08/2006,3,12.7537,2006-08-03,2006,8
01/07/2006,3,14.5355,2006-07-03,2006,7
01/06/2006,3,15.9896,2006-06-03,2006,6
01/05/2006,3,19.3463,2006-05-03,2006,5
01/04/2006,3,27.5754,2006-04-03,2006,4
01/03/2006,3,26.7702,2006-03-03,2006,3
01/02/2006,3,33.325,2006-02-03,2006,2
01/01/2006,3,46.677,2006-01-03,2006,1
01/12/2005,3,40.5492,2005-12-03,2005,12
01/11/2005,3,14.5355,2005-11-03,2005,11
01/10/2005,3,13.4615,2005-10-03,2005,10
01/09/2005,3,13.8179,2005-09-03,2005,9
01/08/2005,3,17.4675,2005-08-03,2005,8
01/07/2005,3,21.2581,2005-07-03,2005,7
01/06/2005,3,27.9796,2005-06-03,2005,6
01/05/2005,3,29.6066,2005-05-03,2005,5
01/04/2005,3,33.325,2005-04-03,2005,4
01/03/2005,3,46.2343,2005-03-03,2005,3
01/02/2005,3,73.6493,2005-02-03,2005,2
01/01/2005,3,40.1174,2005-01-03,2005,1
01/12/2004,3,24.3805,2004-12-03,2004,12
01/11/2004,3,17.4675,2004-11-03,2004,11
01/10/2004,3,12.7537,2004-10-03,2004,10
01/09/2004,3,11.7051,2004-09-03,2004,9
01/08/2004,3,15.6238,2004-08-03,2004,8
01/07/2004,3,18.9679,2004-07-03,2004,7
01/06/2004,3,30.4262,2004-06-03,2004,6
01/05/2004,3,27.9796,2004-05-03,2004,5
01/04/2004,3,30.8374,2004-04-03,2004,4
01/03/2004,3,47.5646,2004-03-03,2004,3
01/02/2004,3,63.5456,2004-02-03,2004,2
01/01/2004,3,26.7702,2004-01-03,2004,1
01/12/2003,3,24.3805,2003-12-03,2003,12
01/11/2003,3,15.2595,2003-11-03,2003,11
01/10/2003,3,8.3339,2003-10-03,2003,10
01/09/2003,3,11.7051,2003-09-03,2003,9
01/08/2003,3,11.7051,2003-08-03,2003,8
01/07/2003,3,13.4615,2003-07-03,2003,7
01/06/2003,3,16.7257,2003-06-03,2003,6
01/05/2003,3,19.3463,2003-05-03,2003,5
01/04/2003,3,25.9693,2003-04-03,2003,4
01/03/2003,3,28.7911,2003-03-03,2003,3
01/02/2003,3,86.6239,2003-02-03,2003,2
01/01/2003,3,39.2564,2003-01-03,2003,1
01/12/2002,3,13.1068,2002-12-03,2002,12
01/11/2002,3,16.7257,2002-11-03,2002,11
01/10/2002,3,11.015,2002-10-03,2002,10
01/09/2002,3,11.015,2002-09-03,2002,9
01/08/2002,3,12.4024,2002-08-03,2002,8
01/07/2002,3,13.1068,2002-07-03,2002,7
01/06/2002,3,16.3569,2002-06-03,2002,6
01/05/2002,3,18.9679,2002-05-03,2002,5
01/04/2002,3,28.7911,2002-04-03,2002,4
01/03/2002,3,38.3986,2002-03-03,2002,3
01/02/2002,3,128.3813,2002-02-03,2002,2
01/01/2002,3,64.0138,2002-01-03,2002,1
01/12/2001,3,49.7964,2001-12-03,2001,12
01/11/2001,3,8.3339,2001-11-03,2001,11
01/10/2001,3,24.3805,2001-10-03,2001,10
01/09/2001,3,9.9942,2001-09-03,2001,9
01/08/2001,3,6.4171,2001-08-03,2001,8
01/07/2001,3,8.0084,2001-07-03,2001,7
01/06/2001,3,11.015,2001-06-03,2001,6
01/05/2001,3,9.9942,2001-05-03,2001,5
01/04/2001,3,20.4895,2001-04-03,2001,4
01/03/2001,3,14.5355,2001-03-03,2001,3
01/02/2001,3,22.0315,2001-02-03,2001,2
01/01/2001,3,35.4235,2001-01-03,2001,1
01/12/2000,3,27.9796,2000-12-03,2000,12
01/11/2000,3,11.7051,2000-11-03,2000,11
01/10/2000,3,17.8405,2000-10-03,2000,10
01/09/2000,3,48.4551,2000-09-03,2000,9
01/08/2000,3,15.2595,2000-08-03,2000,8
01/07/2000,3,15.9896,2000-07-03,2000,7
01/06/2000,3,19.7261,2000-06-03,2000,6
01/05/2000,3,24.3805,2000-05-03,2000,5
01/04/2000,3,40.9817,2000-04-03,2000,4
01/03/2000,3,40.9817,2000-03-03,2000,3
01/02/2000,3,62.611,2000-02-03,2000,2
01/01/2000,3,158.5286,2000-01-03,2000,1
01/12/1999,3,8.0084,1999-12-03,1999,12
01/11/1999,3,8.3339,1999-11-03,1999,11
01/10/1999,3,8.6616,1999-10-03,1999,10
01/09/1999,3,10.3326,1999-09-03,1999,9
01/08/1999,3,14.1759,1999-08-03,1999,8
01/07/1999,3,16.3569,1999-07-03,1999,7
01/06/1999,3,17.8405,1999-06-03,1999,6
01/05/1999,3,22.4201,1999-05-03,1999,5
01/04/1999,3,32.0769,1999-04-03,1999,4
01/03/1999,3,65.4222,1999-03-03,1999,3
01/02/1999,3,63.078,1999-02-03,1999,2
01/01/1999,3,42.2843,1999-01-03,1999,1
01/12/1998,3,20.4895,1998-12-03,1998,12
01/11/1998,3,21.2581,1998-11-03,1998,11
01/10/1998,3,17.0959,1998-10-03,1998,10
01/09/1998,3,12.4024,1998-09-03,1998,9
01/08/1998,3,14.8967,1998-08-03,1998,8
01/07/1998,3,18.2149,1998-07-03,1998,7
01/06/1998,3,27.5754,1998-06-03,1998,6
01/05/1998,3,25.5704,1998-05-03,1998,5
01/04/1998,3,49.3486,1998-04-03,1998,4
01/03/1998,3,42.2843,1998-03-03,1998,3
01/02/1998,3,27.9796,1998-02-03,1998,2
01/01/1998,3,32.492,1998-01-03,1998,1
01/12/1997,3,41.8493,1997-12-03,1997,12
01/11/1997,3,15.2595,1997-11-03,1997,11
01/10/1997,3,19.7261,1997-10-03,1997,10
01/09/1997,3,16.3569,1997-09-03,1997,9
01/08/1997,3,20.8732,1997-08-03,1997,8
01/07/1997,3,25.5704,1997-07-03,1997,7
01/06/1997,3,28.7911,1997-06-03,1997,6
01/05/1997,3,33.7429,1997-05-03,1997,5
01/04/1997,3,53.8583,1997-04-03,1997,4
01/03/1997,3,60.2852,1997-03-03,1997,3
01/02/1997,3,99.599,1997-02-03,1997,2
01/01/1997,3,144.2263,1997-01-03,1997,1
01/12/1996,3,68.7452,1996-12-03,1996,12
01/11/1996,3,35.002,1996-11-03,1996,11
01/10/1996,3,16.3569,1996-10-03,1996,10
01/09/1996,3,12.4024,1996-09-03,1996,9
01/08/1996,3,14.5355,1996-08-03,1996,8
01/07/1996,3,18.9679,1996-07-03,1996,7
01/06/1996,3,20.4895,1996-06-03,1996,6
01/05/1996,3,25.9693,1996-05-03,1996,5
01/04/1996,3,32.0769,1996-04-03,1996,4
01/03/1996,3,39.2564,1996-03-03,1996,3
01/02/1996,3,51.5948,1996-02-03,1996,2
01/01/1996,3,62.1446,1996-01-03,1996,1
01/12/1995,3,16.3569,1995-12-03,1995,12
01/11/1995,3,22.8098,1995-11-03,1995,11
01/10/1995,3,16.7257,1995-10-03,1995,10
01/09/1995,3,10.3326,1995-09-03,1995,9
01/08/1995,3,13.4615,1995-08-03,1995,8
01/07/1995,3,16.7257,1995-07-03,1995,7
01/06/1995,3,20.8732,1995-06-03,1995,6
01/05/1995,3,22.4201,1995-05-03,1995,5
01/04/1995,3,41.4151,1995-04-03,1995,4
01/03/1995,3,39.6865,1995-03-03,1995,3
01/02/1995,3,87.7812,1995-02-03,1995,2
01/01/1995,3,70.9125,1995-01-03,1995,1
01/12/1994,3,15.2595,1994-12-03,1994,12
01/11/1994,3,13.1068,1994-11-03,1994,11
01/10/1994,3,11.7051,1994-10-03,1994,10
01/09/1994,3,14.8967,1994-09-03,1994,9
01/08/1994,3,18.9679,1994-08-03,1994,8
01/07/1994,3,23.9861,1994-07-03,1994,7
01/06/1994,3,30.4262,1994-06-03,1994,6
01/05/1994,3,25.5704,1994-05-03,1994,5
01/04/1994,3,43.1567,1994-04-03,1994,4
01/03/1994,3,148.2717,1994-03-03,1994,3
01/02/1994,3,49.3486,1994-02-03,1994,2
01/01/1994,3,56.1389,1994-01-03,1994,1
01/12/1993,3,32.908,1993-12-03,1993,12
01/11/1993,3,12.7537,1993-11-03,1993,11
01/10/1993,3,29.1984,1993-10-03,1993,10
01/09/1993,3,14.1759,1993-09-03,1993,9
01/08/1993,3,17.8405,1993-08-03,1993,8
01/07/1993,3,21.6442,1993-07-03,1993,7
01/06/1993,3,28.3848,1993-06-03,1993,6
01/05/1993,3,28.7911,1993-05-03,1993,5
01/04/1993,3,44.471,1993-04-03,1993,4
01/03/1993,3,78.0914,1993-03-03,1993,3
01/02/1993,3,41.8493,1993-02-03,1993,2
01/01/1993,3,24.776,1993-01-03,1993,1
01/12/1992,3,39.2564,1992-12-03,1992,12
01/11/1992,3,52.0461,1992-11-03,1992,11
01/10/1992,3,28.3848,1992-10-03,1992,10
01/09/1992,3,15.9896,1992-09-03,1992,9
01/08/1992,3,16.7257,1992-08-03,1992,8
01/07/1992,3,19.3463,1992-07-03,1992,7
01/06/1992,3,25.5704,1992-06-03,1992,6
01/05/1992,3,72.0035,1992-05-03,1992,5
01/04/1992,3,35.8459,1992-04-03,1992,4
01/03/1992,3,59.822,1992-03-03,1992,3
01/02/1992,3,119.3946,1992-02-03,1992,2
01/01/1992,3,35.002,1992-01-03,1992,1
01/12/1991,3,14.8967,1991-12-03,1991,12
01/11/1991,3,53.8583,1991-11-03,1991,11
01/10/1991,3,68.7452,1991-10-03,1991,10
01/09/1991,3,16.3569,1991-09-03,1991,9
01/08/1991,3,21.2581,1991-08-03,1991,8
01/07/1991,3,25.1726,1991-07-03,1991,7
01/06/1991,3,30.4262,1991-06-03,1991,6
01/05/1991,3,40.9817,1991-05-03,1991,5
01/04/1991,3,121.304,1991-04-03,1991,4
01/03/1991,3,72.5509,1991-03-03,1991,3
01/02/1991,3,65.8928,1991-02-03,1991,2
01/01/1991,3,19.7261,1991-01-03,1991,1
01/12/1990,3,14.8967,1990-12-03,1990,12
01/11/1990,3,17.5013,1990-11-03,1990,11
01/10/1990,3,12.8853,1990-10-03,1990,10
01/09/1990,3,20.6941,1990-09-03,1990,9
01/08/1990,3,14.809,1990-08-03,1990,8
01/07/1990,3,16.1375,1990-07-03,1990,7
01/06/1990,3,18.1962,1990-06-03,1990,6
01/05/1990,3,43.0134,1990-05-03,1990,5
01/04/1990,3,33.3128,1990-04-03,1990,4
01/03/1990,3,44.8593,1990-03-03,1990,3
01/02/1990,3,21.7951,1990-02-03,1990,2
01/01/1990,3,138.3789,1990-01-03,1990,1
01/12/1989,3,20.3311,1989-12-03,1989,12
01/11/1989,3,13.5171,1989-11-03,1989,11
01/10/1989,3,18.5468,1989-10-03,1989,10
01/09/1989,3,17.5013,1989-09-03,1989,9
01/08/1989,3,24.0504,1989-08-03,1989,8
01/07/1989,3,22.1661,1989-07-03,1989,7
01/06/1989,3,24.0504,1989-06-03,1989,6
01/05/1989,3,32.0517,1989-05-03,1989,5
01/04/1989,3,46.7293,1989-04-03,1989,4
01/03/1989,3,108.9958,1989-03-03,1989,3
01/02/1989,3,58.4395,1989-02-03,1989,2
01/01/1989,3,82.489,1989-01-03,1989,1
01/12/1988,3,32.8907,1988-12-03,1988,12
01/11/1988,3,27.1639,1988-11-03,1988,11
01/10/1988,3,17.1571,1988-10-03,1988,10
01/09/1988,3,15.1378,1988-09-03,1988,9
01/08/1988,3,18.8995,1988-08-03,1988,8
01/07/1988,3,22.914,1988-07-03,1988,7
01/06/1988,3,28.3618,1988-06-03,1988,6
01/05/1988,3,31.2195,1988-05-03,1988,5
01/04/1988,3,38.0656,1988-04-03,1988,4
01/03/1988,3,85.8874,1988-03-03,1988,3
01/02/1988,3,59.452,1988-02-03,1988,2
01/01/1988,3,119.5968,1988-01-03,1988,1
01/12/1987,3,32.8907,1987-12-03,1987,12
01/11/1987,3,19.2543,1987-11-03,1987,11
01/10/1987,3,21.4261,1987-10-03,1987,10
01/09/1987,3,17.5013,1987-09-03,1987,9
01/08/1987,3,21.4261,1987-08-03,1987,8
01/07/1987,3,26.3744,1987-07-03,1987,7
01/06/1987,3,25.9738,1987-06-03,1987,6
01/05/1987,3,30.3673,1987-05-03,1987,5
01/04/1987,3,43.4741,1987-04-03,1987,4
01/03/1987,3,33.5054,1987-03-03,1987,3
01/02/1987,3,44.4081,1987-02-03,1987,2
01/01/1987,3,78.5226,1987-01-03,1987,1
01/12/1986,3,28.4912,1986-12-03,1986,12
01/11/1986,3,12.0575,1986-11-03,1986,11
01/10/1986,3,15.7906,1986-10-03,1986,10
01/09/1986,3,18.8801,1986-09-03,1986,9
01/08/1986,3,20.6929,1986-08-03,1986,8
01/07/1986,3,23.5829,1986-07-03,1986,7
01/06/1986,3,28.1238,1986-06-03,1986,6
01/05/1986,3,29.2338,1986-05-03,1986,5
01/04/1986,3,41.6386,1986-04-03,1986,4
01/03/1986,3,58.028,1986-03-03,1986,3
01/02/1986,3,55.6836,1986-02-03,1986,2
01/01/1986,3,84.1297,1986-01-03,1986,1
01/12/1985,3,36.3899,1985-12-03,1985,12
01/11/1985,3,37.2379,1985-11-03,1985,11
01/10/1985,3,23.5829,1985-10-03,1985,10
01/09/1985,3,15.5246,1985-09-03,1985,9
01/08/1985,3,17.7218,1985-08-03,1985,8
01/07/1985,3,20.6929,1985-07-03,1985,7
01/06/1985,3,24.2532,1985-06-03,1985,6
01/05/1985,3,29.609,1985-05-03,1985,5
01/04/1985,3,52.2719,1985-04-03,1985,4
01/03/1985,3,73.6416,1985-03-03,1985,3
01/02/1985,3,106.6959,1985-02-03,1985,2
01/01/1985,3,27.3968,1985-01-03,1985,1
01/12/1984,3,41.1864,1984-12-03,1984,12
01/11/1984,3,11.601,1984-11-03,1984,11
01/10/1984,3,15.2611,1984-10-03,1984,10
01/09/1984,3,15.7906,1984-09-03,1984,9
01/08/1984,3,15.5246,1984-08-03,1984,8
01/07/1984,3,18.296,1984-07-03,1984,7
01/06/1984,3,21.6333,1984-06-03,1984,6
01/05/1984,3,31.9153,1984-05-03,1984,5
01/04/1984,3,28.8612,1984-04-03,1984,4
01/03/1984,3,40.2902,1984-03-03,1984,3
01/02/1984,3,46.7905,1984-02-03,1984,2
01/01/1984,3,131.1018,1984-01-03,1984,1
01/12/1983,3,63.8515,1983-12-03,1983,12
01/11/1983,3,154.6355,1983-11-03,1983,11
01/10/1983,3,52.7867,1983-10-03,1983,10
01/09/1983,3,27.3968,1983-09-03,1983,9
01/08/1983,3,35.1378,1983-08-03,1983,8
01/07/1983,3,47.2752,1983-07-03,1983,7
01/06/1983,3,89.9301,1983-06-03,1983,6
01/05/1983,3,51.7599,1983-05-03,1983,5
01/04/1983,3,62.8616,1983-04-03,1983,4
01/03/1983,3,134.6658,1983-03-03,1983,3
01/02/1983,3,138.9982,1983-02-03,1983,2
01/01/1983,3,157.6972,1983-01-03,1983,1
01/12/1982,3,72.0494,1982-12-03,1982,12
01/11/1982,3,27.0371,1982-11-03,1982,11
01/10/1982,3,18.5868,1982-10-03,1982,10
01/09/1982,3,17.7218,1982-09-03,1982,9
01/08/1982,3,21.9519,1982-08-03,1982,8
01/07/1982,3,26.3257,1982-07-03,1982,7
01/06/1982,3,31.9153,1982-06-03,1982,6
01/05/1982,3,38.966,1982-05-03,1982,5
01/04/1982,3,85.2743,1982-04-03,1982,4
01/03/1982,3,76.8782,1982-03-03,1982,3
01/02/1982,3,58.9792,1982-02-03,1982,2
01/01/1982,3,117.2694,1982-01-03,1982,1
01/12/1981,3,42.0934,1981-12-03,1981,12
01/11/1981,3,26.3257,1981-11-03,1981,11
01/10/1981,3,15.5246,1981-10-03,1981,10
01/09/1981,3,16.33,1981-09-03,1981,9
01/08/1981,3,18.0076,1981-08-03,1981,8
01/07/1981,3,21.6333,1981-07-03,1981,7
01/06/1981,3,24.5922,1981-06-03,1981,6
01/05/1981,3,35.9699,1981-05-03,1981,5
01/04/1981,3,48.7455,1981-04-03,1981,4
01/03/1981,3,41.6386,1981-03-03,1981,3
01/02/1981,3,61.3912,1981-02-03,1981,2
01/01/1981,3,109.298,1981-01-03,1981,1
01/12/1980,3,166.2529,1980-12-03,1980,12
01/11/1980,3,12.0575,1980-11-03,1980,11
01/10/1980,3,13.9802,1980-10-03,1980,10
01/09/1980,3,16.33,1980-09-03,1980,9
01/08/1980,3,19.176,1980-08-03,1980,8
01/07/1980,3,24.9337,1980-07-03,1980,7
01/06/1980,3,25.6245,1980-06-03,1980,6
01/05/1980,3,33.9096,1980-05-03,1980,5
01/04/1980,3,45.8294,1980-04-03,1980,4
01/03/1980,3,43.4741,1980-03-03,1980,3
01/02/1980,3,122.0333,1980-02-03,1980,2
01/01/1980,3,72.5782,1980-01-03,1980,1
01/12/1979,3,21.6333,1979-12-03,1979,12
01/11/1979,3,31.9153,1979-11-03,1979,11
01/10/1979,3,27.0371,1979-10-03,1979,10
01/09/1979,3,16.059,1979-09-03,1979,9
01/08/1979,3,17.4385,1979-08-03,1979,8
01/07/1979,3,18.5868,1979-07-03,1979,7
01/06/1979,3,23.9167,1979-06-03,1979,6
01/05/1979,3,28.8612,1979-05-03,1979,5
01/04/1979,3,38.966,1979-04-03,1979,4
01/03/1979,3,82.4273,1979-03-03,1979,3
01/02/1979,3,46.3086,1979-02-03,1979,2
01/01/1979,3,49.241,1979-01-03,1979,1
01/12/1978,3,23.9167,1978-12-03,1978,12
01/11/1978,3,41.1864,1978-11-03,1978,11
01/10/1978,3,10.5016,1978-10-03,1978,10
01/09/1978,3,14.4852,1978-09-03,1978,9
01/08/1978,3,14.7414,1978-08-03,1978,8
01/07/1978,3,16.33,1978-07-03,1978,7
01/06/1978,3,22.273,1978-06-03,1978,6
01/05/1978,3,21.3173,1978-05-03,1978,5
01/04/1978,3,27.0371,1978-04-03,1978,4
01/03/1978,3,29.2338,1978-03-03,1978,3
01/02/1978,3,33.9096,1978-02-03,1978,2
01/01/1978,3,28.4912,1978-01-03,1978,1
01/12/1977,3,56.1486,1977-12-03,1977,12
01/11/1977,3,13.241,1977-11-03,1977,11
01/10/1977,3,16.6034,1977-10-03,1977,10
01/09/1977,3,22.9228,1977-09-03,1977,9
01/08/1977,3,13.7314,1977-08-03,1977,8
01/07/1977,3,16.8793,1977-07-03,1977,7
01/06/1977,3,20.0786,1977-06-03,1977,6
01/05/1977,3,26.6801,1977-05-03,1977,5
01/04/1977,3,46.3086,1977-04-03,1977,4
01/03/1977,3,28.4912,1977-03-03,1977,3
01/02/1977,3,105.4053,1977-02-03,1977,2
01/01/1977,3,53.3042,1977-01-03,1977,1
01/12/1976,3,60.905,1976-12-03,1976,12
01/11/1976,3,26.3257,1976-11-03,1976,11
01/10/1976,3,22.9228,1976-10-03,1976,10
01/09/1976,3,16.6034,1976-09-03,1976,9
01/08/1976,3,15.7906,1976-08-03,1976,8
01/07/1976,3,17.7218,1976-07-03,1976,7
01/06/1976,3,20.0786,1976-06-03,1976,6
01/05/1976,3,19.7752,1976-05-03,1976,5
01/04/1976,3,27.0371,1976-04-03,1976,4
01/03/1976,3,35.9699,1976-03-03,1976,3
01/02/1976,3,38.966,1976-02-03,1976,2
01/01/1976,3,28.8612,1976-01-03,1976,1
01/12/1975,3,52.2719,1975-12-03,1975,12
01/11/1975,3,16.059,1975-11-03,1975,11
01/10/1975,3,12.2894,1975-10-03,1975,10
01/09/1975,3,10.2889,1975-09-03,1975,9
01/08/1975,3,12.5237,1975-08-03,1975,8
01/07/1975,3,18.296,1975-07-03,1975,7
01/06/1975,3,15.7906,1975-06-03,1975,6
01/05/1975,3,18.8801,1975-05-03,1975,5
01/04/1975,3,30.3673,1975-04-03,1975,4
01/03/1975,3,58.9792,1975-03-03,1975,3
01/02/1975,3,46.7905,1975-02-03,1975,2
01/01/1975,3,128.9836,1975-01-03,1975,1
01/12/1974,3,12.2894,1974-12-03,1974,12
01/11/1974,3,18.8801,1974-11-03,1974,11
01/10/1974,3,10.7167,1974-10-03,1974,10
01/09/1974,3,8.8786,1974-09-03,1974,9
01/08/1974,3,12.0181,1974-08-03,1974,8
01/07/1974,3,18.8746,1974-07-03,1974,7
01/06/1974,3,18.8746,1974-06-03,1974,6
01/05/1974,3,25.5892,1974-05-03,1974,5
01/04/1974,3,49.9096,1974-04-03,1974,4
01/03/1974,3,23.6779,1974-03-03,1974,3
01/02/1974,3,56.2867,1974-02-03,1974,2
01/01/1974,3,81.8872,1974-01-03,1974,1
01/12/1973,3,13.6649,1973-12-03,1973,12
01/11/1973,3,55.365,1973-11-03,1973,11
01/10/1973,3,7.6867,1973-10-03,1973,10
01/09/1973,3,9.1826,1973-09-03,1973,9
01/08/1973,3,14.6757,1973-08-03,1973,8
01/07/1973,3,14.0,1973-07-03,1973,7
01/06/1973,3,15.3585,1973-06-03,1973,6
01/05/1973,3,18.1583,1973-05-03,1973,5
01/04/1973,3,67.6081,1973-04-03,1973,4
01/03/1973,3,26.363,1973-03-03,1973,3
01/02/1973,3,47.6753,1973-02-03,1973,2
01/01/1973,3,68.0899,1973-01-03,1973,1
01/12/1972,3,41.5472,1972-12-03,1972,12
01/11/1972,3,53.5322,1972-11-03,1972,11
01/10/1972,3,16.0483,1972-10-03,1972,10
01/09/1972,3,9.4889,1972-09-03,1972,9
01/08/1972,3,11.3731,1972-08-03,1972,8
01/07/1972,3,11.0537,1972-07-03,1972,7
01/06/1972,3,15.0162,1972-06-03,1972,6
01/05/1972,3,19.9608,1972-05-03,1972,5
01/04/1972,3,32.3283,1972-04-03,1972,4
01/03/1972,3,79.881,1972-03-03,1972,3
01/02/1972,3,26.363,1972-02-03,1972,2
01/01/1972,3,37.2916,1972-01-03,1972,1
01/12/1971,3,48.5662,1971-12-03,1971,12
01/11/1971,3,30.7107,1971-11-03,1971,11
01/10/1971,3,14.0,1971-10-03,1971,10
01/09/1971,3,2.2111,1971-09-03,1971,9
01/08/1971,3,4.3725,1971-08-03,1971,8
01/07/1971,3,6.5357,1971-07-03,1971,7
01/06/1971,3,3.6159,1971-06-03,1971,6
01/05/1971,3,5.7016,1971-05-03,1971,5
01/04/1971,3,10.7365,1971-04-03,1971,4
01/03/1971,3,6.2548,1971-03-03,1971,3
01/02/1971,3,9.4889,1971-02-03,1971,2
01/01/1971,3,21.0606,1971-01-03,1971,1
01/12/1970,3,17.4484,1970-12-03,1970,12
01/11/1970,3,11.6946,1970-11-03,1970,11
01/10/1970,3,15.7026,1970-10-03,1970,10
01/09/1970,3,13.6649,1970-09-03,1970,9
01/08/1970,3,9.1826,1970-08-03,1970,8
01/07/1970,3,11.3731,1970-07-03,1970,7
01/06/1970,3,12.0181,1970-06-03,1970,6
01/05/1970,3,18.5157,1970-05-03,1970,5
01/04/1970,3,38.5572,1970-04-03,1970,4
01/03/1970,3,30.7107,1970-03-03,1970,3
01/02/1970,3,36.0357,1970-02-03,1970,2
01/01/1970,3,22.1737,1970-01-03,1970,1
01/12/1969,3,38.9812,1969-12-03,1969,12
01/11/1969,3,15.0162,1969-11-03,1969,11
01/10/1969,3,6.5357,1969-10-03,1969,10
01/09/1969,3,6.8195,1969-09-03,1969,9
01/08/1969,3,13.0004,1969-08-03,1969,8
01/07/1969,3,11.6946,1969-07-03,1969,7
01/06/1969,3,18.5157,1969-06-03,1969,6
01/05/1969,3,17.4484,1969-05-03,1969,5
01/04/1969,3,29.1123,1969-04-03,1969,4
01/03/1969,3,69.0559,1969-03-03,1969,3
01/02/1969,3,48.1203,1969-02-03,1969,2
01/01/1969,3,17.0959,1969-01-03,1969,1
01/12/1968,3,96.2387,1968-12-03,1968,12
01/11/1968,3,11.6946,1968-11-03,1968,11
01/10/1968,3,7.981,1968-10-03,1968,10
01/09/1968,3,8.2778,1968-09-03,1968,9
01/08/1968,3,9.1826,1968-08-03,1968,8
01/07/1968,3,10.1083,1968-07-03,1968,7
01/06/1968,3,13.0004,1968-06-03,1968,6
01/05/1968,3,16.0483,1968-05-03,1968,5
01/04/1968,3,21.8012,1968-04-03,1968,4
01/03/1968,3,38.1342,1968-03-03,1968,3
01/02/1968,3,26.363,1968-02-03,1968,2
01/01/1968,3,38.9812,1968-01-03,1968,1
01/12/1967,3,41.1169,1967-12-03,1967,12
01/11/1967,3,23.2997,1967-11-03,1967,11
01/10/1967,3,10.1083,1967-10-03,1967,10
01/09/1967,3,12.3436,1967-09-03,1967,9
01/08/1967,3,16.3958,1967-08-03,1967,8
01/07/1967,3,20.6925,1967-07-03,1967,7
01/06/1967,3,23.6779,1967-06-03,1967,6
01/05/1967,3,53.0762,1967-05-03,1967,5
01/04/1967,3,47.2312,1967-04-03,1967,4
01/03/1967,3,46.346,1967-03-03,1967,3
01/02/1967,3,122.7207,1967-02-03,1967,2
01/01/1967,3,65.6887,1967-01-03,1967,1
01/12/1966,3,31.5171,1966-12-03,1966,12
01/11/1966,3,67.127,1966-11-03,1966,11
01/10/1966,3,13.6649,1966-10-03,1966,10
01/09/1966,3,14.3369,1966-09-03,1966,9
01/08/1966,3,21.4302,1966-08-03,1966,8
01/07/1966,3,21.4302,1966-07-03,1966,7
01/06/1966,3,27.5336,1966-06-03,1966,6
01/05/1966,3,33.9647,1966-05-03,1966,5
01/04/1966,3,80.3815,1966-04-03,1966,4
01/03/1966,3,79.3813,1966-03-03,1966,3
01/02/1966,3,94.1564,1966-02-03,1966,2
01/01/1966,3,105.4053,1966-01-03,1966,1
01/12/1965,3,38.1342,1965-12-03,1965,12
01/11/1965,3,30.7107,1965-11-03,1965,11
01/10/1965,3,45.9049,1965-10-03,1965,10
01/09/1965,3,20.3259,1965-09-03,1965,9
01/08/1965,3,24.8206,1965-08-03,1965,8
01/07/1965,3,29.1123,1965-07-03,1965,7
01/06/1965,3,34.7897,1965-06-03,1965,6
01/05/1965,3,44.1499,1965-05-03,1965,5
01/04/1965,3,55.8254,1965-04-03,1965,4
01/03/1965,3,96.2387,1965-03-03,1965,3
01/02/1965,3,107.3439,1965-02-03,1965,2
01/01/1965,3,80.8827,1965-01-03,1965,1
01/12/1964,3,29.909,1964-12-03,1964,12
01/11/1964,3,36.0357,1964-11-03,1964,11
01/10/1964,3,19.9608,1964-10-03,1964,10
01/09/1964,3,6.8195,1964-09-03,1964,9
01/08/1964,3,9.1826,1964-08-03,1964,8
01/07/1964,3,9.7975,1964-07-03,1964,7
01/06/1964,3,13.3317,1964-06-03,1964,6
01/05/1964,3,24.8206,1964-05-03,1964,5
01/04/1964,3,32.3283,1964-04-03,1964,4
01/03/1964,3,92.0846,1964-03-03,1964,3
01/02/1964,3,143.3909,1964-02-03,1964,2
01/01/1964,3,45.9049,1964-01-03,1964,1
01/12/1963,3,8.577,1963-12-03,1963,12
01/11/1963,3,25.2042,1963-11-03,1963,11
01/10/1963,3,4.6318,1963-10-03,1963,10
01/09/1963,3,8.2778,1963-09-03,1963,9
01/08/1963,3,12.671,1963-08-03,1963,8
01/07/1963,3,15.3585,1963-07-03,1963,7
01/06/1963,3,18.1583,1963-06-03,1963,6
01/05/1963,3,21.8012,1963-05-03,1963,5
01/04/1963,3,33.5539,1963-04-03,1963,4
01/03/1963,3,46.7882,1963-03-03,1963,3
01/02/1963,3,56.2867,1963-02-03,1963,2
01/01/1963,3,128.9836,1963-01-03,1963,1
01/12/1962,3,55.8254,1962-12-03,1962,12
01/11/1962,3,42.1017,1962-11-03,1962,11
01/10/1962,3,23.8136,1962-10-03,1962,10
01/09/1962,3,5.391,1962-09-03,1962,9
01/08/1962,3,5.9963,1962-08-03,1962,8
01/07/1962,3,8.0494,1962-07-03,1962,7
01/06/1962,3,11.678,1962-06-03,1962,6
01/05/1962,3,44.8347,1962-05-03,1962,5
01/04/1962,3,25.7647,1962-04-03,1962,4
01/03/1962,3,61.0906,1962-03-03,1962,3
01/02/1962,3,107.3439,1962-02-03,1962,2
01/01/1962,3,19.3328,1962-01-03,1962,1
01/12/1961,3,8.0494,1961-12-03,1961,12
01/11/1961,3,7.0921,1961-11-03,1961,11
01/10/1961,3,3.4924,1961-10-03,1961,10
01/09/1961,3,17.2994,1961-09-03,1961,9
01/08/1961,3,8.8155,1961-08-03,1961,8
01/07/1961,3,12.9603,1961-07-03,1961,7
01/06/1961,3,19.3328,1961-06-03,1961,6
01/05/1961,3,49.8681,1961-05-03,1961,5
01/04/1961,3,49.1294,1961-04-03,1961,4
01/03/1961,3,113.9179,1961-03-03,1961,3
01/02/1961,3,68.3545,1961-02-03,1961,2
01/01/1961,3,128.9836,1961-01-03,1961,1
01/12/1960,3,68.3545,1960-12-03,1960,12
01/11/1960,3,8.3001,1960-11-03,1960,11
01/10/1960,3,15.4001,1960-10-03,1960,10
01/09/1960,3,6.6405,1960-09-03,1960,9
01/08/1960,3,8.3001,1960-08-03,1960,8
01/07/1960,3,12.6322,1960-07-03,1960,7
01/06/1960,3,16.9089,1960-06-03,1960,6
01/05/1960,3,47.6716,1960-05-03,1960,5
01/04/1960,3,42.1017,1960-04-03,1960,4
01/03/1960,3,108.6449,1960-03-03,1960,3
01/02/1960,3,71.5774,1960-02-03,1960,2
01/01/1960,3,26.2669,1960-01-03,1960,1
01/12/1959,3,22.8725,1959-12-03,1959,12
01/11/1959,3,22.8725,1959-11-03,1959,11
01/10/1959,3,8.5555,1959-10-03,1959,10
01/09/1959,3,9.6238,1959-09-03,1959,9
01/08/1959,3,10.7685,1959-08-03,1959,8
01/07/1959,3,13.6317,1959-07-03,1959,7
01/06/1959,3,18.0965,1959-06-03,1959,6
01/05/1959,3,25.7647,1959-05-03,1959,5
01/04/1959,3,87.4754,1959-04-03,1959,4
01/03/1959,3,28.0019,1959-03-03,1959,3
01/02/1959,3,42.3737,1959-02-03,1959,2
01/01/1959,3,45.5338,1959-01-03,1959,1
01/12/1958,3,25.4235,1958-12-03,1958,12
01/11/1958,3,44.7351,1958-11-03,1958,11
01/10/1958,3,23.5569,1958-10-03,1958,10
01/09/1958,3,19.4307,1958-09-03,1958,9
01/08/1958,3,23.5569,1958-08-03,1958,8
01/07/1958,3,27.0231,1958-07-03,1958,7
01/06/1958,3,32.0579,1958-06-03,1958,6
01/05/1958,3,28.9949,1958-05-03,1958,5
01/04/1958,3,31.7114,1958-04-03,1958,4
01/03/1958,3,47.5557,1958-03-03,1958,3
01/02/1958,3,49.6133,1958-02-03,1958,2
01/01/1958,3,35.6072,1958-01-03,1958,1
01/12/1957,3,30.6811,1957-12-03,1957,12
01/11/1957,3,25.6898,1957-11-03,1957,11
01/10/1957,3,33.4899,1957-10-03,1957,10
01/09/1957,3,27.9947,1957-09-03,1957,9
01/08/1957,3,32.9658,1957-08-03,1957,8
01/07/1957,3,36.2369,1957-07-03,1957,7
01/06/1957,3,42.5612,1957-06-03,1957,6
01/05/1957,3,49.8866,1957-05-03,1957,5
01/04/1957,3,72.9154,1957-04-03,1957,4
01/03/1957,3,58.3046,1957-03-03,1957,3
01/02/1957,3,51.1495,1957-02-03,1957,2
01/01/1957,3,49.8866,1957-01-03,1957,1
01/12/1956,3,26.5975,1956-12-03,1956,12
01/11/1956,3,25.243,1956-11-03,1956,11
01/10/1956,3,23.0793,1956-10-03,1956,10
01/09/1956,3,17.2711,1956-09-03,1956,9
01/08/1956,3,28.4699,1956-08-03,1956,8
01/07/1956,3,21.8365,1956-07-03,1956,7
01/06/1956,3,36.796,1956-06-03,1956,6
01/05/1956,3,32.4467,1956-05-03,1956,5
01/04/1956,3,42.5612,1956-04-03,1956,4
01/03/1956,3,103.4824,1956-03-03,1956,3
01/02/1956,3,27.5242,1956-02-03,1956,2
01/01/1956,3,106.0498,1956-01-03,1956,1
01/12/1955,3,13.3322,1955-12-03,1955,12
01/11/1955,3,27.5242,1955-11-03,1955,11
01/10/1955,3,9.7353,1955-10-03,1955,10
01/09/1955,3,12.4417,1955-09-03,1955,9
01/08/1955,3,15.2253,1955-08-03,1955,8
01/07/1955,3,15.2253,1955-07-03,1955,7
01/06/1955,3,21.0308,1955-06-03,1955,6
01/05/1955,3,22.2462,1955-05-03,1955,5
01/04/1955,3,35.681,1955-04-03,1955,4
01/03/1955,3,43.7517,1955-03-03,1955,3
01/02/1955,3,30.9188,1955-02-03,1955,2
01/01/1955,3,34.579,1955-01-03,1955,1
01/12/1954,3,7.4168,1954-12-03,1954,12
01/11/1954,3,10.7702,1954-11-03,1954,11
01/10/1954,3,11.0388,1954-10-03,1954,10
01/09/1954,3,7.4168,1954-09-03,1954,9
01/08/1954,3,8.299,1954-08-03,1954,8
01/07/1954,3,9.2412,1954-07-03,1954,7
01/06/1954,3,12.7345,1954-06-03,1954,6
01/05/1954,3,15.5556,1954-05-03,1954,5
01/04/1954,3,20.2432,1954-04-03,1954,4
01/03/1954,3,17.9877,1954-03-03,1954,3
01/02/1954,3,14.5775,1954-02-03,1954,2
01/01/1954,3,27.5242,1954-01-03,1954,1
01/12/1953,3,37.9238,1953-12-03,1953,12
01/11/1953,3,27.9947,1953-11-03,1953,11
01/10/1953,3,7.6318,1953-10-03,1953,10
01/09/1953,3,14.5404,1953-09-03,1953,9
01/08/1953,3,16.0342,1953-08-03,1953,8
01/07/1953,3,17.1942,1953-07-03,1953,7
01/06/1953,3,23.0441,1953-06-03,1953,6
01/05/1953,3,24.389,1953-05-03,1953,5
01/04/1953,3,30.0813,1953-04-03,1953,4
01/03/1953,3,24.8443,1953-03-03,1953,3
01/02/1953,3,16.8038,1953-02-03,1953,2
01/01/1953,3,48.8074,1953-01-03,1953,1
01/12/1952,3,19.2017,1952-12-03,1952,12
01/11/1952,3,44.0666,1952-11-03,1952,11
01/10/1952,3,11.0759,1952-10-03,1952,10
01/09/1952,3,12.074,1952-09-03,1952,9
01/08/1952,3,13.8163,1952-08-03,1952,8
01/07/1952,3,16.8038,1952-07-03,1952,7
01/06/1952,3,18.3877,1952-06-03,1952,6
01/05/1952,3,25.3031,1952-05-03,1952,5
01/04/1952,3,45.2329,1952-04-03,1952,4
01/03/1952,3,62.1062,1952-03-03,1952,3
01/02/1952,3,55.0137,1952-02-03,1952,2
01/01/1952,3,24.8443,1952-01-03,1952,1
01/12/1951,3,55.6512,1951-12-03,1951,12
01/11/1951,3,15.2797,1951-11-03,1951,11
01/10/1951,3,11.4046,1951-10-03,1951,10
01/09/1951,3,12.4147,1951-09-03,1951,9
01/08/1951,3,14.1764,1951-08-03,1951,8
01/07/1951,3,16.4172,1951-07-03,1951,7
01/06/1951,3,18.7929,1951-06-03,1951,6
01/05/1951,3,23.0441,1951-05-03,1951,5
01/04/1951,3,38.4266,1951-04-03,1951,4
01/03/1951,3,34.148,1951-03-03,1951,3
01/02/1951,3,64.1596,1951-02-03,1951,2
01/01/1951,3,32.5979,1951-01-03,1951,1
01/12/1950,3,48.2038,1950-12-03,1950,12
01/11/1950,3,16.4172,1950-11-03,1950,11
01/10/1950,3,14.5404,1950-10-03,1950,10
01/09/1950,3,13.1077,1950-09-03,1950,9
01/08/1950,3,16.4172,1950-08-03,1950,8
01/07/1950,3,21.3004,1950-07-03,1950,7
01/06/1950,3,23.0441,1950-06-03,1950,6
01/05/1950,3,37.8803,1950-05-03,1950,5
01/04/1950,3,41.2065,1950-04-03,1950,4
01/03/1950,3,58.8845,1950-03-03,1950,3
01/02/1950,3,62.1062,1950-02-03,1950,2
01/01/1950,3,25.3031,1950-01-03,1950,1
01/12/1949,3,25.3031,1949-12-03,1949,12
01/11/1949,3,13.1077,1949-11-03,1949,11
01/10/1949,3,9.4927,1949-10-03,1949,10
01/09/1949,3,13.1077,1949-09-03,1949,9
01/08/1949,3,19.2017,1949-08-03,1949,8
01/07/1949,3,23.4888,1949-07-03,1949,7
01/06/1949,3,26.7005,1949-06-03,1949,6
01/05/1949,3,32.5979,1949-05-03,1949,5
01/04/1949,3,33.1113,1949-04-03,1949,4
01/03/1949,3,44.0666,1949-03-03,1949,3
01/02/1949,3,89.2617,1949-02-03,1949,2
01/01/1949,3,41.2065,1949-01-03,1949,1
01/12/1948,3,39.5289,1948-12-03,1948,12
01/11/1948,3,14.2014,1948-11-03,1948,11
01/10/1948,3,16.0472,1948-10-03,1948,10
01/09/1948,3,13.8424,1948-09-03,1948,9
01/08/1948,3,17.9764,1948-08-03,1948,8
01/07/1948,3,19.5781,1948-07-03,1948,7
01/06/1948,3,32.3181,1948-06-03,1948,6
01/05/1948,3,27.2849,1948-05-03,1948,5
01/04/1948,3,42.2414,1948-04-03,1948,4
01/03/1948,3,43.8471,1948-03-03,1948,3
01/02/1948,3,40.6457,1948-02-03,1948,2
01/01/1948,3,42.7755,1948-01-03,1948,1
01/12/1947,3,58.088,1947-12-03,1947,12
01/11/1947,3,28.2801,1947-11-03,1947,11
01/10/1947,3,20.8128,1947-10-03,1947,10
01/09/1947,3,24.3361,1947-09-03,1947,9
01/08/1947,3,19.9865,1947-08-03,1947,8
01/07/1947,3,23.366,1947-07-03,1947,7
01/06/1947,3,26.2958,1947-06-03,1947,6
01/05/1947,3,33.3414,1947-05-03,1947,5
01/04/1947,3,51.8127,1947-04-03,1947,4
01/03/1947,3,81.6364,1947-03-03,1947,3
01/02/1947,3,38.0096,1947-02-03,1947,2
01/01/1947,3,63.6435,1947-01-03,1947,1
01/12/1946,3,18.372,1946-12-03,1946,12
01/11/1946,3,16.809,1946-11-03,1946,11
01/10/1946,3,15.6713,1946-10-03,1946,10
01/09/1946,3,13.487,1946-09-03,1946,9
01/08/1946,3,16.4265,1946-08-03,1946,8
01/07/1946,3,17.9764,1946-07-03,1946,7
01/06/1946,3,20.3981,1946-06-03,1946,6
01/05/1946,3,25.3128,1946-05-03,1946,5
01/04/1946,3,52.7575,1946-04-03,1946,4
01/03/1946,3,36.4422,1946-03-03,1946,3
01/02/1946,3,55.1524,1946-02-03,1946,2
01/01/1946,3,234.3822,1946-01-03,1946,1
01/12/1945,3,20.8128,1945-12-03,1945,12
01/11/1945,3,16.809,1945-11-03,1945,11
01/10/1945,3,10.1274,1945-10-03,1945,10
01/09/1945,3,11.0973,1945-09-03,1945,9
01/08/1945,3,11.7622,1945-08-03,1945,8
01/07/1945,3,14.5638,1945-07-03,1945,7
01/06/1945,3,15.6713,1945-06-03,1945,6
01/05/1945,3,18.372,1945-05-03,1945,5
01/04/1945,3,46.0034,1945-04-03,1945,4
01/03/1945,3,48.1767,1945-03-03,1945,3
01/02/1945,3,99.6834,1945-02-03,1945,2
01/01/1945,3,11.7622,1945-01-03,1945,1
01/12/1944,3,17.9764,1944-12-03,1944,12
01/11/1944,3,14.5638,1944-11-03,1944,11
01/10/1944,3,10.447,1944-10-03,1944,10
01/09/1944,3,23.366,1944-09-03,1944,9
01/08/1944,3,13.8424,1944-08-03,1944,8
01/07/1944,3,16.809,1944-07-03,1944,7
01/06/1944,3,18.7709,1944-06-03,1944,6
01/05/1944,3,22.5026,1944-05-03,1944,5
01/04/1944,3,54.6697,1944-04-03,1944,4
01/03/1944,3,71.5774,1944-03-03,1944,3
01/02/1944,3,30.2879,1944-02-03,1944,2
01/01/1944,3,34.886,1944-01-03,1944,1
01/12/1943,3,43.8471,1943-12-03,1943,12
01/11/1943,3,17.584,1943-11-03,1943,11
01/10/1943,3,13.8424,1943-10-03,1943,10
01/09/1943,3,13.8424,1943-09-03,1943,9
01/08/1943,3,15.2988,1943-08-03,1943,8
01/07/1943,3,17.9764,1943-07-03,1943,7
01/06/1943,3,19.9865,1943-06-03,1943,6
01/05/1943,3,24.8236,1943-05-03,1943,5
01/04/1943,3,34.3699,1943-04-03,1943,4
01/03/1943,3,36.4422,1943-03-03,1943,3
01/02/1943,3,85.1184,1943-02-03,1943,2
01/01/1943,3,47.0879,1943-01-03,1943,1
01/12/1942,3,31.3002,1942-12-03,1942,12
01/11/1942,3,24.3361,1942-11-03,1942,11
01/10/1942,3,13.8424,1942-10-03,1942,10
01/09/1942,3,12.7864,1942-09-03,1942,9
01/08/1942,3,15.2988,1942-08-03,1942,8
01/07/1942,3,17.1949,1942-07-03,1942,7
01/06/1942,3,19.9865,1942-06-03,1942,6
01/05/1942,3,22.0755,1942-05-03,1942,5
01/04/1942,3,28.7799,1942-04-03,1942,4
01/03/1942,3,47.6318,1942-03-03,1942,3
01/02/1942,3,21.2306,1942-02-03,1942,2
01/01/1942,3,33.855,1942-01-03,1942,1
01/12/1941,3,34.3699,1941-12-03,1941,12
01/11/1941,3,18.7709,1941-11-03,1941,11
01/10/1941,3,33.855,1941-10-03,1941,10
01/09/1941,3,17.9764,1941-09-03,1941,9
01/08/1941,3,13.1349,1941-08-03,1941,8
01/07/1941,3,13.8424,1941-07-03,1941,7
01/06/1941,3,15.2988,1941-06-03,1941,6
01/05/1941,3,17.584,1941-05-03,1941,5
01/04/1941,3,29.2811,1941-04-03,1941,4
01/03/1941,3,29.7838,1941-03-03,1941,3
01/02/1941,3,54.1888,1941-02-03,1941,2
01/01/1941,3,91.6681,1941-01-03,1941,1
01/12/1940,3,54.6697,1940-12-03,1940,12
01/11/1940,3,20.8128,1940-11-03,1940,11
01/10/1940,3,13.8424,1940-10-03,1940,10
01/09/1940,3,13.8424,1940-09-03,1940,9
01/08/1940,3,15.2988,1940-08-03,1940,8
01/07/1940,3,18.372,1940-07-03,1940,7
01/06/1940,3,22.5026,1940-06-03,1940,6
01/05/1940,3,30.7934,1940-05-03,1940,5
01/04/1940,3,43.3108,1940-04-03,1940,4
01/03/1940,3,42.7755,1940-03-03,1940,3
01/02/1940,3,47.0879,1940-02-03,1940,2
01/01/1940,3,52.2842,1940-01-03,1940,1
01/12/1939,3,25.8035,1939-12-03,1939,12
01/11/1939,3,11.7622,1939-11-03,1939,11
01/10/1939,3,35.4035,1939-10-03,1939,10
01/09/1939,3,15.3439,1939-09-03,1939,9
01/08/1939,3,16.5816,1939-08-03,1939,8
01/07/1939,3,15.7525,1939-07-03,1939,7
01/06/1939,3,17.8546,1939-06-03,1939,6
01/05/1939,3,22.3444,1939-05-03,1939,5
01/04/1939,3,31.8607,1939-04-03,1939,4
01/03/1939,3,36.2314,1939-03-03,1939,3
01/02/1939,3,58.3536,1939-02-03,1939,2
01/01/1939,3,81.6364,1939-01-03,1939,1
01/12/1938,3,131.8112,1938-12-03,1938,12
01/11/1938,3,36.2314,1938-11-03,1938,11
01/10/1938,3,15.3439,1938-10-03,1938,10
01/09/1938,3,15.7525,1938-09-03,1938,9
01/08/1938,3,18.7225,1938-08-03,1938,8
01/07/1938,3,15.7525,1938-07-03,1938,7
01/06/1938,3,20.9584,1938-06-03,1938,6
01/05/1938,3,21.4167,1938-05-03,1938,5
01/04/1938,3,28.7213,1938-04-03,1938,4
01/03/1938,3,111.9276,1938-03-03,1938,3
01/02/1938,3,34.568,1938-02-03,1938,2
01/01/1938,3,110.6093,1938-01-03,1938,1
01/12/1937,3,84.5336,1937-12-03,1937,12
01/11/1937,3,50.5501,1937-11-03,1937,11
01/10/1937,3,17.4264,1937-10-03,1937,10
01/09/1937,3,15.7525,1937-09-03,1937,9
01/08/1937,3,12.2214,1937-08-03,1937,8
01/07/1937,3,13.7497,1937-07-03,1937,7
01/06/1937,3,21.8787,1937-06-03,1937,6
01/05/1937,3,41.9826,1937-05-03,1937,5
01/04/1937,3,24.2431,1937-04-03,1937,4
01/03/1937,3,73.7623,1937-03-03,1937,3
01/02/1937,3,48.0423,1937-02-03,1937,2
01/01/1937,3,111.9276,1937-01-03,1937,1
01/12/1936,3,14.9393,1936-12-03,1936,12
01/11/1936,3,15.7525,1936-11-03,1936,11
01/10/1936,3,11.1195,1936-10-03,1936,10
01/09/1936,3,13.3614,1936-09-03,1936,9
01/08/1936,3,11.1195,1936-08-03,1936,8
01/07/1936,3,11.8498,1936-07-03,1936,7
01/06/1936,3,14.9393,1936-06-03,1936,6
01/05/1936,3,35.1193,1936-05-03,1936,5
01/04/1936,3,32.9338,1936-04-03,1936,4
01/03/1936,3,64.4749,1936-03-03,1936,3
01/02/1936,3,11.1195,1936-02-03,1936,2
01/01/1936,3,38.4941,1936-01-03,1936,1
01/12/1935,3,17.8546,1935-12-03,1935,12
01/11/1935,3,18.2866,1935-11-03,1935,11
01/10/1935,3,20.9584,1935-10-03,1935,10
01/09/1935,3,11.8498,1935-09-03,1935,9
01/08/1935,3,14.1421,1935-08-03,1935,8
01/07/1935,3,15.7525,1935-07-03,1935,7
01/06/1935,3,21.8787,1935-06-03,1935,6
01/05/1935,3,27.1974,1935-05-03,1935,5
01/04/1935,3,101.575,1935-04-03,1935,4
01/03/1935,3,44.37,1935-03-03,1935,3
01/02/1935,3,98.431,1935-02-03,1935,2
01/01/1935,3,67.9726,1935-01-03,1935,1
01/12/1934,3,18.7225,1934-12-03,1934,12
01/11/1934,3,8.3753,1934-11-03,1934,11
01/10/1934,3,8.3753,1934-10-03,1934,10
01/09/1934,3,7.4222,1934-09-03,1934,9
01/08/1934,3,7.7351,1934-08-03,1934,8
01/07/1934,3,7.114,1934-07-03,1934,7
01/06/1934,3,5.9308,1934-06-03,1934,6
01/05/1934,3,10.4066,1934-05-03,1934,5
01/04/1934,3,14.1421,1934-04-03,1934,4
01/03/1934,3,,1934-03-03,1934,3
01/12/2023,4,22.0148,2023-12-04,2023,12
01/11/2023,4,22.7215,2023-11-04,2023,11
01/10/2023,4,17.278,2023-10-04,2023,10
01/09/2023,4,15.6793,2023-09-04,2023,9
01/08/2023,4,15.3657,2023-08-04,2023,8
01/07/2023,4,18.5929,2023-07-04,2023,7
01/06/2023,4,23.4354,2023-06-04,2023,6
01/05/2023,4,30.958,2023-05-04,2023,5
01/04/2023,4,36.2012,2023-04-04,2023,4
01/03/2023,4,44.3301,2023-03-04,2023,3
01/02/2023,4,74.2004,2023-02-04,2023,2
01/01/2023,4,74.7526,2023-01-04,2023,1
01/12/2022,4,22.0148,2022-12-04,2022,12
01/11/2022,4,13.5281,2022-11-04,2022,11
01/10/2022,4,21.3154,2022-10-04,2022,10
01/09/2022,4,9.8202,2022-09-04,2022,9
01/08/2022,4,11.2004,2022-08-04,2022,8
01/07/2022,4,13.5281,2022-07-04,2022,7
01/06/2022,4,15.6793,2022-06-04,2022,6
01/05/2022,4,18.9266,2022-05-04,2022,5
01/04/2022,4,30.958,2022-04-04,2022,4
01/03/2022,4,33.748,2022-03-04,2022,3
01/02/2022,4,53.918,2022-02-04,2022,2
01/01/2022,4,59.2441,2022-01-04,2022,1
01/12/2021,4,16.3516,2021-12-04,2021,12
01/11/2021,4,37.1197,2021-11-04,2021,11
01/10/2021,4,11.7969,2021-10-04,2021,10
01/09/2021,4,9.3072,2021-09-04,2021,9
01/08/2021,4,11.2271,2021-08-04,2021,8
01/07/2021,4,12.6686,2021-07-04,2021,7
01/06/2021,4,17.3192,2021-06-04,2021,6
01/05/2021,4,15.7167,2021-05-04,2021,5
01/04/2021,4,21.3663,2021-04-04,2021,4
01/03/2021,4,27.9338,2021-03-04,2021,3
01/02/2021,4,28.6983,2021-02-04,2021,2
01/01/2021,4,34.153,2021-01-04,2021,1
01/12/2020,4,13.5281,2020-12-04,2020,12
01/11/2020,4,8.521,2020-11-04,2020,11
01/10/2020,4,7.0186,2020-10-04,2020,10
01/09/2020,4,8.0097,2020-09-04,2020,9
01/08/2020,4,9.5742,2020-08-04,2020,8
01/07/2020,4,12.0852,2020-07-04,2020,7
01/06/2020,4,14.7799,2020-06-04,2020,6
01/05/2020,4,16.9947,2020-05-04,2020,5
01/04/2020,4,31.8229,2020-04-04,2020,4
01/03/2020,4,74.2004,2020-03-04,2020,3
01/02/2020,4,54.8626,2020-02-04,2020,2
01/01/2020,4,33.8285,2020-01-04,2020,1
01/12/2019,4,13.2609,2019-12-04,2019,12
01/11/2019,4,9.3072,2019-11-04,2019,11
01/10/2019,4,8.7806,2019-10-04,2019,10
01/09/2019,4,9.8437,2019-09-04,2019,9
01/08/2019,4,8.2641,2019-08-04,2019,8
01/07/2019,4,10.1156,2019-07-04,2019,7
01/06/2019,4,12.9637,2019-06-04,2019,6
01/05/2019,4,15.09,2019-05-04,2019,5
01/04/2019,4,19.9866,2019-04-04,2019,4
01/03/2019,4,84.8966,2019-03-04,2019,3
01/02/2019,4,34.153,2019-02-04,2019,2
01/01/2019,4,31.0319,2019-01-04,2019,1
01/12/2018,4,47.0067,2018-12-04,2018,12
01/11/2018,4,8.521,2018-11-04,2018,11
01/10/2018,4,9.5742,2018-10-04,2018,10
01/09/2018,4,6.0713,2018-09-04,2018,9
01/08/2018,4,14.1659,2018-08-04,2018,8
01/07/2018,4,6.7776,2018-07-04,2018,7
01/06/2018,4,7.758,2018-06-04,2018,6
01/05/2018,4,8.7806,2018-05-04,2018,5
01/04/2018,4,12.9637,2018-04-04,2018,4
01/03/2018,4,29.8576,2018-03-04,2018,3
01/02/2018,4,19.9866,2018-02-04,2018,2
01/01/2018,4,16.9542,2018-01-04,2018,1
01/12/2017,4,19.3081,2017-12-04,2017,12
01/11/2017,4,9.5742,2017-11-04,2017,11
01/10/2017,4,24.2142,2017-10-04,2017,10
01/09/2017,4,7.758,2017-09-04,2017,9
01/08/2017,4,8.7806,2017-08-04,2017,8
01/07/2017,4,10.6666,2017-07-04,2017,7
01/06/2017,4,12.6686,2017-06-04,2017,6
01/05/2017,4,12.9637,2017-05-04,2017,5
01/04/2017,4,13.8621,2017-04-04,2017,4
01/03/2017,4,24.5198,2017-03-04,2017,3
01/02/2017,4,20.6726,2017-02-04,2017,2
01/01/2017,4,20.3287,2017-01-04,2017,1
01/12/2016,4,18.9717,2016-12-04,2016,12
01/11/2016,4,12.6385,2016-11-04,2016,11
01/10/2016,4,12.3758,2016-10-04,2016,10
01/09/2016,4,11.7969,2016-09-04,2016,9
01/08/2016,4,10.9457,2016-08-04,2016,8
01/07/2016,4,13.5604,2016-07-04,2016,7
01/06/2016,4,29.8576,2016-06-04,2016,6
01/05/2016,4,16.3516,2016-05-04,2016,5
01/04/2016,4,24.5783,2016-04-04,2016,4
01/03/2016,4,33.8285,2016-03-04,2016,3
01/02/2016,4,29.3994,2016-02-04,2016,2
01/01/2016,4,35.3772,2016-01-04,2016,1
01/12/2015,4,47.1188,2015-12-04,2015,12
01/11/2015,4,32.2208,2015-11-04,2015,11
01/10/2015,4,7.5088,2015-10-04,2015,10
01/09/2015,4,6.5394,2015-09-04,2015,9
01/08/2015,4,7.2624,2015-08-04,2015,8
01/07/2015,4,9.0426,2015-07-04,2015,7
01/06/2015,4,11.5108,2015-06-04,2015,6
01/05/2015,4,12.0852,2015-05-04,2015,5
01/04/2015,4,18.9717,2015-04-04,2015,4
01/03/2015,4,11.015,2015-03-04,2015,3
01/02/2015,4,17.4675,2015-02-04,2015,2
01/01/2015,4,13.1068,2015-01-04,2015,1
01/10/2014,4,,2014-10-04,2014,10
01/09/2014,4,,2014-09-04,2014,9
01/08/2014,4,,2014-08-04,2014,8
01/07/2014,4,,2014-07-04,2014,7
01/06/2014,4,,2014-06-04,2014,6
01/05/2014,4,9.658,2014-05-04,2014,5
01/04/2014,4,17.8405,2014-04-04,2014,4
01/03/2014,4,13.8179,2014-03-04,2014,3
01/02/2014,4,12.7537,2014-02-04,2014,2
01/01/2014,4,21.6442,2014-01-04,2014,1
01/12/2013,4,57.0558,2013-12-04,2013,12
01/11/2013,4,13.1068,2013-11-04,2013,11
01/10/2013,4,33.325,2013-10-04,2013,10
01/09/2013,4,13.1068,2013-09-04,2013,9
01/08/2013,4,16.7257,2013-08-04,2013,8
01/07/2013,4,21.2581,2013-07-04,2013,7
01/06/2013,4,28.3848,2013-06-04,2013,6
01/05/2013,4,25.9693,2013-05-04,2013,5
01/04/2013,4,43.594,2013-04-04,2013,4
01/03/2013,4,59.822,2013-03-04,2013,3
01/02/2013,4,87.7812,2013-02-04,2013,2
01/01/2013,4,24.3805,2013-01-04,2013,1
01/12/2012,4,27.5754,2012-12-04,2012,12
01/11/2012,4,33.325,2012-11-04,2012,11
01/10/2012,4,11.7051,2012-10-04,2012,10
01/09/2012,4,14.5355,2012-09-04,2012,9
01/08/2012,4,17.4675,2012-08-04,2012,8
01/07/2012,4,22.8098,2012-07-04,2012,7
01/06/2012,4,23.2007,2012-06-04,2012,6
01/05/2012,4,30.8374,2012-05-04,2012,5
01/04/2012,4,32.908,2012-04-04,2012,4
01/03/2012,4,35.8459,2012-03-04,2012,3
01/02/2012,4,51.1441,2012-02-04,2012,2
01/01/2012,4,130.984,2012-01-04,2012,1
01/12/2011,4,28.7911,2011-12-04,2011,12
01/11/2011,4,14.5355,2011-11-04,2011,11
01/10/2011,4,18.2149,2011-10-04,2011,10
01/09/2011,4,14.8967,2011-09-04,2011,9
01/08/2011,4,19.3463,2011-08-04,2011,8
01/07/2011,4,22.4201,2011-07-04,2011,7
01/06/2011,4,25.9693,2011-06-04,2011,6
01/05/2011,4,27.1723,2011-05-04,2011,5
01/04/2011,4,49.3486,2011-04-04,2011,4
01/03/2011,4,64.4827,2011-03-04,2011,3
01/02/2011,4,57.0558,2011-02-04,2011,2
01/01/2011,4,125.1496,2011-01-04,2011,1
01/12/2010,4,27.1723,2010-12-04,2010,12
01/11/2010,4,30.8374,2010-11-04,2010,11
01/10/2010,4,17.0959,2010-10-04,2010,10
01/09/2010,4,12.4024,2010-09-04,2010,9
01/08/2010,4,15.9896,2010-08-04,2010,8
01/07/2010,4,18.9679,2010-07-04,2010,7
01/06/2010,4,,2010-06-04,2010,6
01/05/2010,4,28.7911,2010-05-04,2010,5
01/04/2010,4,41.8493,2010-04-04,2010,4
01/03/2010,4,61.2137,2010-03-04,2010,3
01/02/2010,4,40.5492,2010-02-04,2010,2
01/01/2010,4,94.819,2010-01-04,2010,1
01/12/2009,4,40.1174,2009-12-04,2009,12
01/11/2009,4,40.1174,2009-11-04,2009,11
01/10/2009,4,27.1723,2009-10-04,2009,10
01/09/2009,4,17.4675,2009-09-04,2009,9
01/08/2009,4,20.8732,2009-08-04,2009,8
01/07/2009,4,26.7702,2009-07-04,2009,7
01/06/2009,4,29.1984,2009-06-04,2009,6
01/05/2009,4,37.1184,2009-05-04,2009,5
01/04/2009,4,60.7491,2009-04-04,2009,4
01/03/2009,4,51.5948,2009-03-04,2009,3
01/02/2009,4,148.2717,2009-02-04,2009,2
01/01/2009,4,60.7491,2009-01-04,2009,1
01/12/2008,4,20.1072,2008-12-04,2008,12
01/11/2008,4,22.0315,2008-11-04,2008,11
01/10/2008,4,22.8098,2008-10-04,2008,10
01/09/2008,4,13.4615,2008-09-04,2008,9
01/08/2008,4,15.6238,2008-08-04,2008,8
01/07/2008,4,20.1072,2008-07-04,2008,7
01/06/2008,4,24.776,2008-06-04,2008,6
01/05/2008,4,35.002,2008-05-04,2008,5
01/04/2008,4,36.2692,2008-04-04,2008,4
01/03/2008,4,48.9015,2008-03-04,2008,3
01/02/2008,4,93.0445,2008-02-04,2008,2
01/01/2008,4,14.5355,2008-01-04,2008,1
01/12/2007,4,12.7537,2007-12-04,2007,12
01/11/2007,4,12.7537,2007-11-04,2007,11
01/10/2007,4,9.3237,2007-10-04,2007,10
01/09/2007,4,11.015,2007-09-04,2007,9
01/08/2007,4,14.8967,2007-08-04,2007,8
01/07/2007,4,16.7257,2007-07-04,2007,7
01/06/2007,4,23.5928,2007-06-04,2007,6
01/05/2007,4,23.2007,2007-05-04,2007,5
01/04/2007,4,28.7911,2007-04-04,2007,4
01/03/2007,4,37.971,2007-03-04,2007,3
01/02/2007,4,102.6216,2007-02-04,2007,2
01/01/2007,4,82.6095,2007-01-04,2007,1
01/12/2006,4,30.0159,2006-12-04,2006,12
01/11/2006,4,57.0558,2006-11-04,2006,11
01/10/2006,4,13.8179,2006-10-04,2006,10
01/09/2006,4,14.1759,2006-09-04,2006,9
01/08/2006,4,12.4024,2006-08-04,2006,8
01/07/2006,4,14.5355,2006-07-04,2006,7
01/06/2006,4,15.9896,2006-06-04,2006,6
01/05/2006,4,18.9679,2006-05-04,2006,5
01/04/2006,4,26.7702,2006-04-04,2006,4
01/03/2006,4,25.1726,2006-03-04,2006,3
01/02/2006,4,30.4262,2006-02-04,2006,2
01/01/2006,4,50.6942,2006-01-04,2006,1
01/12/2005,4,29.1984,2005-12-04,2005,12
01/11/2005,4,14.5355,2005-11-04,2005,11
01/10/2005,4,13.8179,2005-10-04,2005,10
01/09/2005,4,13.8179,2005-09-04,2005,9
01/08/2005,4,17.0959,2005-08-04,2005,8
01/07/2005,4,20.4895,2005-07-04,2005,7
01/06/2005,4,27.5754,2005-06-04,2005,6
01/05/2005,4,28.3848,2005-05-04,2005,5
01/04/2005,4,32.492,2005-04-04,2005,4
01/03/2005,4,49.3486,2005-03-04,2005,3
01/02/2005,4,75.8607,2005-02-04,2005,2
01/01/2005,4,40.5492,2005-01-04,2005,1
01/12/2004,4,24.3805,2004-12-04,2004,12
01/11/2004,4,23.5928,2004-11-04,2004,11
01/10/2004,4,20.1072,2004-10-04,2004,10
01/09/2004,4,11.7051,2004-09-04,2004,9
01/08/2004,4,15.6238,2004-08-04,2004,8
01/07/2004,4,18.9679,2004-07-04,2004,7
01/06/2004,4,29.6066,2004-06-04,2004,6
01/05/2004,4,26.7702,2004-05-04,2004,5
01/04/2004,4,30.0159,2004-04-04,2004,4
01/03/2004,4,41.8493,2004-03-04,2004,3
01/02/2004,4,42.7201,2004-02-04,2004,2
01/01/2004,4,21.2581,2004-01-04,2004,1
01/12/2003,4,52.9508,2003-12-04,2003,12
01/11/2003,4,12.4024,2003-11-04,2003,11
01/10/2003,4,8.0084,2003-10-04,2003,10
01/09/2003,4,11.7051,2003-09-04,2003,9
01/08/2003,4,11.7051,2003-08-04,2003,8
01/07/2003,4,13.1068,2003-07-04,2003,7
01/06/2003,4,16.7257,2003-06-04,2003,6
01/05/2003,4,19.7261,2003-05-04,2003,5
01/04/2003,4,25.1726,2003-04-04,2003,4
01/03/2003,4,32.0769,2003-03-04,2003,3
01/02/2003,4,75.8607,2003-02-04,2003,2
01/01/2003,4,34.1617,2003-01-04,2003,1
01/12/2002,4,18.2149,2002-12-04,2002,12
01/11/2002,4,13.1068,2002-11-04,2002,11
01/10/2002,4,10.6728,2002-10-04,2002,10
01/09/2002,4,11.015,2002-09-04,2002,9
01/08/2002,4,13.1068,2002-08-04,2002,8
01/07/2002,4,13.1068,2002-07-04,2002,7
01/06/2002,4,16.3569,2002-06-04,2002,6
01/05/2002,4,19.7261,2002-05-04,2002,5
01/04/2002,4,27.5754,2002-04-04,2002,4
01/03/2002,4,38.8271,2002-03-04,2002,3
01/02/2002,4,114.3469,2002-02-04,2002,2
01/01/2002,4,51.1441,2002-01-04,2002,1
01/12/2001,4,33.325,2001-12-04,2001,12
01/11/2001,4,19.3463,2001-11-04,2001,11
01/10/2001,4,24.776,2001-10-04,2001,10
01/09/2001,4,8.3339,2001-09-04,2001,9
01/08/2001,4,6.4171,2001-08-04,2001,8
01/07/2001,4,8.0084,2001-07-04,2001,7
01/06/2001,4,11.015,2001-06-04,2001,6
01/05/2001,4,10.3326,2001-05-04,2001,5
01/04/2001,4,18.9679,2001-04-04,2001,4
01/03/2001,4,20.4895,2001-03-04,2001,3
01/02/2001,4,22.0315,2001-02-04,2001,2
01/01/2001,4,36.2692,2001-01-04,2001,1
01/12/2000,4,24.3805,2000-12-04,2000,12
01/11/2000,4,11.015,2000-11-04,2000,11
01/10/2000,4,18.5907,2000-10-04,2000,10
01/09/2000,4,34.5814,2000-09-04,2000,9
01/08/2000,4,15.2595,2000-08-04,2000,8
01/07/2000,4,15.9896,2000-07-04,2000,7
01/06/2000,4,19.7261,2000-06-04,2000,6
01/05/2000,4,23.5928,2000-05-04,2000,5
01/04/2000,4,36.6934,2000-04-04,2000,4
01/03/2000,4,38.3986,2000-03-04,2000,3
01/02/2000,4,57.9753,2000-02-04,2000,2
01/01/2000,4,179.6378,2000-01-04,2000,1
01/12/1999,4,8.6616,1999-12-04,1999,12
01/11/1999,4,8.0084,1999-11-04,1999,11
01/10/1999,4,8.6616,1999-10-04,1999,10
01/09/1999,4,9.9942,1999-09-04,1999,9
01/08/1999,4,13.8179,1999-08-04,1999,8
01/07/1999,4,16.3569,1999-07-04,1999,7
01/06/1999,4,17.8405,1999-06-04,1999,6
01/05/1999,4,22.0315,1999-05-04,1999,5
01/04/1999,4,31.6628,1999-04-04,1999,4
01/03/1999,4,59.822,1999-03-04,1999,3
01/02/1999,4,49.7964,1999-02-04,1999,2
01/01/1999,4,57.9753,1999-01-04,1999,1
01/12/1998,4,18.5907,1998-12-04,1998,12
01/11/1998,4,18.2149,1998-11-04,1998,11
01/10/1998,4,27.1723,1998-10-04,1998,10
01/09/1998,4,12.4024,1998-09-04,1998,9
01/08/1998,4,15.2595,1998-08-04,1998,8
01/07/1998,4,17.8405,1998-07-04,1998,7
01/06/1998,4,24.776,1998-06-04,1998,6
01/05/1998,4,24.776,1998-05-04,1998,5
01/04/1998,4,44.0321,1998-04-04,1998,4
01/03/1998,4,38.8271,1998-03-04,1998,3
01/02/1998,4,27.1723,1998-02-04,1998,2
01/01/1998,4,27.9796,1998-01-04,1998,1
01/12/1997,4,41.8493,1997-12-04,1997,12
01/11/1997,4,14.5355,1997-11-04,1997,11
01/10/1997,4,21.2581,1997-10-04,1997,10
01/09/1997,4,16.3569,1997-09-04,1997,9
01/08/1997,4,20.4895,1997-08-04,1997,8
01/07/1997,4,25.1726,1997-07-04,1997,7
01/06/1997,4,28.3848,1997-06-04,1997,6
01/05/1997,4,32.908,1997-05-04,1997,5
01/04/1997,4,50.2449,1997-04-04,1997,4
01/03/1997,4,55.6815,1997-03-04,1997,3
01/02/1997,4,95.4127,1997-02-04,1997,2
01/01/1997,4,153.7168,1997-01-04,1997,1
01/12/1996,4,57.0558,1996-12-04,1996,12
01/11/1996,4,59.3593,1996-11-04,1996,11
01/10/1996,4,37.1184,1996-10-04,1996,10
01/09/1996,4,36.2692,1996-09-04,1996,9
01/08/1996,4,14.1759,1996-08-04,1996,8
01/07/1996,4,18.2149,1996-07-04,1996,7
01/06/1996,4,20.1072,1996-06-04,1996,6
01/05/1996,4,23.9861,1996-05-04,1996,5
01/04/1996,4,30.8374,1996-04-04,1996,4
01/03/1996,4,84.3231,1996-03-04,1996,3
01/02/1996,4,65.4222,1996-02-04,1996,2
01/01/1996,4,103.2293,1996-01-04,1996,1
01/12/1995,4,21.2581,1995-12-04,1995,12
01/11/1995,4,20.4895,1995-11-04,1995,11
01/10/1995,4,13.4615,1995-10-04,1995,10
01/09/1995,4,10.3326,1995-09-04,1995,9
01/08/1995,4,13.4615,1995-08-04,1995,8
01/07/1995,4,16.7257,1995-07-04,1995,7
01/06/1995,4,20.4895,1995-06-04,1995,6
01/05/1995,4,22.0315,1995-05-04,1995,5
01/04/1995,4,34.1617,1995-04-04,1995,4
01/03/1995,4,47.5646,1995-03-04,1995,3
01/02/1995,4,93.0445,1995-02-04,1995,2
01/01/1995,4,57.0558,1995-01-04,1995,1
01/12/1994,4,14.1759,1994-12-04,1994,12
01/11/1994,4,12.7537,1994-11-04,1994,11
01/10/1994,4,11.7051,1994-10-04,1994,10
01/09/1994,4,14.8967,1994-09-04,1994,9
01/08/1994,4,18.5907,1994-08-04,1994,8
01/07/1994,4,23.5928,1994-07-04,1994,7
01/06/1994,4,30.0159,1994-06-04,1994,6
01/05/1994,4,25.1726,1994-05-04,1994,5
01/04/1994,4,39.6865,1994-04-04,1994,4
01/03/1994,4,96.6033,1994-03-04,1994,3
01/02/1994,4,43.1567,1994-02-04,1994,2
01/01/1994,4,73.6493,1994-01-04,1994,1
01/12/1993,4,37.5443,1993-12-04,1993,12
01/11/1993,4,13.1068,1993-11-04,1993,11
01/10/1993,4,22.8098,1993-10-04,1993,10
01/09/1993,4,13.8179,1993-09-04,1993,9
01/08/1993,4,17.8405,1993-08-04,1993,8
01/07/1993,4,21.2581,1993-07-04,1993,7
01/06/1993,4,26.7702,1993-06-04,1993,6
01/05/1993,4,28.7911,1993-05-04,1993,5
01/04/1993,4,46.2343,1993-04-04,1993,4
01/03/1993,4,59.822,1993-03-04,1993,3
01/02/1993,4,48.0095,1993-02-04,1993,2
01/01/1993,4,41.4151,1993-01-04,1993,1
01/12/1992,4,38.3986,1992-12-04,1992,12
01/11/1992,4,57.0558,1992-11-04,1992,11
01/10/1992,4,27.5754,1992-10-04,1992,10
01/09/1992,4,15.9896,1992-09-04,1992,9
01/08/1992,4,16.7257,1992-08-04,1992,8
01/07/1992,4,19.3463,1992-07-04,1992,7
01/06/1992,4,25.5704,1992-06-04,1992,6
01/05/1992,4,60.7491,1992-05-04,1992,5
01/04/1992,4,35.4235,1992-04-04,1992,4
01/03/1992,4,55.2247,1992-03-04,1992,3
01/02/1992,4,153.7168,1992-02-04,1992,2
01/01/1992,4,33.325,1992-01-04,1992,1
01/12/1991,4,14.5355,1991-12-04,1991,12
01/11/1991,4,39.6865,1991-11-04,1991,11
01/10/1991,4,43.1567,1991-10-04,1991,10
01/09/1991,4,15.9896,1991-09-04,1991,9
01/08/1991,4,20.8732,1991-08-04,1991,8
01/07/1991,4,24.776,1991-07-04,1991,7
01/06/1991,4,30.0159,1991-06-04,1991,6
01/05/1991,4,39.6865,1991-05-04,1991,5
01/04/1991,4,99.599,1991-04-04,1991,4
01/03/1991,4,52.4981,1991-03-04,1991,3
01/02/1991,4,59.3593,1991-02-04,1991,2
01/01/1991,4,23.5928,1991-01-04,1991,1
01/12/1990,4,14.5355,1990-12-04,1990,12
01/11/1990,4,15.802,1990-11-04,1990,11
01/10/1990,4,17.8477,1990-10-04,1990,10
01/09/1990,4,16.815,1990-09-04,1990,9
01/08/1990,4,14.809,1990-08-04,1990,8
01/07/1990,4,16.1375,1990-07-04,1990,7
01/06/1990,4,17.8477,1990-06-04,1990,6
01/05/1990,4,35.4484,1990-05-04,1990,5
01/04/1990,4,31.6347,1990-04-04,1990,4
01/03/1990,4,38.0656,1990-03-04,1990,3
01/02/1990,4,21.4261,1990-02-04,1990,2
01/01/1990,4,151.8245,1990-01-04,1990,1
01/12/1989,4,18.5468,1989-12-04,1989,12
01/11/1989,4,15.1378,1989-11-04,1989,11
01/10/1989,4,17.5013,1989-10-04,1989,10
01/09/1989,4,17.1571,1989-09-04,1989,9
01/08/1989,4,22.1661,1989-08-04,1989,8
01/07/1989,4,21.7951,1989-07-04,1989,7
01/06/1989,4,24.0504,1989-06-04,1989,6
01/05/1989,4,32.4703,1989-05-04,1989,5
01/04/1989,4,43.0134,1989-04-04,1989,4
01/03/1989,4,142.3712,1989-03-04,1989,3
01/02/1989,4,48.1476,1989-02-04,1989,2
01/01/1989,4,88.7521,1989-01-04,1989,1
01/12/1988,4,25.2039,1988-12-04,1988,12
01/11/1988,4,28.3618,1988-11-04,1988,11
01/10/1988,4,16.1375,1988-10-04,1988,10
01/09/1988,4,15.1378,1988-09-04,1988,9
01/08/1988,4,18.8995,1988-08-04,1988,8
01/07/1988,4,22.5391,1988-07-04,1988,7
01/06/1988,4,28.3618,1988-06-04,1988,6
01/05/1988,4,30.3942,1988-05-04,1988,5
01/04/1988,4,37.1867,1988-04-04,1988,4
01/03/1988,4,101.1014,1988-03-04,1988,3
01/02/1988,4,47.6733,1988-02-04,1988,2
01/01/1988,4,67.7456,1988-01-04,1988,1
01/12/1987,4,29.5759,1987-12-04,1987,12
01/11/1987,4,17.5013,1987-11-04,1987,11
01/10/1987,4,20.6941,1987-10-04,1987,10
01/09/1987,4,17.5013,1987-09-04,1987,9
01/08/1987,4,21.0591,1987-08-04,1987,8
01/07/1987,4,26.3744,1987-07-04,1987,7
01/06/1987,4,25.6245,1987-06-04,1987,6
01/05/1987,4,29.9869,1987-05-04,1987,5
01/04/1987,4,82.4273,1987-04-04,1987,4
01/03/1987,4,32.3089,1987-03-04,1987,3
01/02/1987,4,37.6659,1987-02-04,1987,2
01/01/1987,4,70.9976,1987-01-04,1987,1
01/12/1986,4,24.9337,1986-12-04,1986,12
01/11/1986,4,12.5237,1986-11-04,1986,11
01/10/1986,4,15.5246,1986-10-04,1986,10
01/09/1986,4,18.5868,1986-09-04,1986,9
01/08/1986,4,20.0786,1986-08-04,1986,8
01/07/1986,4,25.2778,1986-07-04,1986,7
01/06/1986,4,27.3968,1986-06-04,1986,6
01/05/1986,4,28.8612,1986-05-04,1986,5
01/04/1986,4,40.2902,1986-04-04,1986,4
01/03/1986,4,74.7128,1986-03-04,1986,3
01/02/1986,4,55.2206,1986-02-04,1986,2
01/01/1986,4,73.109,1986-01-04,1986,1
01/12/1985,4,64.3494,1985-12-04,1985,12
01/11/1985,4,74.1762,1985-11-04,1985,11
01/10/1985,4,19.4743,1985-10-04,1985,10
01/09/1985,4,15.2611,1985-09-04,1985,9
01/08/1985,4,17.7218,1985-08-04,1985,8
01/07/1985,4,20.6929,1985-07-04,1985,7
01/06/1985,4,32.3089,1985-06-04,1985,6
01/05/1985,4,30.3673,1985-05-04,1985,5
01/04/1985,4,50.7441,1985-04-04,1985,4
01/03/1985,4,73.109,1985-03-04,1985,3
01/02/1985,4,93.5031,1985-02-04,1985,2
01/01/1985,4,25.2778,1985-01-04,1985,1
01/12/1984,4,35.5525,1984-12-04,1984,12
01/11/1984,4,11.601,1984-11-04,1984,11
01/10/1984,4,15.0,1984-10-04,1984,10
01/09/1984,4,15.5246,1984-09-04,1984,9
01/08/1984,4,16.059,1984-08-04,1984,8
01/07/1984,4,18.0076,1984-07-04,1984,7
01/06/1984,4,21.6333,1984-06-04,1984,6
01/05/1984,4,30.3673,1984-05-04,1984,5
01/04/1984,4,29.9869,1984-04-04,1984,4
01/03/1984,4,34.3163,1984-03-04,1984,3
01/02/1984,4,45.8294,1984-02-04,1984,2
01/01/1984,4,91.7079,1984-01-04,1984,1
01/12/1983,4,54.3475,1983-12-04,1983,12
01/11/1983,4,201.5937,1983-11-04,1983,11
01/10/1983,4,51.7599,1983-10-04,1983,10
01/09/1983,4,27.3968,1983-09-04,1983,9
01/08/1983,4,35.1378,1983-08-04,1983,8
01/07/1983,4,45.8294,1983-07-04,1983,7
01/06/1983,4,174.2033,1983-06-04,1983,6
01/05/1983,4,50.7441,1983-05-04,1983,5
01/04/1983,4,61.3912,1983-04-04,1983,4
01/03/1983,4,119.3008,1983-03-04,1983,3
01/02/1983,4,134.6658,1983-02-04,1983,2
01/01/1983,4,131.1018,1983-01-04,1983,1
01/12/1982,4,73.6416,1982-12-04,1982,12
01/11/1982,4,23.2516,1982-11-04,1982,11
01/10/1982,4,19.4743,1982-10-04,1982,10
01/09/1982,4,17.4385,1982-09-04,1982,9
01/08/1982,4,21.9519,1982-08-04,1982,8
01/07/1982,4,26.3257,1982-07-04,1982,7
01/06/1982,4,31.1361,1982-06-04,1982,6
01/05/1982,4,38.53,1982-05-04,1982,5
01/04/1982,4,80.1845,1982-04-04,1982,4
01/03/1982,4,64.3494,1982-03-04,1982,3
01/02/1982,4,54.7595,1982-02-04,1982,2
01/01/1982,4,117.2694,1982-01-04,1982,1
01/12/1981,4,42.0934,1981-12-04,1981,12
01/11/1981,4,32.7051,1981-11-04,1981,11
01/10/1981,4,15.5246,1981-10-04,1981,10
01/09/1981,4,16.33,1981-09-04,1981,9
01/08/1981,4,18.0076,1981-08-04,1981,8
01/07/1981,4,21.3173,1981-07-04,1981,7
01/06/1981,4,24.5922,1981-06-04,1981,6
01/05/1981,4,32.7051,1981-05-04,1981,5
01/04/1981,4,45.3529,1981-04-04,1981,4
01/03/1981,4,41.1864,1981-03-04,1981,3
01/02/1981,4,59.9382,1981-02-04,1981,2
01/01/1981,4,96.5656,1981-01-04,1981,1
01/12/1980,4,122.0333,1980-12-04,1980,12
01/11/1980,4,12.0575,1980-11-04,1980,11
01/10/1980,4,13.7314,1980-10-04,1980,10
01/09/1980,4,16.059,1980-09-04,1980,9
01/08/1980,4,18.8801,1980-08-04,1980,8
01/07/1980,4,24.2532,1980-07-04,1980,7
01/06/1980,4,25.6245,1980-06-04,1980,6
01/05/1980,4,34.7257,1980-05-04,1980,5
01/04/1980,4,58.9792,1980-04-04,1980,4
01/03/1980,4,42.0934,1980-03-04,1980,3
01/02/1980,4,83.5603,1980-02-04,1980,2
01/01/1980,4,60.4206,1980-01-04,1980,1
01/12/1979,4,38.966,1979-12-04,1979,12
01/11/1979,4,34.3163,1979-11-04,1979,11
01/10/1979,4,25.6245,1979-10-04,1979,10
01/09/1979,4,17.1576,1979-09-04,1979,9
01/08/1979,4,17.4385,1979-08-04,1979,8
01/07/1979,4,18.5868,1979-07-04,1979,7
01/06/1979,4,22.9228,1979-06-04,1979,6
01/05/1979,4,27.3968,1979-05-04,1979,5
01/04/1979,4,37.2379,1979-04-04,1979,4
01/03/1979,4,58.5026,1979-03-04,1979,3
01/02/1979,4,44.4081,1979-02-04,1979,2
01/01/1979,4,68.4019,1979-01-04,1979,1
01/12/1978,4,22.9228,1978-12-04,1978,12
01/11/1978,4,33.104,1978-11-04,1978,11
01/10/1978,4,10.5016,1978-10-04,1978,10
01/09/1978,4,13.7314,1978-09-04,1978,9
01/08/1978,4,14.7414,1978-08-04,1978,8
01/07/1978,4,16.059,1978-07-04,1978,7
01/06/1978,4,21.0038,1978-06-04,1978,6
01/05/1978,4,20.6929,1978-05-04,1978,5
01/04/1978,4,26.3257,1978-04-04,1978,4
01/03/1978,4,36.3899,1978-03-04,1978,3
01/02/1978,4,33.104,1978-02-04,1978,2
01/01/1978,4,27.759,1978-01-04,1978,1
01/12/1977,4,52.7867,1977-12-04,1977,12
01/11/1977,4,11.3763,1977-11-04,1977,11
01/10/1977,4,16.6034,1977-10-04,1977,10
01/09/1977,4,21.9519,1977-09-04,1977,9
01/08/1977,4,13.7314,1977-08-04,1977,8
01/07/1977,4,16.6034,1977-07-04,1977,7
01/06/1977,4,20.0786,1977-06-04,1977,6
01/05/1977,4,26.3257,1977-05-04,1977,5
01/04/1977,4,43.0112,1977-04-04,1977,4
01/03/1977,4,36.3899,1977-03-04,1977,3
01/02/1977,4,107.9935,1977-02-04,1977,2
01/01/1977,4,50.2404,1977-01-04,1977,1
01/12/1976,4,46.3086,1976-12-04,1976,12
01/11/1976,4,22.5966,1976-11-04,1976,11
01/10/1976,4,21.6333,1976-10-04,1976,10
01/09/1976,4,16.33,1976-09-04,1976,9
01/08/1976,4,15.7906,1976-08-04,1976,8
01/07/1976,4,63.8515,1976-07-04,1976,7
01/06/1976,4,21.3173,1976-06-04,1976,6
01/05/1976,4,19.4743,1976-05-04,1976,5
01/04/1976,4,25.9738,1976-04-04,1976,4
01/03/1976,4,34.3163,1976-03-04,1976,3
01/02/1976,4,34.3163,1976-02-04,1976,2
01/01/1976,4,38.0966,1976-01-04,1976,1
01/12/1975,4,43.0112,1975-12-04,1975,12
01/11/1975,4,14.7414,1975-11-04,1975,11
01/10/1975,4,12.0575,1975-10-04,1975,10
01/09/1975,4,10.2889,1975-09-04,1975,9
01/08/1975,4,12.2894,1975-08-04,1975,8
01/07/1975,4,17.4385,1975-07-04,1975,7
01/06/1975,4,15.7906,1975-06-04,1975,6
01/05/1975,4,19.7752,1975-05-04,1975,5
01/04/1975,4,30.7504,1975-04-04,1975,4
01/03/1975,4,79.6286,1975-03-04,1975,3
01/02/1975,4,49.241,1975-02-04,1975,2
01/01/1975,4,76.334,1975-01-04,1975,1
01/12/1974,4,11.8281,1974-12-04,1974,12
01/11/1974,4,15.5246,1974-11-04,1974,11
01/10/1974,4,10.7167,1974-10-04,1974,10
01/09/1974,4,8.8786,1974-09-04,1974,9
01/08/1974,4,12.0181,1974-08-04,1974,8
01/07/1974,4,18.1583,1974-07-04,1974,7
01/06/1974,4,19.5972,1974-06-04,1974,6
01/05/1974,4,25.5892,1974-05-04,1974,5
01/04/1974,4,44.5872,1974-04-04,1974,4
01/03/1974,4,31.1133,1974-03-04,1974,3
01/02/1974,4,53.5322,1974-02-04,1974,2
01/01/1974,4,56.2867,1974-01-04,1974,1
01/12/1973,4,42.4107,1973-12-04,1973,12
01/11/1973,4,44.1499,1973-11-04,1973,11
01/10/1973,4,6.8195,1973-10-04,1973,10
01/09/1973,4,9.4889,1973-09-04,1973,9
01/08/1973,4,14.6757,1973-08-04,1973,8
01/07/1973,4,14.6757,1973-07-04,1973,7
01/06/1973,4,15.3585,1973-06-04,1973,6
01/05/1973,4,17.8025,1973-05-04,1973,5
01/04/1973,4,49.9096,1973-04-04,1973,4
01/03/1973,4,25.5892,1973-03-04,1973,3
01/02/1973,4,70.9971,1973-02-04,1973,2
01/01/1973,4,54.4469,1973-01-04,1973,1
01/12/1972,4,40.6877,1972-12-04,1972,12
01/11/1972,4,33.5539,1972-11-04,1972,11
01/10/1972,4,40.2595,1972-10-04,1972,10
01/09/1972,4,9.4889,1972-09-04,1972,9
01/08/1972,4,11.6946,1972-08-04,1972,8
01/07/1972,4,10.7365,1972-07-04,1972,7
01/06/1972,4,14.6757,1972-06-04,1972,6
01/05/1972,4,19.2351,1972-05-04,1972,5
01/04/1972,4,34.3766,1972-04-04,1972,4
01/03/1972,4,61.4168,1972-03-04,1972,3
01/02/1972,4,39.8323,1972-02-04,1972,2
01/01/1972,4,33.1442,1972-01-04,1972,1
01/12/1971,4,53.9891,1971-12-04,1971,12
01/11/1971,4,34.7897,1971-11-04,1971,11
01/10/1971,4,13.3317,1971-10-04,1971,10
01/09/1971,4,1.9933,1971-09-04,1971,9
01/08/1971,4,4.1166,1971-08-04,1971,8
01/07/1971,4,6.2548,1971-07-04,1971,7
01/06/1971,4,3.6159,1971-06-04,1971,6
01/05/1971,4,5.7016,1971-05-04,1971,5
01/04/1971,4,10.1083,1971-04-04,1971,4
01/03/1971,4,6.2548,1971-03-04,1971,3
01/02/1971,4,8.577,1971-02-04,1971,2
01/01/1971,4,32.7357,1971-01-04,1971,1
01/12/1970,4,15.3585,1970-12-04,1970,12
01/11/1970,4,11.0537,1970-11-04,1970,11
01/10/1970,4,15.0162,1970-10-04,1970,10
01/09/1970,4,11.6946,1970-09-04,1970,9
01/08/1970,4,9.1826,1970-08-04,1970,8
01/07/1970,4,11.0537,1970-07-04,1970,7
01/06/1970,4,11.6946,1970-06-04,1970,6
01/05/1970,4,18.1583,1970-05-04,1970,5
01/04/1970,4,42.4107,1970-04-04,1970,4
01/03/1970,4,29.909,1970-03-04,1970,3
01/02/1970,4,32.7357,1970-02-04,1970,2
01/01/1970,4,21.0606,1970-01-04,1970,1
01/12/1969,4,28.3204,1969-12-04,1969,12
01/11/1969,4,25.9754,1969-11-04,1969,11
01/10/1969,4,14.0,1969-10-04,1969,10
01/09/1969,4,6.8195,1969-09-04,1969,9
01/08/1969,4,18.5157,1969-08-04,1969,8
01/07/1969,4,11.6946,1969-07-04,1969,7
01/06/1969,4,17.4484,1969-06-04,1969,6
01/05/1969,4,16.745,1969-05-04,1969,5
01/04/1969,4,25.5892,1969-04-04,1969,4
01/03/1969,4,73.9317,1969-03-04,1969,3
01/02/1969,4,36.4532,1969-02-04,1969,2
01/01/1969,4,15.0162,1969-01-04,1969,1
01/12/1968,4,171.801,1968-12-04,1968,12
01/11/1968,4,11.0537,1968-11-04,1968,11
01/10/1968,4,7.6867,1968-10-04,1968,10
01/09/1968,4,29.51,1968-09-04,1968,9
01/08/1968,4,9.1826,1968-08-04,1968,8
01/07/1968,4,10.1083,1968-07-04,1968,7
01/06/1968,4,13.0004,1968-06-04,1968,6
01/05/1968,4,16.0483,1968-05-04,1968,5
01/04/1968,4,21.4302,1968-04-04,1968,4
01/03/1968,4,34.3766,1968-03-04,1968,3
01/02/1968,4,25.2042,1968-02-04,1968,2
01/01/1968,4,35.6192,1968-01-04,1968,1
01/12/1967,4,34.7897,1967-12-04,1967,12
01/11/1967,4,28.7157,1967-11-04,1967,11
01/10/1967,4,9.7975,1967-10-04,1967,10
01/09/1967,4,12.3436,1967-09-04,1967,9
01/08/1967,4,16.3958,1967-08-04,1967,8
01/07/1967,4,20.6925,1967-07-04,1967,7
01/06/1967,4,23.6779,1967-06-04,1967,6
01/05/1967,4,39.4062,1967-05-04,1967,5
01/04/1967,4,44.1499,1967-04-04,1967,4
01/03/1967,4,44.5872,1967-03-04,1967,3
01/02/1967,4,186.4348,1967-02-04,1967,2
01/01/1967,4,58.1403,1967-01-04,1967,1
01/12/1966,4,27.5336,1966-12-04,1966,12
01/11/1966,4,49.9096,1966-11-04,1966,11
01/10/1966,4,13.3317,1966-10-04,1966,10
01/09/1966,4,14.3369,1966-09-04,1966,9
01/08/1966,4,19.9608,1966-08-04,1966,8
01/07/1966,4,21.0606,1966-07-04,1966,7
01/06/1966,4,27.5336,1966-06-04,1966,6
01/05/1966,4,33.9647,1966-05-04,1966,5
01/04/1966,4,53.9891,1966-04-04,1966,4
01/03/1966,4,66.6468,1966-03-04,1966,3
01/02/1966,4,80.8827,1966-02-04,1966,2
01/01/1966,4,76.8932,1966-01-04,1966,1
01/12/1965,4,78.8822,1965-12-04,1965,12
01/11/1965,4,29.51,1965-11-04,1965,11
01/10/1965,4,36.4532,1965-10-04,1965,10
01/09/1965,4,19.9608,1965-09-04,1965,9
01/08/1965,4,24.8206,1965-08-04,1965,8
01/07/1965,4,29.1123,1965-07-04,1965,7
01/06/1965,4,34.3766,1965-06-04,1965,6
01/05/1965,4,43.2783,1965-05-04,1965,5
01/04/1965,4,54.4469,1965-04-04,1965,4
01/03/1965,4,83.9047,1965-03-04,1965,3
01/02/1965,4,96.2387,1965-02-04,1965,2
01/01/1965,4,85.9333,1965-01-04,1965,1
01/12/1964,4,30.7107,1964-12-04,1964,12
01/11/1964,4,32.3283,1964-11-04,1964,11
01/10/1964,4,24.8206,1964-10-04,1964,10
01/09/1964,4,6.8195,1964-09-04,1964,9
01/08/1964,4,8.8786,1964-08-04,1964,8
01/07/1964,4,11.0537,1964-07-04,1964,7
01/06/1964,4,13.0004,1964-06-04,1964,6
01/05/1964,4,24.4383,1964-05-04,1964,5
01/04/1964,4,31.9221,1964-04-04,1964,4
01/03/1964,4,82.3905,1964-03-04,1964,3
01/02/1964,4,136.1032,1964-02-04,1964,2
01/01/1964,4,70.0249,1964-01-04,1964,1
01/12/1963,4,8.2778,1963-12-04,1963,12
01/11/1963,4,22.923,1963-11-04,1963,11
01/10/1963,4,4.3725,1963-10-04,1963,10
01/09/1963,4,8.2778,1963-09-04,1963,9
01/08/1963,4,12.671,1963-08-04,1963,8
01/07/1963,4,15.0162,1963-07-04,1963,7
01/06/1963,4,17.8025,1963-06-04,1963,6
01/05/1963,4,21.8012,1963-05-04,1963,5
01/04/1963,4,33.5539,1963-04-04,1963,4
01/03/1963,4,46.7882,1963-03-04,1963,3
01/02/1963,4,52.167,1963-02-04,1963,2
01/01/1963,4,115.2534,1963-01-04,1963,1
01/12/1962,4,35.2039,1962-12-04,1962,12
01/11/1962,4,27.8086,1962-11-04,1962,11
01/10/1962,4,27.8086,1962-10-04,1962,10
01/09/1962,4,5.7902,1962-09-04,1962,9
01/08/1962,4,5.9963,1962-08-04,1962,8
01/07/1962,4,8.0494,1962-07-04,1962,7
01/06/1962,4,11.678,1962-06-04,1962,6
01/05/1962,4,40.7736,1962-05-04,1962,5
01/04/1962,4,24.7776,1962-04-04,1962,4
01/03/1962,4,98.431,1962-03-04,1962,3
01/02/1962,4,101.575,1962-02-04,1962,2
01/01/1962,4,64.6776,1962-01-04,1962,1
01/12/1961,4,8.0494,1961-12-04,1961,12
01/11/1961,4,6.8641,1961-11-04,1961,11
01/10/1961,4,3.3438,1961-10-04,1961,10
01/09/1961,4,16.5238,1961-09-04,1961,9
01/08/1961,4,8.8155,1961-08-04,1961,8
01/07/1961,4,12.9603,1961-07-04,1961,7
01/06/1961,4,19.3328,1961-06-04,1961,6
01/05/1961,4,48.3972,1961-05-04,1961,5
01/04/1961,4,48.3972,1961-04-04,1961,4
01/03/1961,4,102.2091,1961-03-04,1961,3
01/02/1961,4,62.6168,1961-02-04,1961,2
01/01/1961,4,166.2529,1961-01-04,1961,1
01/12/1960,4,60.0823,1960-12-04,1960,12
01/11/1960,4,7.5617,1960-11-04,1960,11
01/10/1960,4,14.6772,1960-10-04,1960,10
01/09/1960,4,5.9963,1960-09-04,1960,9
01/08/1960,4,8.3001,1960-08-04,1960,8
01/07/1960,4,12.6322,1960-07-04,1960,7
01/06/1960,4,16.1439,1960-06-04,1960,6
01/05/1960,4,39.471,1960-05-04,1960,5
01/04/1960,4,40.7736,1960-04-04,1960,4
01/03/1960,4,83.9506,1960-03-04,1960,3
01/02/1960,4,100.3122,1960-02-04,1960,2
01/01/1960,4,20.1843,1960-01-04,1960,1
01/12/1959,4,20.1843,1959-12-04,1959,12
01/11/1959,4,23.8136,1959-11-04,1959,11
01/10/1959,4,8.5555,1959-10-04,1959,10
01/09/1959,4,9.6238,1959-09-04,1959,9
01/08/1959,4,10.7685,1959-08-04,1959,8
01/07/1959,4,13.6317,1959-07-04,1959,7
01/06/1959,4,17.6953,1959-06-04,1959,6
01/05/1959,4,25.7647,1959-05-04,1959,5
01/04/1959,4,74.8655,1959-04-04,1959,4
01/03/1959,4,28.0019,1959-03-04,1959,3
01/02/1959,4,39.3071,1959-02-04,1959,2
01/01/1959,4,40.8287,1959-01-04,1959,1
01/12/1958,4,24.7949,1958-12-04,1958,12
01/11/1958,4,41.5983,1958-11-04,1958,11
01/10/1958,4,23.2515,1958-10-04,1958,10
01/09/1958,4,19.4307,1958-09-04,1958,9
01/08/1958,4,23.864,1958-08-04,1958,8
01/07/1958,4,27.0231,1958-07-04,1958,7
01/06/1958,4,31.7114,1958-06-04,1958,6
01/05/1958,4,28.3313,1958-05-04,1958,5
01/04/1958,4,31.3664,1958-04-04,1958,4
01/03/1958,4,46.3382,1958-03-04,1958,3
01/02/1958,4,47.9644,1958-02-04,1958,2
01/01/1958,4,30.3407,1958-01-04,1958,1
01/12/1957,4,50.4463,1957-12-04,1957,12
01/11/1957,4,23.9308,1957-11-04,1957,11
01/10/1957,4,32.4467,1957-10-04,1957,10
01/09/1957,4,44.9545,1957-09-04,1957,9
01/08/1957,4,32.4467,1957-08-04,1957,8
01/07/1957,4,36.2369,1957-07-04,1957,7
01/06/1957,4,41.9706,1957-06-04,1957,6
01/05/1957,4,49.2596,1957-05-04,1957,5
01/04/1957,4,68.6165,1957-04-04,1957,4
01/03/1957,4,50.5165,1957-03-04,1957,3
01/02/1957,4,53.7106,1957-02-04,1957,2
01/01/1957,4,46.7814,1957-01-04,1957,1
01/12/1956,4,33.4899,1956-12-04,1956,12
01/11/1956,4,20.2432,1956-11-04,1956,11
01/10/1956,4,20.6347,1956-10-04,1956,10
01/09/1956,4,17.6272,1956-09-04,1956,9
01/08/1956,4,32.4467,1956-08-04,1956,8
01/07/1956,4,21.4314,1956-07-04,1956,7
01/06/1956,4,28.95,1956-06-04,1956,6
01/05/1956,4,30.4193,1956-05-04,1956,5
01/04/1956,4,36.796,1956-04-04,1956,4
01/03/1956,4,83.3218,1956-03-04,1956,3
01/02/1956,4,26.5975,1956-02-04,1956,2
01/01/1956,4,77.3115,1956-01-04,1956,1
01/12/1955,4,32.4467,1955-12-04,1955,12
01/11/1955,4,19.8562,1955-11-04,1955,11
01/10/1955,4,9.7353,1955-10-04,1955,10
01/09/1955,4,12.1531,1955-09-04,1955,9
01/08/1955,4,15.2253,1955-08-04,1955,8
01/07/1955,4,15.2253,1955-07-04,1955,7
01/06/1955,4,17.9877,1955-06-04,1955,6
01/05/1955,4,21.8365,1955-05-04,1955,5
01/04/1955,4,34.579,1955-04-04,1955,4
01/03/1955,4,42.5612,1955-03-04,1955,3
01/02/1955,4,30.9188,1955-02-04,1955,2
01/01/1955,4,64.4163,1955-01-04,1955,1
01/12/1954,4,7.8505,1954-12-04,1954,12
01/11/1954,4,16.2289,1954-11-04,1954,11
01/10/1954,4,10.5056,1954-10-04,1954,10
01/09/1954,4,7.2055,1954-09-04,1954,9
01/08/1954,4,8.299,1954-08-04,1954,8
01/07/1954,4,9.0,1954-07-04,1954,7
01/06/1954,4,12.7345,1954-06-04,1954,6
01/05/1954,4,15.5556,1954-05-04,1954,5
01/04/1954,4,16.2289,1954-04-04,1954,4
01/03/1954,4,17.6272,1954-03-04,1954,3
01/02/1954,4,13.6373,1954-02-04,1954,2
01/01/1954,4,35.681,1954-01-04,1954,1
01/12/1953,4,54.3582,1953-12-04,1953,12
01/11/1953,4,20.2432,1953-11-04,1953,11
01/10/1953,4,7.6318,1953-10-04,1953,10
01/09/1953,4,14.1764,1953-09-04,1953,9
01/08/1953,4,16.0342,1953-08-04,1953,8
01/07/1953,4,17.1942,1953-07-04,1953,7
01/06/1953,4,22.1651,1953-06-04,1953,6
01/05/1953,4,23.4888,1953-05-04,1953,5
01/04/1953,4,33.6279,1953-04-04,1953,4
01/03/1953,4,23.4888,1953-03-04,1953,3
01/02/1953,4,17.9862,1953-02-04,1953,2
01/01/1953,4,44.0666,1953-01-04,1953,1
01/12/1952,4,18.3877,1952-12-04,1952,12
01/11/1952,4,37.3373,1952-11-04,1952,11
01/10/1952,4,11.0759,1952-10-04,1952,10
01/09/1952,4,11.7373,1952-09-04,1952,9
01/08/1952,4,13.8163,1952-08-04,1952,8
01/07/1952,4,16.8038,1952-07-04,1952,7
01/06/1952,4,18.3877,1952-06-04,1952,6
01/05/1952,4,24.389,1952-05-04,1952,5
01/04/1952,4,42.913,1952-04-04,1952,4
01/03/1952,4,63.6435,1952-03-04,1952,3
01/02/1952,4,81.6364,1952-02-04,1952,2
01/01/1952,4,24.8443,1952-01-04,1952,1
01/12/1951,4,31.0779,1951-12-04,1951,12
01/11/1951,4,14.9081,1951-11-04,1951,11
01/10/1951,4,11.4046,1951-10-04,1951,10
01/09/1951,4,12.4147,1951-09-04,1951,9
01/08/1951,4,14.1764,1951-08-04,1951,8
01/07/1951,4,16.4172,1951-07-04,1951,7
01/06/1951,4,18.7929,1951-06-04,1951,6
01/05/1951,4,23.9372,1951-05-04,1951,5
01/04/1951,4,40.6441,1951-04-04,1951,4
01/03/1951,4,47.6034,1951-03-04,1951,3
01/02/1951,4,59.5402,1951-02-04,1951,2
01/01/1951,4,30.0813,1951-01-04,1951,1
01/12/1950,4,48.2038,1950-12-04,1950,12
01/11/1950,4,15.2797,1950-11-04,1950,11
01/10/1950,4,14.1764,1950-10-04,1950,10
01/09/1950,4,13.1077,1950-09-04,1950,9
01/08/1950,4,16.4172,1950-08-04,1950,8
01/07/1950,4,21.3004,1950-07-04,1950,7
01/06/1950,4,23.0441,1950-06-04,1950,6
01/05/1950,4,36.7975,1950-05-04,1950,5
01/04/1950,4,45.8208,1950-04-04,1950,4
01/03/1950,4,53.1194,1950-03-04,1950,3
01/02/1950,4,53.7478,1950-02-04,1950,2
01/01/1950,4,23.4888,1950-01-04,1950,1
01/12/1949,4,23.4888,1949-12-04,1949,12
01/11/1949,4,12.074,1949-11-04,1949,11
01/10/1949,4,9.1883,1949-10-04,1949,10
01/09/1949,4,13.1077,1949-09-04,1949,9
01/08/1949,4,19.2017,1949-08-04,1949,8
01/07/1949,4,23.4888,1949-07-04,1949,7
01/06/1949,4,26.2312,1949-06-04,1949,6
01/05/1949,4,32.0879,1949-05-04,1949,5
01/04/1949,4,32.5979,1949-04-04,1949,4
01/03/1949,4,40.0849,1949-03-04,1949,3
01/02/1949,4,78.2187,1949-02-04,1949,2
01/01/1949,4,37.8803,1949-01-04,1949,1
01/12/1948,4,36.261,1948-12-04,1948,12
01/11/1948,4,13.8424,1948-11-04,1948,11
01/10/1948,4,16.0472,1948-10-04,1948,10
01/09/1948,4,13.8424,1948-09-04,1948,9
01/08/1948,4,17.584,1948-08-04,1948,8
01/07/1948,4,19.5781,1948-07-04,1948,7
01/06/1948,4,26.2958,1948-06-04,1948,6
01/05/1948,4,26.7896,1948-05-04,1948,5
01/04/1948,4,40.6457,1948-04-04,1948,4
01/03/1948,4,40.1162,1948-03-04,1948,3
01/02/1948,4,48.1767,1948-02-04,1948,2
01/01/1948,4,37.4859,1948-01-04,1948,1
01/12/1947,4,39.5877,1947-12-04,1947,12
01/11/1947,4,28.2801,1947-11-04,1947,11
01/10/1947,4,21.2306,1947-10-04,1947,10
01/09/1947,4,27.2849,1947-09-04,1947,9
01/08/1947,4,19.9865,1947-08-04,1947,8
01/07/1947,4,22.9328,1947-07-04,1947,7
01/06/1947,4,25.8035,1947-06-04,1947,6
01/05/1947,4,32.8291,1947-05-04,1947,5
01/04/1947,4,50.9164,1947-04-04,1947,4
01/03/1947,4,88.6645,1947-03-04,1947,3
01/02/1947,4,34.886,1947-02-04,1947,2
01/01/1947,4,69.9578,1947-01-04,1947,1
01/12/1946,4,17.1949,1946-12-04,1946,12
01/11/1946,4,21.2306,1946-11-04,1946,11
01/10/1946,4,13.487,1946-10-04,1946,10
01/09/1946,4,13.1349,1946-09-04,1946,9
01/08/1946,4,16.4265,1946-08-04,1946,8
01/07/1946,4,17.9764,1946-07-04,1946,7
01/06/1946,4,20.3981,1946-06-04,1946,6
01/05/1946,4,25.3128,1946-05-04,1946,5
01/04/1946,4,46.5451,1946-04-04,1946,4
01/03/1946,4,34.886,1946-03-04,1946,3
01/02/1946,4,52.2842,1946-02-04,1946,2
01/01/1946,4,132.5223,1946-01-04,1946,1
01/12/1945,4,20.3981,1945-12-04,1945,12
01/11/1945,4,13.8424,1945-11-04,1945,11
01/10/1945,4,10.1274,1945-10-04,1945,10
01/09/1945,4,11.0973,1945-09-04,1945,9
01/08/1945,4,11.7622,1945-08-04,1945,8
01/07/1945,4,14.2014,1945-07-04,1945,7
01/06/1945,4,15.6713,1945-06-04,1945,6
01/05/1945,4,18.372,1945-05-04,1945,5
01/04/1945,4,38.5344,1945-04-04,1945,4
01/03/1945,4,32.3181,1945-03-04,1945,3
01/02/1945,4,95.9472,1945-02-04,1945,2
01/01/1945,4,16.809,1945-01-04,1945,1
01/12/1944,4,28.7799,1944-12-04,1944,12
01/11/1944,4,13.1349,1944-11-04,1944,11
01/10/1944,4,10.447,1944-10-04,1944,10
01/09/1944,4,19.9865,1944-09-04,1944,9
01/08/1944,4,13.8424,1944-08-04,1944,8
01/07/1944,4,16.809,1944-07-04,1944,7
01/06/1944,4,18.7709,1944-06-04,1944,6
01/05/1944,4,22.5026,1944-05-04,1944,5
01/04/1944,4,48.7226,1944-04-04,1944,4
01/03/1944,4,60.0823,1944-03-04,1944,3
01/02/1944,4,76.534,1944-02-04,1944,2
01/01/1944,4,32.3181,1944-01-04,1944,1
01/12/1943,4,34.886,1943-12-04,1943,12
01/11/1943,4,19.5781,1943-11-04,1943,11
01/10/1943,4,13.8424,1943-10-04,1943,10
01/09/1943,4,13.8424,1943-09-04,1943,9
01/08/1943,4,15.2988,1943-08-04,1943,8
01/07/1943,4,17.9764,1943-07-04,1943,7
01/06/1943,4,19.5781,1943-06-04,1943,6
01/05/1943,4,24.3361,1943-05-04,1943,5
01/04/1943,4,34.3699,1943-04-04,1943,4
01/03/1943,4,35.9222,1943-03-04,1943,3
01/02/1943,4,66.7677,1943-02-04,1943,2
01/01/1943,4,56.6118,1943-01-04,1943,1
01/12/1942,4,30.2879,1942-12-04,1942,12
01/11/1942,4,22.0755,1942-11-04,1942,11
01/10/1942,4,13.8424,1942-10-04,1942,10
01/09/1942,4,12.4415,1942-09-04,1942,9
01/08/1942,4,15.2988,1942-08-04,1942,8
01/07/1942,4,16.809,1942-07-04,1942,7
01/06/1942,4,19.5781,1942-06-04,1942,6
01/05/1942,4,21.6515,1942-05-04,1942,5
01/04/1942,4,28.2801,1942-04-04,1942,4
01/03/1942,4,58.088,1942-03-04,1942,3
01/02/1942,4,19.5781,1942-02-04,1942,2
01/01/1942,4,33.855,1942-01-04,1942,1
01/12/1941,4,27.2849,1941-12-04,1941,12
01/11/1941,4,19.5781,1941-11-04,1941,11
01/10/1941,4,28.7799,1941-10-04,1941,10
01/09/1941,4,32.3181,1941-09-04,1941,9
01/08/1941,4,12.7864,1941-08-04,1941,8
01/07/1941,4,13.8424,1941-07-04,1941,7
01/06/1941,4,14.9296,1941-06-04,1941,6
01/05/1941,4,17.1949,1941-05-04,1941,5
01/04/1941,4,28.7799,1941-04-04,1941,4
01/03/1941,4,31.3002,1941-03-04,1941,3
01/02/1941,4,53.2328,1941-02-04,1941,2
01/01/1941,4,83.9506,1941-01-04,1941,1
01/12/1940,4,48.7226,1940-12-04,1940,12
01/11/1940,4,19.9865,1940-11-04,1940,11
01/10/1940,4,13.487,1940-10-04,1940,10
01/09/1940,4,13.487,1940-09-04,1940,9
01/08/1940,4,15.2988,1940-08-04,1940,8
01/07/1940,4,18.372,1940-07-04,1940,7
01/06/1940,4,23.366,1940-06-04,1940,6
01/05/1940,4,30.2879,1940-05-04,1940,5
01/04/1940,4,41.7084,1940-04-04,1940,4
01/03/1940,4,47.6318,1940-03-04,1940,3
01/02/1940,4,59.581,1940-02-04,1940,2
01/01/1940,4,61.5975,1940-01-04,1940,1
01/12/1939,4,24.3361,1939-12-04,1939,12
01/11/1939,4,14.5638,1939-11-04,1939,11
01/10/1939,4,29.2811,1939-10-04,1939,10
01/09/1939,4,15.7525,1939-09-04,1939,9
01/08/1939,4,17.002,1939-08-04,1939,8
01/07/1939,4,15.7525,1939-07-04,1939,7
01/06/1939,4,17.8546,1939-06-04,1939,6
01/05/1939,4,21.8787,1939-05-04,1939,5
01/04/1939,4,30.8008,1939-04-04,1939,4
01/03/1939,4,34.568,1939-03-04,1939,3
01/02/1939,4,57.0243,1939-02-04,1939,2
01/01/1939,4,67.9726,1939-01-04,1939,1
01/12/1938,4,79.9195,1938-12-04,1938,12
01/11/1938,4,33.4752,1938-11-04,1938,11
01/10/1938,4,15.7525,1938-10-04,1938,10
01/09/1938,4,17.002,1938-09-04,1938,9
01/08/1938,4,19.1622,1938-08-04,1938,8
01/07/1938,4,15.3439,1938-07-04,1938,7
01/06/1938,4,20.5037,1938-06-04,1938,6
01/05/1938,4,21.4167,1938-05-04,1938,5
01/04/1938,4,28.7213,1938-04-04,1938,4
01/03/1938,4,79.3507,1938-03-04,1938,3
01/02/1938,4,67.9726,1938-02-04,1938,2
01/01/1938,4,105.4053,1938-01-04,1938,1
01/12/1937,4,128.281,1937-12-04,1937,12
01/11/1937,4,49.9187,1937-11-04,1937,11
01/10/1937,4,51.8217,1937-10-04,1937,10
01/09/1937,4,15.3439,1937-09-04,1937,9
01/08/1937,4,15.7525,1937-08-04,1937,8
01/07/1937,4,13.7497,1937-07-04,1937,7
01/06/1937,4,20.9584,1937-06-04,1937,6
01/05/1937,4,36.2314,1937-05-04,1937,5
01/04/1937,4,23.763,1937-04-04,1937,4
01/03/1937,4,54.3999,1937-03-04,1937,3
01/02/1937,4,46.8062,1937-02-04,1937,2
01/01/1937,4,92.8819,1937-01-04,1937,1
01/12/1936,4,13.7497,1936-12-04,1936,12
01/11/1936,4,11.4825,1936-11-04,1936,11
01/10/1936,4,10.7609,1936-10-04,1936,10
01/09/1936,4,12.5972,1936-09-04,1936,9
01/08/1936,4,10.7609,1936-08-04,1936,8
01/07/1936,4,11.8498,1936-07-04,1936,7
01/06/1936,4,14.9393,1936-06-04,1936,6
01/05/1936,4,27.7019,1936-05-04,1936,5
01/04/1936,4,30.8008,1936-04-04,1936,4
01/03/1936,4,60.3688,1936-03-04,1936,3
01/02/1936,4,13.3614,1936-02-04,1936,2
01/01/1936,4,30.8008,1936-01-04,1936,1
01/12/1935,4,17.4264,1935-12-04,1935,12
01/11/1935,4,17.4264,1935-11-04,1935,11
01/10/1935,4,20.9584,1935-10-04,1935,10
01/09/1935,4,11.8498,1935-09-04,1935,9
01/08/1935,4,14.1421,1935-08-04,1935,8
01/07/1935,4,15.7525,1935-07-04,1935,7
01/06/1935,4,20.0528,1935-06-04,1935,6
01/05/1935,4,25.2138,1935-05-04,1935,5
01/04/1935,4,94.1028,1935-04-04,1935,4
01/03/1935,4,37.3564,1935-03-04,1935,3
01/02/1935,4,92.8819,1935-02-04,1935,2
01/01/1935,4,61.0462,1935-01-04,1935,1
01/12/1934,4,18.2866,1934-12-04,1934,12
01/11/1934,4,8.0529,1934-11-04,1934,11
01/10/1934,4,7.114,1934-10-04,1934,10
01/09/1934,4,7.114,1934-09-04,1934,9
01/08/1934,4,7.114,1934-08-04,1934,8
01/07/1934,4,7.114,1934-07-04,1934,7
01/06/1934,4,5.9308,1934-06-04,1934,6
01/05/1934,4,10.4066,1934-05-04,1934,5
01/04/1934,4,14.1421,1934-04-04,1934,4
01/03/1934,4,,1934-03-04,1934,3
01/12/2023,5,19.939,2023-12-05,2023,12
01/11/2023,5,19.5996,2023-11-05,2023,11
01/10/2023,5,15.3657,2023-10-05,2023,10
01/09/2023,5,15.995,2023-09-05,2023,9
01/08/2023,5,15.0541,2023-08-05,2023,8
01/07/2023,5,18.5929,2023-07-05,2023,7
01/06/2023,5,22.7215,2023-06-05,2023,6
01/05/2023,5,30.1754,2023-05-05,2023,5
01/04/2023,5,34.9676,2023-04-05,2023,4
01/03/2023,5,49.276,2023-03-05,2023,3
01/02/2023,5,65.5319,2023-02-05,2023,2
01/01/2023,5,67.1328,2023-01-05,2023,1
01/12/2022,5,19.939,2022-12-05,2022,12
01/11/2022,5,12.9328,2022-11-05,2022,11
01/10/2022,5,22.3672,2022-10-05,2022,10
01/09/2022,5,9.8202,2022-09-05,2022,9
01/08/2022,5,11.2004,2022-08-05,2022,8
01/07/2022,5,13.5281,2022-07-05,2022,7
01/06/2022,5,15.3657,2022-06-05,2022,6
01/05/2022,5,18.9266,2022-05-05,2022,5
01/04/2022,5,28.63,2022-04-05,2022,4
01/03/2022,5,32.9429,2022-03-05,2022,3
01/02/2022,5,70.3688,2022-02-05,2022,2
01/01/2022,5,31.7471,2022-01-05,2022,1
01/12/2021,5,14.4718,2021-12-05,2021,12
01/11/2021,5,28.3152,2021-11-05,2021,11
01/10/2021,5,11.5108,2021-10-05,2021,10
01/09/2021,5,9.0426,2021-09-05,2021,9
01/08/2021,5,11.2271,2021-08-05,2021,8
01/07/2021,5,12.6686,2021-07-05,2021,7
01/06/2021,5,16.3516,2021-06-05,2021,6
01/05/2021,5,15.7167,2021-05-05,2021,5
01/04/2021,5,21.0185,2021-04-05,2021,4
01/03/2021,5,26.4252,2021-03-05,2021,3
01/02/2021,5,51.2383,2021-02-05,2021,2
01/01/2021,5,36.6155,2021-01-05,2021,1
01/12/2020,5,16.6324,2020-12-05,2020,12
01/11/2020,5,8.521,2020-11-05,2020,11
01/10/2020,5,6.5394,2020-10-05,2020,10
01/09/2020,5,7.758,2020-09-05,2020,9
01/08/2020,5,9.5742,2020-08-05,2020,8
01/07/2020,5,12.0852,2020-07-05,2020,7
01/06/2020,5,14.7799,2020-06-05,2020,6
01/05/2020,5,16.6721,2020-05-05,2020,5
01/04/2020,5,28.6983,2020-04-05,2020,4
01/03/2020,5,61.8412,2020-03-05,2020,3
01/02/2020,5,52.0448,2020-02-05,2020,2
01/01/2020,5,36.2876,2020-01-05,2020,1
01/12/2019,5,15.4023,2019-12-05,2019,12
01/11/2019,5,8.2641,2019-11-05,2019,11
01/10/2019,5,8.2641,2019-10-05,2019,10
01/09/2019,5,9.8437,2019-09-05,2019,9
01/08/2019,5,8.2641,2019-08-05,2019,8
01/07/2019,5,10.1156,2019-07-05,2019,7
01/06/2019,5,12.9637,2019-06-05,2019,6
01/05/2019,5,15.09,2019-05-05,2019,5
01/04/2019,5,18.9717,2019-04-05,2019,4
01/03/2019,5,75.8607,2019-03-05,2019,3
01/02/2019,5,43.0111,2019-02-05,2019,2
01/01/2019,5,36.2876,2019-01-05,2019,1
01/12/2018,5,33.3446,2018-12-05,2018,12
01/11/2018,5,8.2641,2018-11-05,2018,11
01/10/2018,5,8.2641,2018-10-05,2018,10
01/09/2018,5,6.0713,2018-09-05,2018,9
01/08/2018,5,17.3192,2018-08-05,2018,8
01/07/2018,5,6.7776,2018-07-05,2018,7
01/06/2018,5,7.758,2018-06-05,2018,6
01/05/2018,5,8.7806,2018-05-05,2018,5
01/04/2018,5,16.9947,2018-04-05,2018,4
01/03/2018,5,25.3118,2018-03-05,2018,3
01/02/2018,5,18.3048,2018-02-05,2018,2
01/01/2018,5,22.3672,2018-01-05,2018,1
01/12/2017,5,17.3192,2017-12-05,2017,12
01/11/2017,5,9.3072,2017-11-05,2017,11
01/10/2017,5,18.9717,2017-10-05,2017,10
01/09/2017,5,7.758,2017-09-05,2017,9
01/08/2017,5,8.7806,2017-08-05,2017,8
01/07/2017,5,10.6666,2017-07-05,2017,7
01/06/2017,5,12.6686,2017-06-05,2017,6
01/05/2017,5,12.9637,2017-05-05,2017,5
01/04/2017,5,13.5604,2017-04-05,2017,4
01/03/2017,5,22.7215,2017-03-05,2017,3
01/02/2017,5,37.9579,2017-02-05,2017,2
01/01/2017,5,33.4242,2017-01-05,2017,1
01/12/2016,5,33.0215,2016-12-05,2016,12
01/11/2016,5,19.5996,2016-11-05,2016,11
01/10/2016,5,16.9947,2016-10-05,2016,10
01/09/2016,5,11.5108,2016-09-05,2016,9
01/08/2016,5,10.9457,2016-08-05,2016,8
01/07/2016,5,13.5604,2016-07-05,2016,7
01/06/2016,5,25.6812,2016-06-05,2016,6
01/05/2016,5,15.7167,2016-05-05,2016,5
01/04/2016,5,23.1326,2016-04-05,2016,4
01/03/2016,5,42.2396,2016-03-05,2016,3
01/02/2016,5,27.8673,2016-02-05,2016,2
01/01/2016,5,30.1754,2016-01-05,2016,1
01/12/2015,5,40.509,2015-12-05,2015,12
01/11/2015,5,19.6464,2015-11-05,2015,11
01/10/2015,5,7.2624,2015-10-05,2015,10
01/09/2015,5,6.3039,2015-09-05,2015,9
01/08/2015,5,7.0186,2015-08-05,2015,8
01/07/2015,5,9.3072,2015-07-05,2015,7
01/06/2015,5,11.2271,2015-06-05,2015,6
01/05/2015,5,12.6686,2015-05-05,2015,5
01/04/2015,5,17.9743,2015-04-05,2015,4
01/03/2015,5,9.9942,2015-03-05,2015,3
01/02/2015,5,18.9679,2015-02-05,2015,2
01/01/2015,5,13.8179,2015-01-05,2015,1
01/10/2014,5,,2014-10-05,2014,10
01/09/2014,5,,2014-09-05,2014,9
01/08/2014,5,,2014-08-05,2014,8
01/07/2014,5,,2014-07-05,2014,7
01/06/2014,5,,2014-06-05,2014,6
01/05/2014,5,9.658,2014-05-05,2014,5
01/04/2014,5,13.1068,2014-04-05,2014,4
01/03/2014,5,12.4024,2014-03-05,2014,3
01/02/2014,5,12.4024,2014-02-05,2014,2
01/01/2014,5,20.4895,2014-01-05,2014,1
01/12/2013,5,54.3131,2013-12-05,2013,12
01/11/2013,5,12.7537,2013-11-05,2013,11
01/10/2013,5,40.9817,2013-10-05,2013,10
01/09/2013,5,15.9896,2013-09-05,2013,9
01/08/2013,5,16.7257,2013-08-05,2013,8
01/07/2013,5,21.2581,2013-07-05,2013,7
01/06/2013,5,26.7702,2013-06-05,2013,6
01/05/2013,5,25.5704,2013-05-05,2013,5
01/04/2013,5,39.2564,2013-04-05,2013,4
01/03/2013,5,56.1389,2013-03-05,2013,3
01/02/2013,5,106.2837,2013-02-05,2013,2
01/01/2013,5,28.3848,2013-01-05,2013,1
01/12/2012,5,27.5754,2012-12-05,2012,12
01/11/2012,5,20.4895,2012-11-05,2012,11
01/10/2012,5,11.015,2012-10-05,2012,10
01/09/2012,5,14.5355,2012-09-05,2012,9
01/08/2012,5,17.4675,2012-08-05,2012,8
01/07/2012,5,22.8098,2012-07-05,2012,7
01/06/2012,5,23.2007,2012-06-05,2012,6
01/05/2012,5,28.7911,2012-05-05,2012,5
01/04/2012,5,31.6628,2012-04-05,2012,4
01/03/2012,5,34.1617,2012-03-05,2012,3
01/02/2012,5,46.2343,2012-02-05,2012,2
01/01/2012,5,114.9743,2012-01-05,2012,1
01/12/2011,5,22.8098,2011-12-05,2011,12
01/11/2011,5,13.8179,2011-11-05,2011,11
01/10/2011,5,17.4675,2011-10-05,2011,10
01/09/2011,5,14.8967,2011-09-05,2011,9
01/08/2011,5,20.1072,2011-08-05,2011,8
01/07/2011,5,22.4201,2011-07-05,2011,7
01/06/2011,5,25.9693,2011-06-05,2011,6
01/05/2011,5,26.7702,2011-05-05,2011,5
01/04/2011,5,69.2851,2011-04-05,2011,4
01/03/2011,5,68.7452,2011-03-05,2011,3
01/02/2011,5,53.4043,2011-02-05,2011,2
01/01/2011,5,131.6371,2011-01-05,2011,1
01/12/2010,5,21.2581,2010-12-05,2010,12
01/11/2010,5,25.5704,2010-11-05,2010,11
01/10/2010,5,15.9896,2010-10-05,2010,10
01/09/2010,5,12.0529,2010-09-05,2010,9
01/08/2010,5,15.6238,2010-08-05,2010,8
01/07/2010,5,18.9679,2010-07-05,2010,7
01/06/2010,5,,2010-06-05,2010,6
01/05/2010,5,28.3848,2010-05-05,2010,5
01/04/2010,5,65.8928,2010-04-05,2010,4
01/03/2010,5,56.597,2010-03-05,2010,3
01/02/2010,5,38.8271,2010-02-05,2010,2
01/01/2010,5,79.2139,2010-01-05,2010,1
01/12/2009,5,98.9977,2009-12-05,2009,12
01/11/2009,5,48.0095,2009-11-05,2009,11
01/10/2009,5,28.7911,2009-10-05,2009,10
01/09/2009,5,18.9679,2009-09-05,2009,9
01/08/2009,5,20.8732,2009-08-05,2009,8
01/07/2009,5,26.3692,2009-07-05,2009,7
01/06/2009,5,28.7911,2009-06-05,2009,6
01/05/2009,5,41.8493,2009-05-05,2009,5
01/04/2009,5,56.597,2009-04-05,2009,4
01/03/2009,5,61.6788,2009-03-05,2009,3
01/02/2009,5,106.8977,2009-02-05,2009,2
01/01/2009,5,75.8607,2009-01-05,2009,1
01/12/2008,5,19.7261,2008-12-05,2008,12
01/11/2008,5,29.1984,2008-11-05,2008,11
01/10/2008,5,22.0315,2008-10-05,2008,10
01/09/2008,5,13.1068,2008-09-05,2008,9
01/08/2008,5,15.6238,2008-08-05,2008,8
01/07/2008,5,20.1072,2008-07-05,2008,7
01/06/2008,5,24.776,2008-06-05,2008,6
01/05/2008,5,35.002,2008-05-05,2008,5
01/04/2008,5,38.3986,2008-04-05,2008,4
01/03/2008,5,41.8493,2008-03-05,2008,3
01/02/2008,5,67.3083,2008-02-05,2008,2
01/01/2008,5,13.8179,2008-01-05,2008,1
01/12/2007,5,18.5907,2007-12-05,2007,12
01/11/2007,5,14.1759,2007-11-05,2007,11
01/10/2007,5,8.9916,2007-10-05,2007,10
01/09/2007,5,11.015,2007-09-05,2007,9
01/08/2007,5,14.5355,2007-08-05,2007,8
01/07/2007,5,16.7257,2007-07-05,2007,7
01/06/2007,5,22.8098,2007-06-05,2007,6
01/05/2007,5,22.8098,2007-05-05,2007,5
01/04/2007,5,28.3848,2007-04-05,2007,4
01/03/2007,5,36.6934,2007-03-05,2007,3
01/02/2007,5,93.0445,2007-02-05,2007,2
01/01/2007,5,159.9114,2007-01-05,2007,1
01/12/2006,5,45.3511,2006-12-05,2006,12
01/11/2006,5,53.4043,2006-11-05,2006,11
01/10/2006,5,12.7537,2006-10-05,2006,10
01/09/2006,5,13.8179,2006-09-05,2006,9
01/08/2006,5,12.4024,2006-08-05,2006,8
01/07/2006,5,14.1759,2006-07-05,2006,7
01/06/2006,5,15.6238,2006-06-05,2006,6
01/05/2006,5,18.9679,2006-05-05,2006,5
01/04/2006,5,25.9693,2006-04-05,2006,4
01/03/2006,5,79.2139,2006-03-05,2006,3
01/02/2006,5,29.1984,2006-02-05,2006,2
01/01/2006,5,63.078,2006-01-05,2006,1
01/12/2005,5,26.3692,2005-12-05,2005,12
01/11/2005,5,24.776,2005-11-05,2005,11
01/10/2005,5,13.8179,2005-10-05,2005,10
01/09/2005,5,13.8179,2005-09-05,2005,9
01/08/2005,5,16.7257,2005-08-05,2005,8
01/07/2005,5,20.4895,2005-07-05,2005,7
01/06/2005,5,26.7702,2005-06-05,2005,6
01/05/2005,5,27.5754,2005-05-05,2005,5
01/04/2005,5,31.6628,2005-04-05,2005,4
01/03/2005,5,48.0095,2005-03-05,2005,3
01/02/2005,5,111.225,2005-02-05,2005,2
01/01/2005,5,53.4043,2005-01-05,2005,1
01/12/2004,5,31.6628,2004-12-05,2004,12
01/11/2004,5,21.2581,2004-11-05,2004,11
01/10/2004,5,23.2007,2004-10-05,2004,10
01/09/2004,5,11.3591,2004-09-05,2004,9
01/08/2004,5,15.2595,2004-08-05,2004,8
01/07/2004,5,18.5907,2004-07-05,2004,7
01/06/2004,5,30.0159,2004-06-05,2004,6
01/05/2004,5,26.3692,2004-05-05,2004,5
01/04/2004,5,63.5456,2004-04-05,2004,4
01/03/2004,5,37.5443,2004-03-05,2004,3
01/02/2004,5,32.492,2004-02-05,2004,2
01/01/2004,5,18.2149,2004-01-05,2004,1
01/12/2003,5,112.4707,2003-12-05,2003,12
01/11/2003,5,10.3326,2003-11-05,2003,11
01/10/2003,5,7.6852,2003-10-05,2003,10
01/09/2003,5,11.3591,2003-09-05,2003,9
01/08/2003,5,11.3591,2003-08-05,2003,8
01/07/2003,5,13.1068,2003-07-05,2003,7
01/06/2003,5,16.7257,2003-06-05,2003,6
01/05/2003,5,19.7261,2003-05-05,2003,5
01/04/2003,5,24.776,2003-04-05,2003,4
01/03/2003,5,30.8374,2003-03-05,2003,3
01/02/2003,5,77.5319,2003-02-05,2003,2
01/01/2003,5,40.9817,2003-01-05,2003,1
01/12/2002,5,30.0159,2002-12-05,2002,12
01/11/2002,5,12.4024,2002-11-05,2002,11
01/10/2002,5,10.6728,2002-10-05,2002,10
01/09/2002,5,10.3326,2002-09-05,2002,9
01/08/2002,5,13.1068,2002-08-05,2002,8
01/07/2002,5,13.1068,2002-07-05,2002,7
01/06/2002,5,15.9896,2002-06-05,2002,6
01/05/2002,5,20.4895,2002-05-05,2002,5
01/04/2002,5,26.7702,2002-04-05,2002,4
01/03/2002,5,40.9817,2002-03-05,2002,3
01/02/2002,5,73.0995,2002-02-05,2002,2
01/01/2002,5,45.3511,2002-01-05,2002,1
01/12/2001,5,26.3692,2001-12-05,2001,12
01/11/2001,5,18.9679,2001-11-05,2001,11
01/10/2001,5,23.5928,2001-10-05,2001,10
01/09/2001,5,7.6852,2001-09-05,2001,9
01/08/2001,5,6.4171,2001-08-05,2001,8
01/07/2001,5,8.0084,2001-07-05,2001,7
01/06/2001,5,10.6728,2001-06-05,2001,6
01/05/2001,5,9.658,2001-05-05,2001,5
01/04/2001,5,19.7261,2001-04-05,2001,4
01/03/2001,5,16.7257,2001-03-05,2001,3
01/02/2001,5,19.3463,2001-02-05,2001,2
01/01/2001,5,31.6628,2001-01-05,2001,1
01/12/2000,5,44.471,2000-12-05,2000,12
01/11/2000,5,17.8405,2000-11-05,2000,11
01/10/2000,5,15.6238,2000-10-05,2000,10
01/09/2000,5,29.1984,2000-09-05,2000,9
01/08/2000,5,15.2595,2000-08-05,2000,8
01/07/2000,5,15.9896,2000-07-05,2000,7
01/06/2000,5,19.3463,2000-06-05,2000,6
01/05/2000,5,23.5928,2000-05-05,2000,5
01/04/2000,5,35.002,2000-04-05,2000,4
01/03/2000,5,37.1184,2000-03-05,2000,3
01/02/2000,5,57.9753,2000-02-05,2000,2
01/01/2000,5,186.8451,2000-01-05,2000,1
01/12/1999,5,28.3848,1999-12-05,1999,12
01/11/1999,5,7.6852,1999-11-05,1999,11
01/10/1999,5,8.6616,1999-10-05,1999,10
01/09/1999,5,9.9942,1999-09-05,1999,9
01/08/1999,5,13.4615,1999-08-05,1999,8
01/07/1999,5,15.9896,1999-07-05,1999,7
01/06/1999,5,17.8405,1999-06-05,1999,6
01/05/1999,5,22.0315,1999-05-05,1999,5
01/04/1999,5,30.8374,1999-04-05,1999,4
01/03/1999,5,51.1441,1999-03-05,1999,3
01/02/1999,5,40.1174,1999-02-05,1999,2
01/01/1999,5,63.5456,1999-01-05,1999,1
01/12/1998,5,17.0959,1998-12-05,1998,12
01/11/1998,5,17.4675,1998-11-05,1998,11
01/10/1998,5,20.1072,1998-10-05,1998,10
01/09/1998,5,12.4024,1998-09-05,1998,9
01/08/1998,5,14.8967,1998-08-05,1998,8
01/07/1998,5,17.8405,1998-07-05,1998,7
01/06/1998,5,23.9861,1998-06-05,1998,6
01/05/1998,5,30.4262,1998-05-05,1998,5
01/04/1998,5,41.4151,1998-04-05,1998,4
01/03/1998,5,37.5443,1998-03-05,1998,3
01/02/1998,5,25.5704,1998-02-05,1998,2
01/01/1998,5,36.6934,1998-01-05,1998,1
01/12/1997,5,35.4235,1997-12-05,1997,12
01/11/1997,5,17.4675,1997-11-05,1997,11
01/10/1997,5,19.3463,1997-10-05,1997,10
01/09/1997,5,15.9896,1997-09-05,1997,9
01/08/1997,5,20.1072,1997-08-05,1997,8
01/07/1997,5,25.1726,1997-07-05,1997,7
01/06/1997,5,33.7429,1997-06-05,1997,6
01/05/1997,5,32.0769,1997-05-05,1997,5
01/04/1997,5,48.9015,1997-04-05,1997,4
01/03/1997,5,58.8973,1997-03-05,1997,3
01/02/1997,5,83.1795,1997-02-05,1997,2
01/01/1997,5,137.558,1997-01-05,1997,1
01/12/1996,5,61.2137,1996-12-05,1996,12
01/11/1996,5,60.2852,1996-11-05,1996,11
01/10/1996,5,50.2449,1996-10-05,1996,10
01/09/1996,5,36.6934,1996-09-05,1996,9
01/08/1996,5,14.1759,1996-08-05,1996,8
01/07/1996,5,17.8405,1996-07-05,1996,7
01/06/1996,5,20.1072,1996-06-05,1996,6
01/05/1996,5,23.2007,1996-05-05,1996,5
01/04/1996,5,30.0159,1996-04-05,1996,4
01/03/1996,5,94.2264,1996-03-05,1996,3
01/02/1996,5,79.2139,1996-02-05,1996,2
01/01/1996,5,68.2549,1996-01-05,1996,1
01/12/1995,5,27.9796,1995-12-05,1995,12
01/11/1995,5,20.1072,1995-11-05,1995,11
01/10/1995,5,12.4024,1995-10-05,1995,10
01/09/1995,5,10.3326,1995-09-05,1995,9
01/08/1995,5,13.4615,1995-08-05,1995,8
01/07/1995,5,16.7257,1995-07-05,1995,7
01/06/1995,5,20.1072,1995-06-05,1995,6
01/05/1995,5,22.0315,1995-05-05,1995,5
01/04/1995,5,33.325,1995-04-05,1995,4
01/03/1995,5,47.1204,1995-03-05,1995,3
01/02/1995,5,84.3231,1995-02-05,1995,2
01/01/1995,5,51.1441,1995-01-05,1995,1
01/12/1994,5,13.4615,1994-12-05,1994,12
01/11/1994,5,12.4024,1994-11-05,1994,11
01/10/1994,5,11.3591,1994-10-05,1994,10
01/09/1994,5,14.5355,1994-09-05,1994,9
01/08/1994,5,18.2149,1994-08-05,1994,8
01/07/1994,5,23.2007,1994-07-05,1994,7
01/06/1994,5,29.1984,1994-06-05,1994,6
01/05/1994,5,25.1726,1994-05-05,1994,5
01/04/1994,5,37.971,1994-04-05,1994,4
01/03/1994,5,54.7686,1994-03-05,1994,3
01/02/1994,5,40.5492,1994-02-05,1994,2
01/01/1994,5,70.9125,1994-01-05,1994,1
01/12/1993,5,39.6865,1993-12-05,1993,12
01/11/1993,5,17.0959,1993-11-05,1993,11
01/10/1993,5,18.9679,1993-10-05,1993,10
01/09/1993,5,13.8179,1993-09-05,1993,9
01/08/1993,5,17.4675,1993-08-05,1993,8
01/07/1993,5,21.2581,1993-07-05,1993,7
01/06/1993,5,25.5704,1993-06-05,1993,6
01/05/1993,5,29.6066,1993-05-05,1993,5
01/04/1993,5,47.5646,1993-04-05,1993,4
01/03/1993,5,56.1389,1993-03-05,1993,3
01/02/1993,5,72.0035,1993-02-05,1993,2
01/01/1993,5,70.9125,1993-01-05,1993,1
01/12/1992,5,34.5814,1992-12-05,1992,12
01/11/1992,5,75.3061,1992-11-05,1992,11
01/10/1992,5,27.1723,1992-10-05,1992,10
01/09/1992,5,17.0959,1992-09-05,1992,9
01/08/1992,5,16.7257,1992-08-05,1992,8
01/07/1992,5,19.3463,1992-07-05,1992,7
01/06/1992,5,25.9693,1992-06-05,1992,6
01/05/1992,5,56.597,1992-05-05,1992,5
01/04/1992,5,34.5814,1992-04-05,1992,4
01/03/1992,5,57.0558,1992-03-05,1992,3
01/02/1992,5,149.6276,1992-02-05,1992,2
01/01/1992,5,49.3486,1992-01-05,1992,1
01/12/1991,5,13.8179,1991-12-05,1991,12
01/11/1991,5,32.0769,1991-11-05,1991,11
01/10/1991,5,32.908,1991-10-05,1991,10
01/09/1991,5,15.9896,1991-09-05,1991,9
01/08/1991,5,20.4895,1991-08-05,1991,8
01/07/1991,5,24.3805,1991-07-05,1991,7
01/06/1991,5,29.6066,1991-06-05,1991,6
01/05/1991,5,38.3986,1991-05-05,1991,5
01/04/1991,5,75.3061,1991-04-05,1991,4
01/03/1991,5,73.0995,1991-03-05,1991,3
01/02/1991,5,54.7686,1991-02-05,1991,2
01/01/1991,5,57.0558,1991-01-05,1991,1
01/12/1990,5,13.8179,1990-12-05,1990,12
01/11/1990,5,16.815,1990-11-05,1990,11
01/10/1990,5,14.809,1990-10-05,1990,10
01/09/1990,5,15.4687,1990-09-05,1990,9
01/08/1990,5,14.809,1990-08-05,1990,8
01/07/1990,5,16.1375,1990-07-05,1990,7
01/06/1990,5,17.5013,1990-06-05,1990,6
01/05/1990,5,28.3618,1990-05-05,1990,5
01/04/1990,5,29.9842,1990-04-05,1990,4
01/03/1990,5,38.951,1990-03-05,1990,3
01/02/1990,5,21.0591,1990-02-05,1990,2
01/01/1990,5,123.4116,1990-01-05,1990,1
01/12/1989,5,17.8477,1989-12-05,1989,12
01/11/1989,5,21.7951,1989-11-05,1989,11
01/10/1989,5,18.1962,1989-10-05,1989,10
01/09/1989,5,16.815,1989-09-05,1989,9
01/08/1989,5,21.0591,1989-08-05,1989,8
01/07/1989,5,21.7951,1989-07-05,1989,7
01/06/1989,5,24.0504,1989-06-05,1989,6
01/05/1989,5,30.3942,1989-05-05,1989,5
01/04/1989,5,41.1923,1989-04-05,1989,4
01/03/1989,5,119.5968,1989-03-05,1989,3
01/02/1989,5,53.4604,1989-02-05,1989,2
01/01/1989,5,101.1014,1989-01-05,1989,1
01/12/1988,5,22.1661,1988-12-05,1988,12
01/11/1988,5,24.433,1988-11-05,1988,11
01/10/1988,5,18.5468,1988-10-05,1988,10
01/09/1988,5,15.1378,1988-09-05,1988,9
01/08/1988,5,18.8995,1988-08-05,1988,8
01/07/1988,5,22.5391,1988-07-05,1988,7
01/06/1988,5,37.1867,1988-06-05,1988,6
01/05/1988,5,30.3942,1988-05-05,1988,5
01/04/1988,5,36.7497,1988-04-05,1988,4
01/03/1988,5,98.7103,1988-03-05,1988,3
01/02/1988,5,47.6733,1988-02-05,1988,2
01/01/1988,5,58.9451,1988-01-05,1988,1
01/12/1987,5,25.2039,1987-12-05,1987,12
01/11/1987,5,16.815,1987-11-05,1987,11
01/10/1987,5,19.6112,1987-10-05,1987,10
01/09/1987,5,17.5013,1987-09-05,1987,9
01/08/1987,5,21.0591,1987-08-05,1987,8
01/07/1987,5,25.9824,1987-07-05,1987,7
01/06/1987,5,25.6245,1987-06-05,1987,6
01/05/1987,5,29.609,1987-05-05,1987,5
01/04/1987,5,98.431,1987-04-05,1987,4
01/03/1987,5,31.5244,1987-03-05,1987,3
01/02/1987,5,34.7257,1987-02-05,1987,2
01/01/1987,5,62.8616,1987-01-05,1987,1
01/12/1986,5,21.0038,1986-12-05,1986,12
01/11/1986,5,12.5237,1986-11-05,1986,11
01/10/1986,5,15.0,1986-10-05,1986,10
01/09/1986,5,18.296,1986-09-05,1986,9
01/08/1986,5,19.7752,1986-08-05,1986,8
01/07/1986,5,25.2778,1986-07-05,1986,7
01/06/1986,5,26.3257,1986-06-05,1986,6
01/05/1986,5,28.8612,1986-05-05,1986,5
01/04/1986,5,38.966,1986-04-05,1986,4
01/03/1986,5,73.109,1986-03-05,1986,3
01/02/1986,5,55.6836,1986-02-05,1986,2
01/01/1986,5,77.9726,1986-01-05,1986,1
01/12/1985,5,107.9935,1985-12-05,1985,12
01/11/1985,5,95.9472,1985-11-05,1985,11
01/10/1985,5,17.4385,1985-10-05,1985,10
01/09/1985,5,15.2611,1985-09-05,1985,9
01/08/1985,5,17.7218,1985-08-05,1985,8
01/07/1985,5,20.3845,1985-07-05,1985,7
01/06/1985,5,32.3089,1985-06-05,1985,6
01/05/1985,5,29.609,1985-05-05,1985,5
01/04/1985,5,49.241,1985-04-05,1985,4
01/03/1985,5,68.9172,1985-03-05,1985,3
01/02/1985,5,76.8782,1985-02-05,1985,2
01/01/1985,5,23.5829,1985-01-05,1985,1
01/12/1984,5,30.7504,1984-12-05,1984,12
01/11/1984,5,11.1541,1984-11-05,1984,11
01/10/1984,5,14.7414,1984-10-05,1984,10
01/09/1984,5,15.2611,1984-09-05,1984,9
01/08/1984,5,16.059,1984-08-05,1984,8
01/07/1984,5,18.0076,1984-07-05,1984,7
01/06/1984,5,21.3173,1984-06-05,1984,6
01/05/1984,5,29.2338,1984-05-05,1984,5
01/04/1984,5,32.7051,1984-04-05,1984,4
01/03/1984,5,38.0966,1984-03-05,1984,3
01/02/1984,5,44.4081,1984-02-05,1984,2
01/01/1984,5,79.0746,1984-01-05,1984,1
01/12/1983,5,49.7393,1983-12-05,1983,12
01/11/1983,5,189.7583,1983-11-05,1983,11
01/10/1983,5,50.7441,1983-10-05,1983,10
01/09/1983,5,28.1238,1983-09-05,1983,9
01/08/1983,5,34.7257,1983-08-05,1983,8
01/07/1983,5,44.4081,1983-07-05,1983,7
01/06/1983,5,215.5051,1983-06-05,1983,6
01/05/1983,5,49.241,1983-05-05,1983,5
01/04/1983,5,58.9792,1983-04-05,1983,4
01/03/1983,5,81.8637,1983-03-05,1983,3
01/02/1983,5,128.9836,1983-02-05,1983,2
01/01/1983,5,107.9935,1983-01-05,1983,1
01/12/1982,5,51.7599,1982-12-05,1982,12
01/11/1982,5,21.3173,1982-11-05,1982,11
01/10/1982,5,18.296,1982-10-05,1982,10
01/09/1982,5,17.4385,1982-09-05,1982,9
01/08/1982,5,21.6333,1982-08-05,1982,8
01/07/1982,5,25.9738,1982-07-05,1982,7
01/06/1982,5,30.7504,1982-06-05,1982,6
01/05/1982,5,38.0966,1982-05-05,1982,5
01/04/1982,5,72.0494,1982-04-05,1982,4
01/03/1982,5,61.3912,1982-03-05,1982,3
01/02/1982,5,63.3556,1982-02-05,1982,2
01/01/1982,5,75.7916,1982-01-05,1982,1
01/12/1981,5,42.5509,1981-12-05,1981,12
01/11/1981,5,40.737,1981-11-05,1981,11
01/10/1981,5,16.33,1981-10-05,1981,10
01/09/1981,5,16.059,1981-09-05,1981,9
01/08/1981,5,17.7218,1981-08-05,1981,8
01/07/1981,5,21.0038,1981-07-05,1981,7
01/06/1981,5,25.2778,1981-06-05,1981,6
01/05/1981,5,32.3089,1981-05-05,1981,5
01/04/1981,5,41.1864,1981-04-05,1981,4
01/03/1981,5,99.6834,1981-03-05,1981,3
01/02/1981,5,54.3475,1981-02-05,1981,2
01/01/1981,5,79.6286,1981-01-05,1981,1
01/12/1980,5,102.8449,1980-12-05,1980,12
01/11/1980,5,11.8281,1980-11-05,1980,11
01/10/1980,5,13.7314,1980-10-05,1980,10
01/09/1980,5,16.059,1980-09-05,1980,9
01/08/1980,5,18.8801,1980-08-05,1980,8
01/07/1980,5,23.9167,1980-07-05,1980,7
01/06/1980,5,25.6245,1980-06-05,1980,6
01/05/1980,5,34.3163,1980-05-05,1980,5
01/04/1980,5,115.9237,1980-04-05,1980,4
01/03/1980,5,40.737,1980-03-05,1980,3
01/02/1980,5,73.6416,1980-02-05,1980,2
01/01/1980,5,57.5552,1980-01-05,1980,1
01/12/1979,5,80.1845,1979-12-05,1979,12
01/11/1979,5,31.9153,1979-11-05,1979,11
01/10/1979,5,26.6801,1979-10-05,1979,10
01/09/1979,5,17.7218,1979-09-05,1979,9
01/08/1979,5,17.4385,1979-08-05,1979,8
01/07/1979,5,18.5868,1979-07-05,1979,7
01/06/1979,5,22.5966,1979-06-05,1979,6
01/05/1979,5,27.3968,1979-05-05,1979,5
01/04/1979,5,44.8792,1979-04-05,1979,4
01/03/1979,5,49.7393,1979-03-05,1979,3
01/02/1979,5,88.7545,1979-02-05,1979,2
01/01/1979,5,61.3912,1979-01-05,1979,1
01/12/1978,5,21.9519,1978-12-05,1978,12
01/11/1978,5,27.759,1978-11-05,1978,11
01/10/1978,5,9.8705,1978-10-05,1978,10
01/09/1978,5,12.9995,1978-09-05,1978,9
01/08/1978,5,14.4852,1978-08-05,1978,8
01/07/1978,5,16.059,1978-07-05,1978,7
01/06/1978,5,20.3845,1978-06-05,1978,6
01/05/1978,5,20.6929,1978-05-05,1978,5
01/04/1978,5,25.6245,1978-04-05,1978,4
01/03/1978,5,119.3008,1978-03-05,1978,3
01/02/1978,5,31.9153,1978-02-05,1978,2
01/01/1978,5,25.2778,1978-01-05,1978,1
01/12/1977,5,44.4081,1977-12-05,1977,12
01/11/1977,5,13.241,1977-11-05,1977,11
01/10/1977,5,16.33,1977-10-05,1977,10
01/09/1977,5,18.296,1977-09-05,1977,9
01/08/1977,5,13.7314,1977-08-05,1977,8
01/07/1977,5,16.6034,1977-07-05,1977,7
01/06/1977,5,20.6929,1977-06-05,1977,6
01/05/1977,5,25.6245,1977-05-05,1977,5
01/04/1977,5,47.2752,1977-04-05,1977,4
01/03/1977,5,44.8792,1977-03-05,1977,3
01/02/1977,5,82.4273,1977-02-05,1977,2
01/01/1977,5,45.8294,1977-01-05,1977,1
01/12/1976,5,134.6658,1976-12-05,1976,12
01/11/1976,5,24.9337,1976-11-05,1976,11
01/10/1976,5,20.3845,1976-10-05,1976,10
01/09/1976,5,15.7906,1976-09-05,1976,9
01/08/1976,5,15.5246,1976-08-05,1976,8
01/07/1976,5,38.966,1976-07-05,1976,7
01/06/1976,5,20.3845,1976-06-05,1976,6
01/05/1976,5,20.6929,1976-05-05,1976,5
01/04/1976,5,25.2778,1976-04-05,1976,4
01/03/1976,5,28.8612,1976-03-05,1976,3
01/02/1976,5,47.2752,1976-02-05,1976,2
01/01/1976,5,59.4578,1976-01-05,1976,1
01/12/1975,5,32.7051,1975-12-05,1975,12
01/11/1975,5,13.7314,1975-11-05,1975,11
01/10/1975,5,12.5237,1975-10-05,1975,10
01/09/1975,5,10.0785,1975-09-05,1975,9
01/08/1975,5,12.2894,1975-08-05,1975,8
01/07/1975,5,17.4385,1975-07-05,1975,7
01/06/1975,5,15.7906,1975-06-05,1975,6
01/05/1975,5,19.7752,1975-05-05,1975,5
01/04/1975,5,28.4912,1975-04-05,1975,4
01/03/1975,5,72.0494,1975-03-05,1975,3
01/02/1975,5,46.7905,1975-02-05,1975,2
01/01/1975,5,91.7079,1975-01-05,1975,1
01/12/1974,5,11.8281,1974-12-05,1974,12
01/11/1974,5,13.9802,1974-11-05,1974,11
01/10/1974,5,12.2894,1974-10-05,1974,10
01/09/1974,5,8.8786,1974-09-05,1974,9
01/08/1974,5,12.0181,1974-08-05,1974,8
01/07/1974,5,18.1583,1974-07-05,1974,7
01/06/1974,5,23.2997,1974-06-05,1974,6
01/05/1974,5,24.8206,1974-05-05,1974,5
01/04/1974,5,42.4107,1974-04-05,1974,4
01/03/1974,5,28.7157,1974-03-05,1974,3
01/02/1974,5,44.1499,1974-02-05,1974,2
01/01/1974,5,42.844,1974-01-05,1974,1
01/12/1973,5,46.7882,1973-12-05,1973,12
01/11/1973,5,30.7107,1973-11-05,1973,11
01/10/1973,5,6.5357,1973-10-05,1973,10
01/09/1973,5,9.1826,1973-09-05,1973,9
01/08/1973,5,15.0162,1973-08-05,1973,8
01/07/1973,5,15.3585,1973-07-05,1973,7
01/06/1973,5,15.0162,1973-06-05,1973,6
01/05/1973,5,19.2351,1973-05-05,1973,5
01/04/1973,5,44.5872,1973-04-05,1973,4
01/03/1973,5,27.1422,1973-03-05,1973,3
01/02/1973,5,69.54,1973-02-05,1973,2
01/01/1973,5,48.5662,1973-01-05,1973,1
01/12/1972,5,49.0131,1972-12-05,1972,12
01/11/1972,5,32.7357,1972-11-05,1972,11
01/10/1972,5,45.0254,1972-10-05,1972,10
01/09/1972,5,10.7365,1972-09-05,1972,9
01/08/1972,5,11.6946,1972-08-05,1972,8
01/07/1972,5,10.7365,1972-07-05,1972,7
01/06/1972,5,14.6757,1972-06-05,1972,6
01/05/1972,5,18.8746,1972-05-05,1972,5
01/04/1972,5,33.5539,1972-04-05,1972,4
01/03/1972,5,53.9891,1972-03-05,1972,3
01/02/1972,5,81.8872,1972-02-05,1972,2
01/01/1972,5,30.3092,1972-01-05,1972,1
01/12/1971,5,42.844,1971-12-05,1971,12
01/11/1971,5,27.5336,1971-11-05,1971,11
01/10/1971,5,13.3317,1971-10-05,1971,10
01/09/1971,5,1.9933,1971-09-05,1971,9
01/08/1971,5,3.8644,1971-08-05,1971,8
01/07/1971,5,6.2548,1971-07-05,1971,7
01/06/1971,5,3.8644,1971-06-05,1971,6
01/05/1971,5,5.4294,1971-05-05,1971,5
01/04/1971,5,8.8786,1971-04-05,1971,4
01/03/1971,5,5.7016,1971-03-05,1971,3
01/02/1971,5,7.6867,1971-02-05,1971,2
01/01/1971,5,25.2042,1971-01-05,1971,1
01/12/1970,5,13.3317,1970-12-05,1970,12
01/11/1970,5,10.1083,1970-11-05,1970,11
01/10/1970,5,15.7026,1970-10-05,1970,10
01/09/1970,5,11.0537,1970-09-05,1970,9
01/08/1970,5,8.8786,1970-08-05,1970,8
01/07/1970,5,10.7365,1970-07-05,1970,7
01/06/1970,5,11.6946,1970-06-05,1970,6
01/05/1970,5,17.0959,1970-05-05,1970,5
01/04/1970,5,38.5572,1970-04-05,1970,4
01/03/1970,5,28.7157,1970-03-05,1970,3
01/02/1970,5,31.9221,1970-02-05,1970,2
01/01/1970,5,34.3766,1970-01-05,1970,1
01/12/1969,5,22.1737,1969-12-05,1969,12
01/11/1969,5,24.8206,1969-11-05,1969,11
01/10/1969,5,13.0004,1969-10-05,1969,10
01/09/1969,5,6.5357,1969-09-05,1969,9
01/08/1969,5,18.1583,1969-08-05,1969,8
01/07/1969,5,11.3731,1969-07-05,1969,7
01/06/1969,5,16.3958,1969-06-05,1969,6
01/05/1969,5,16.745,1969-05-05,1969,5
01/04/1969,5,23.6779,1969-04-05,1969,4
01/03/1969,5,65.6887,1969-03-05,1969,3
01/02/1969,5,33.9647,1969-02-05,1969,2
01/01/1969,5,13.6649,1969-01-05,1969,1
01/12/1968,5,148.5918,1968-12-05,1968,12
01/11/1968,5,10.1083,1968-11-05,1968,11
01/10/1968,5,7.1059,1968-10-05,1968,10
01/09/1968,5,28.3204,1968-09-05,1968,9
01/08/1968,5,9.1826,1968-08-05,1968,8
01/07/1968,5,9.7975,1968-07-05,1968,7
01/06/1968,5,12.671,1968-06-05,1968,6
01/05/1968,5,16.0483,1968-05-05,1968,5
01/04/1968,5,22.1737,1968-04-05,1968,4
01/03/1968,5,32.3283,1968-03-05,1968,3
01/02/1968,5,24.4383,1968-02-05,1968,2
01/01/1968,5,56.2867,1968-01-05,1968,1
01/12/1967,5,31.9221,1967-12-05,1967,12
01/11/1967,5,24.8206,1967-11-05,1967,11
01/10/1967,5,9.1826,1967-10-05,1967,10
01/09/1967,5,12.3436,1967-09-05,1967,9
01/08/1967,5,16.3958,1967-08-05,1967,8
01/07/1967,5,20.6925,1967-07-05,1967,7
01/06/1967,5,23.6779,1967-06-05,1967,6
01/05/1967,5,34.3766,1967-05-05,1967,5
01/04/1967,5,41.1169,1967-04-05,1967,4
01/03/1967,5,42.844,1967-03-05,1967,3
01/02/1967,5,150.8457,1967-02-05,1967,2
01/01/1967,5,67.127,1967-01-05,1967,1
01/12/1966,5,26.752,1966-12-05,1966,12
01/11/1966,5,45.0254,1966-11-05,1966,11
01/10/1966,5,13.3317,1966-10-05,1966,10
01/09/1966,5,14.3369,1966-09-05,1966,9
01/08/1966,5,19.5972,1966-08-05,1966,8
01/07/1966,5,21.0606,1966-07-05,1966,7
